Value Set Name,Value Set OID,Value Set Version,Code,Definition,Code System,Code System OID,Code System Version
Diagnostic Radiology,2.16.840.1.113883.3.464.1004.1081,2025-03-31,241165002,Single contrast barium enema (procedure),SNOMED CT US Edition,2.16.840.1.113883.6.96,2024.09.24AA
Diagnostic Radiology,2.16.840.1.113883.3.464.1004.1081,2025-03-31,241166001,Distal loop enema (procedure),SNOMED CT US Edition,2.16.840.1.113883.6.96,2024.09.24AA
Diagnostic Radiology,2.16.840.1.113883.3.464.1004.1081,2025-03-31,241167005,Instant barium enema (procedure),SNOMED CT US Edition,2.16.840.1.113883.6.96,2024.09.24AA
Diagnostic Radiology,2.16.840.1.113883.3.464.1004.1081,2025-03-31,241168000,Water soluble contrast enema (procedure),SNOMED CT US Edition,2.16.840.1.113883.6.96,2024.09.24AA
Diagnostic Radiology,2.16.840.1.113883.3.464.1004.1081,2025-03-31,241169008,Proctogram (procedure),SNOMED CT US Edition,2.16.840.1.113883.6.96,2024.09.24AA
Diagnostic Radiology,2.16.840.1.113883.3.464.1004.1081,2025-03-31,241170009,Defecating proctogram (procedure),SNOMED CT US Edition,2.16.840.1.113883.6.96,2024.09.24AA
Diagnostic Radiology,2.16.840.1.113883.3.464.1004.1081,2025-03-31,241171008,Gastrointestinal tract loopogram (procedure),SNOMED CT US Edition,2.16.840.1.113883.6.96,2024.09.24AA
Diagnostic Radiology,2.16.840.1.113883.3.464.1004.1081,2025-03-31,241172001,Pouchogram (procedure),SNOMED CT US Edition,2.16.840.1.113883.6.96,2024.09.24AA
Diagnostic Radiology,2.16.840.1.113883.3.464.1004.1081,2025-03-31,241175004,Cholecystography (procedure),SNOMED CT US Edition,2.16.840.1.113883.6.96,2024.09.24AA
Diagnostic Radiology,2.16.840.1.113883.3.464.1004.1081,2025-03-31,241176003,Catheter cholecystogram (procedure),SNOMED CT US Edition,2.16.840.1.113883.6.96,2024.09.24AA
Diagnostic Radiology,2.16.840.1.113883.3.464.1004.1081,2025-03-31,241177007,Percutaneous cholecystogram (procedure),SNOMED CT US Edition,2.16.840.1.113883.6.96,2024.09.24AA
Diagnostic Radiology,2.16.840.1.113883.3.464.1004.1081,2025-03-31,241178002,U tube cholangiography (procedure),SNOMED CT US Edition,2.16.840.1.113883.6.96,2024.09.24AA
Diagnostic Radiology,2.16.840.1.113883.3.464.1004.1081,2025-03-31,241179005,Catheter cholangiogram (procedure),SNOMED CT US Edition,2.16.840.1.113883.6.96,2024.09.24AA
Diagnostic Radiology,2.16.840.1.113883.3.464.1004.1081,2025-03-31,241180008,Percutaneous hepatography (procedure),SNOMED CT US Edition,2.16.840.1.113883.6.96,2024.09.24AA
Diagnostic Radiology,2.16.840.1.113883.3.464.1004.1081,2025-03-31,241181007,Percutaneous cyst puncture and cystogram (procedure),SNOMED CT US Edition,2.16.840.1.113883.6.96,2024.09.24AA
Diagnostic Radiology,2.16.840.1.113883.3.464.1004.1081,2025-03-31,241184004,Stress cystogram (procedure),SNOMED CT US Edition,2.16.840.1.113883.6.96,2024.09.24AA
Diagnostic Radiology,2.16.840.1.113883.3.464.1004.1081,2025-03-31,241185003,Retrograde ileoureterostogram (procedure),SNOMED CT US Edition,2.16.840.1.113883.6.96,2024.09.24AA
Diagnostic Radiology,2.16.840.1.113883.3.464.1004.1081,2025-03-31,241186002,Gynecogram (procedure),SNOMED CT US Edition,2.16.840.1.113883.6.96,2024.09.24AA
Diagnostic Radiology,2.16.840.1.113883.3.464.1004.1081,2025-03-31,241190000,Breast pneumocystogram (procedure),SNOMED CT US Edition,2.16.840.1.113883.6.96,2024.09.24AA
Diagnostic Radiology,2.16.840.1.113883.3.464.1004.1081,2025-03-31,241193003,Scoliosis myelogram (procedure),SNOMED CT US Edition,2.16.840.1.113883.6.96,2024.09.24AA
Diagnostic Radiology,2.16.840.1.113883.3.464.1004.1081,2025-03-31,241194009,Air myelogram (procedure),SNOMED CT US Edition,2.16.840.1.113883.6.96,2024.09.24AA
Diagnostic Radiology,2.16.840.1.113883.3.464.1004.1081,2025-03-31,241195005,Epidurogram (procedure),SNOMED CT US Edition,2.16.840.1.113883.6.96,2024.09.24AA
Diagnostic Radiology,2.16.840.1.113883.3.464.1004.1081,2025-03-31,241205006,Interphalangeal joint arthrogram (procedure),SNOMED CT US Edition,2.16.840.1.113883.6.96,2024.09.24AA
Diagnostic Radiology,2.16.840.1.113883.3.464.1004.1081,2025-03-31,241209000,Sinogram with contrast (procedure),SNOMED CT US Edition,2.16.840.1.113883.6.96,2024.09.24AA
Diagnostic Radiology,2.16.840.1.113883.3.464.1004.1081,2025-03-31,241210005,Pneumocystogram (procedure),SNOMED CT US Edition,2.16.840.1.113883.6.96,2024.09.24AA
Diagnostic Radiology,2.16.840.1.113883.3.464.1004.1081,2025-03-31,241213007,Cardiac shunt study (procedure),SNOMED CT US Edition,2.16.840.1.113883.6.96,2024.09.24AA
Diagnostic Radiology,2.16.840.1.113883.3.464.1004.1081,2025-03-31,241221001,Intravenous digital subtraction angiography of cervicocerebral arteries (procedure),SNOMED CT US Edition,2.16.840.1.113883.6.96,2024.09.24AA
Diagnostic Radiology,2.16.840.1.113883.3.464.1004.1081,2025-03-31,241275007,Vascular fistulography with contrast (procedure),SNOMED CT US Edition,2.16.840.1.113883.6.96,2024.09.24AA
Diagnostic Radiology,2.16.840.1.113883.3.464.1004.1081,2025-03-31,241283001,Skull isotope studies (procedure),SNOMED CT US Edition,2.16.840.1.113883.6.96,2024.09.24AA
Diagnostic Radiology,2.16.840.1.113883.3.464.1004.1081,2025-03-31,241286009,Radionuclide brain study first pass (procedure),SNOMED CT US Edition,2.16.840.1.113883.6.96,2024.09.24AA
Diagnostic Radiology,2.16.840.1.113883.3.464.1004.1081,2025-03-31,241290006,Radionuclide study of neural receptors (procedure),SNOMED CT US Edition,2.16.840.1.113883.6.96,2024.09.24AA
Diagnostic Radiology,2.16.840.1.113883.3.464.1004.1081,2025-03-31,241291005,Radionuclide brain study with inhaled gases (procedure),SNOMED CT US Edition,2.16.840.1.113883.6.96,2024.09.24AA
Diagnostic Radiology,2.16.840.1.113883.3.464.1004.1081,2025-03-31,241292003,Radionuclide ophthalmology study (procedure),SNOMED CT US Edition,2.16.840.1.113883.6.96,2024.09.24AA
Diagnostic Radiology,2.16.840.1.113883.3.464.1004.1081,2025-03-31,241293008,Radionuclide study of lung (procedure),SNOMED CT US Edition,2.16.840.1.113883.6.96,2024.09.24AA
Diagnostic Radiology,2.16.840.1.113883.3.464.1004.1081,2025-03-31,241294002,Lung perfusion study with Tc99m-albumin (procedure),SNOMED CT US Edition,2.16.840.1.113883.6.96,2024.09.24AA
Diagnostic Radiology,2.16.840.1.113883.3.464.1004.1081,2025-03-31,241295001,Lung perfusion study with Krypton 81m (procedure),SNOMED CT US Edition,2.16.840.1.113883.6.96,2024.09.24AA
Diagnostic Radiology,2.16.840.1.113883.3.464.1004.1081,2025-03-31,241297009,Xenon ventilation study (procedure),SNOMED CT US Edition,2.16.840.1.113883.6.96,2024.09.24AA
Diagnostic Radiology,2.16.840.1.113883.3.464.1004.1081,2025-03-31,241298004,Xenon-133 ventilation study (procedure),SNOMED CT US Edition,2.16.840.1.113883.6.96,2024.09.24AA
Diagnostic Radiology,2.16.840.1.113883.3.464.1004.1081,2025-03-31,241299007,Xenon-127 ventilation study (procedure),SNOMED CT US Edition,2.16.840.1.113883.6.96,2024.09.24AA
Diagnostic Radiology,2.16.840.1.113883.3.464.1004.1081,2025-03-31,241302007,Diethylenetriaminepentaacetate aerosol ventilation study (procedure),SNOMED CT US Edition,2.16.840.1.113883.6.96,2024.09.24AA
Diagnostic Radiology,2.16.840.1.113883.3.464.1004.1081,2025-03-31,241303002,Radionuclide mucociliary clearance study (procedure),SNOMED CT US Edition,2.16.840.1.113883.6.96,2024.09.24AA
Diagnostic Radiology,2.16.840.1.113883.3.464.1004.1081,2025-03-31,241304008,Radionuclide lung permeability study (procedure),SNOMED CT US Edition,2.16.840.1.113883.6.96,2024.09.24AA
Diagnostic Radiology,2.16.840.1.113883.3.464.1004.1081,2025-03-31,241305009,Radionuclide venogram (procedure),SNOMED CT US Edition,2.16.840.1.113883.6.96,2024.09.24AA
Diagnostic Radiology,2.16.840.1.113883.3.464.1004.1081,2025-03-31,241306005,Radionuclide venous first pass study (procedure),SNOMED CT US Edition,2.16.840.1.113883.6.96,2024.09.24AA
Diagnostic Radiology,2.16.840.1.113883.3.464.1004.1081,2025-03-31,241307001,Radionuclide thrombus localization study (procedure),SNOMED CT US Edition,2.16.840.1.113883.6.96,2024.09.24AA
Diagnostic Radiology,2.16.840.1.113883.3.464.1004.1081,2025-03-31,241310008,Radionuclide thrombus-specific peptide study (procedure),SNOMED CT US Edition,2.16.840.1.113883.6.96,2024.09.24AA
Diagnostic Radiology,2.16.840.1.113883.3.464.1004.1081,2025-03-31,241311007,Radionuclide venous blood pool study (procedure),SNOMED CT US Edition,2.16.840.1.113883.6.96,2024.09.24AA
Diagnostic Radiology,2.16.840.1.113883.3.464.1004.1081,2025-03-31,241312000,Radionuclide angiography of artery using radioactive isotope (procedure),SNOMED CT US Edition,2.16.840.1.113883.6.96,2024.09.24AA
Diagnostic Radiology,2.16.840.1.113883.3.464.1004.1081,2025-03-31,241313005,Radionuclide soft tissue blood pool study - early and delayed (procedure),SNOMED CT US Edition,2.16.840.1.113883.6.96,2024.09.24AA
Diagnostic Radiology,2.16.840.1.113883.3.464.1004.1081,2025-03-31,241316002,Radionuclide gastric emptying study (procedure),SNOMED CT US Edition,2.16.840.1.113883.6.96,2024.09.24AA
Diagnostic Radiology,2.16.840.1.113883.3.464.1004.1081,2025-03-31,241317006,Radionuclide dual phase gastric emptying study (procedure),SNOMED CT US Edition,2.16.840.1.113883.6.96,2024.09.24AA
Diagnostic Radiology,2.16.840.1.113883.3.464.1004.1081,2025-03-31,241321004,Radionuclide esophageal study (procedure),SNOMED CT US Edition,2.16.840.1.113883.6.96,2024.09.24AA
Diagnostic Radiology,2.16.840.1.113883.3.464.1004.1081,2025-03-31,241322006,Radionuclide study for esophageal transit time (procedure),SNOMED CT US Edition,2.16.840.1.113883.6.96,2024.09.24AA
Diagnostic Radiology,2.16.840.1.113883.3.464.1004.1081,2025-03-31,241323001,Study of esophageal transit using radiolabeled fluid (procedure),SNOMED CT US Edition,2.16.840.1.113883.6.96,2024.09.24AA
Diagnostic Radiology,2.16.840.1.113883.3.464.1004.1081,2025-03-31,241324007,Study of esophageal transit using radiolabeled solid (procedure),SNOMED CT US Edition,2.16.840.1.113883.6.96,2024.09.24AA
Diagnostic Radiology,2.16.840.1.113883.3.464.1004.1081,2025-03-31,241325008,Study of esophageal transit using both radiolabeled fluid and solid (procedure),SNOMED CT US Edition,2.16.840.1.113883.6.96,2024.09.24AA
Diagnostic Radiology,2.16.840.1.113883.3.464.1004.1081,2025-03-31,241328005,Radionuclide gastroesophageal reflux study (procedure),SNOMED CT US Edition,2.16.840.1.113883.6.96,2024.09.24AA
Diagnostic Radiology,2.16.840.1.113883.3.464.1004.1081,2025-03-31,241329002,Radionuclide study of esophageal reflux of gastric contents (procedure),SNOMED CT US Edition,2.16.840.1.113883.6.96,2024.09.24AA
Diagnostic Radiology,2.16.840.1.113883.3.464.1004.1081,2025-03-31,241330007,Radionuclide study of esophageal reflux of bile (procedure),SNOMED CT US Edition,2.16.840.1.113883.6.96,2024.09.24AA
Diagnostic Radiology,2.16.840.1.113883.3.464.1004.1081,2025-03-31,241331006,Radionuclide duodenogastric reflux study (procedure),SNOMED CT US Edition,2.16.840.1.113883.6.96,2024.09.24AA
Diagnostic Radiology,2.16.840.1.113883.3.464.1004.1081,2025-03-31,241332004,Radionuclide stomach-lung reflux study (procedure),SNOMED CT US Edition,2.16.840.1.113883.6.96,2024.09.24AA
Diagnostic Radiology,2.16.840.1.113883.3.464.1004.1081,2025-03-31,241333009,Measuring permeability of small intestine using radiolabeled serum proteins (procedure),SNOMED CT US Edition,2.16.840.1.113883.6.96,2024.09.24AA
Diagnostic Radiology,2.16.840.1.113883.3.464.1004.1081,2025-03-31,241334003,Measuring permeability of small intestine using radiolabeled macromolecules (procedure),SNOMED CT US Edition,2.16.840.1.113883.6.96,2024.09.24AA
Diagnostic Radiology,2.16.840.1.113883.3.464.1004.1081,2025-03-31,241335002,Radionuclide large intestine study (procedure),SNOMED CT US Edition,2.16.840.1.113883.6.96,2024.09.24AA
Diagnostic Radiology,2.16.840.1.113883.3.464.1004.1081,2025-03-31,241336001,Radionuclide study for colonic transit (procedure),SNOMED CT US Edition,2.16.840.1.113883.6.96,2024.09.24AA
Diagnostic Radiology,2.16.840.1.113883.3.464.1004.1081,2025-03-31,241337005,Radionuclide study for rectal transit (procedure),SNOMED CT US Edition,2.16.840.1.113883.6.96,2024.09.24AA
Diagnostic Radiology,2.16.840.1.113883.3.464.1004.1081,2025-03-31,241341009,"Radionuclide study of liver, spleen and biliary tract (procedure)",SNOMED CT US Edition,2.16.840.1.113883.6.96,2024.09.24AA
Diagnostic Radiology,2.16.840.1.113883.3.464.1004.1081,2025-03-31,241343007,Tc99m-IDA derivative study (procedure),SNOMED CT US Edition,2.16.840.1.113883.6.96,2024.09.24AA
Diagnostic Radiology,2.16.840.1.113883.3.464.1004.1081,2025-03-31,241344001,Radiolabeled sulfobromophthalein study (procedure),SNOMED CT US Edition,2.16.840.1.113883.6.96,2024.09.24AA
Diagnostic Radiology,2.16.840.1.113883.3.464.1004.1081,2025-03-31,241347008,Radionuclide first pass liver study (procedure),SNOMED CT US Edition,2.16.840.1.113883.6.96,2024.09.24AA
Diagnostic Radiology,2.16.840.1.113883.3.464.1004.1081,2025-03-31,241348003,Radionuclide imaging of liver using technetium (99m-Tc) with hepatic perfusion index (procedure),SNOMED CT US Edition,2.16.840.1.113883.6.96,2024.09.24AA
Diagnostic Radiology,2.16.840.1.113883.3.464.1004.1081,2025-03-31,241349006,Radionuclide first pass spleen study (procedure),SNOMED CT US Edition,2.16.840.1.113883.6.96,2024.09.24AA
Diagnostic Radiology,2.16.840.1.113883.3.464.1004.1081,2025-03-31,241351005,Radionuclide estimation of spleen size (procedure),SNOMED CT US Edition,2.16.840.1.113883.6.96,2024.09.24AA
Diagnostic Radiology,2.16.840.1.113883.3.464.1004.1081,2025-03-31,241354002,Renal isotope studies (procedure),SNOMED CT US Edition,2.16.840.1.113883.6.96,2024.09.24AA
Diagnostic Radiology,2.16.840.1.113883.3.464.1004.1081,2025-03-31,241355001,Placenta isotope study (procedure),SNOMED CT US Edition,2.16.840.1.113883.6.96,2024.09.24AA
Diagnostic Radiology,2.16.840.1.113883.3.464.1004.1081,2025-03-31,241357009,Radionuclide static renal study (procedure),SNOMED CT US Edition,2.16.840.1.113883.6.96,2024.09.24AA
Diagnostic Radiology,2.16.840.1.113883.3.464.1004.1081,2025-03-31,241362005,Radionuclide imaging of kidney using technetium (99m-Tc) tiatide (procedure),SNOMED CT US Edition,2.16.840.1.113883.6.96,2024.09.24AA
Diagnostic Radiology,2.16.840.1.113883.3.464.1004.1081,2025-03-31,241363000,Radionuclide micturating cystogram (procedure),SNOMED CT US Edition,2.16.840.1.113883.6.96,2024.09.24AA
Diagnostic Radiology,2.16.840.1.113883.3.464.1004.1081,2025-03-31,241364006,Radionuclide indirect micturating cystogram (procedure),SNOMED CT US Edition,2.16.840.1.113883.6.96,2024.09.24AA
Diagnostic Radiology,2.16.840.1.113883.3.464.1004.1081,2025-03-31,241366008,Radionuclide direct micturating cystogram (procedure),SNOMED CT US Edition,2.16.840.1.113883.6.96,2024.09.24AA
Diagnostic Radiology,2.16.840.1.113883.3.464.1004.1081,2025-03-31,241367004,Radionuclide hysterosalpingography (procedure),SNOMED CT US Edition,2.16.840.1.113883.6.96,2024.09.24AA
Diagnostic Radiology,2.16.840.1.113883.3.464.1004.1081,2025-03-31,241368009,Radionuclide study of scrotum (procedure),SNOMED CT US Edition,2.16.840.1.113883.6.96,2024.09.24AA
Diagnostic Radiology,2.16.840.1.113883.3.464.1004.1081,2025-03-31,241369001,Radionuclide study of phallic blood flow (procedure),SNOMED CT US Edition,2.16.840.1.113883.6.96,2024.09.24AA
Diagnostic Radiology,2.16.840.1.113883.3.464.1004.1081,2025-03-31,241371001,Probe renogram (procedure),SNOMED CT US Edition,2.16.840.1.113883.6.96,2024.09.24AA
Diagnostic Radiology,2.16.840.1.113883.3.464.1004.1081,2025-03-31,241372008,Effective renal plasma flow determination (procedure),SNOMED CT US Edition,2.16.840.1.113883.6.96,2024.09.24AA
Diagnostic Radiology,2.16.840.1.113883.3.464.1004.1081,2025-03-31,241373003,Technetium-99m-diethylenetriamine pentaacetic acid clearance - glomerular filtration rate (procedure),SNOMED CT US Edition,2.16.840.1.113883.6.96,2024.09.24AA
Diagnostic Radiology,2.16.840.1.113883.3.464.1004.1081,2025-03-31,241387003,Whole body radioiodine I123 study (procedure),SNOMED CT US Edition,2.16.840.1.113883.6.96,2024.09.24AA
Diagnostic Radiology,2.16.840.1.113883.3.464.1004.1081,2025-03-31,241389000,Radionuclide parathyroid subtraction study (procedure),SNOMED CT US Edition,2.16.840.1.113883.6.96,2024.09.24AA
Diagnostic Radiology,2.16.840.1.113883.3.464.1004.1081,2025-03-31,241390009,Thallium 201 parathyroid study (procedure),SNOMED CT US Edition,2.16.840.1.113883.6.96,2024.09.24AA
Diagnostic Radiology,2.16.840.1.113883.3.464.1004.1081,2025-03-31,241391008,Tc99m-methoxyisobutyl isonitrile parathyroid study (procedure),SNOMED CT US Edition,2.16.840.1.113883.6.96,2024.09.24AA
Diagnostic Radiology,2.16.840.1.113883.3.464.1004.1081,2025-03-31,241392001,Triple radionuclide parathyroid study (procedure),SNOMED CT US Edition,2.16.840.1.113883.6.96,2024.09.24AA
Diagnostic Radiology,2.16.840.1.113883.3.464.1004.1081,2025-03-31,241393006,Radionuclide adrenal cortex study (procedure),SNOMED CT US Edition,2.16.840.1.113883.6.96,2024.09.24AA
Diagnostic Radiology,2.16.840.1.113883.3.464.1004.1081,2025-03-31,241394000,Radionuclide adrenal study with Scintadren only (procedure),SNOMED CT US Edition,2.16.840.1.113883.6.96,2024.09.24AA
Diagnostic Radiology,2.16.840.1.113883.3.464.1004.1081,2025-03-31,241395004,Radionuclide adrenal study with kidney localization (procedure),SNOMED CT US Edition,2.16.840.1.113883.6.96,2024.09.24AA
Diagnostic Radiology,2.16.840.1.113883.3.464.1004.1081,2025-03-31,241401004,Radionuclide bone study first pass (procedure),SNOMED CT US Edition,2.16.840.1.113883.6.96,2024.09.24AA
Diagnostic Radiology,2.16.840.1.113883.3.464.1004.1081,2025-03-31,241403001,Delayed phase radionuclide bone study (procedure),SNOMED CT US Edition,2.16.840.1.113883.6.96,2024.09.24AA
Diagnostic Radiology,2.16.840.1.113883.3.464.1004.1081,2025-03-31,241404007,Radionuclide two-phase bone study (procedure),SNOMED CT US Edition,2.16.840.1.113883.6.96,2024.09.24AA
Diagnostic Radiology,2.16.840.1.113883.3.464.1004.1081,2025-03-31,241405008,Radionuclide three-phase bone study (procedure),SNOMED CT US Edition,2.16.840.1.113883.6.96,2024.09.24AA
Diagnostic Radiology,2.16.840.1.113883.3.464.1004.1081,2025-03-31,241406009,Radionuclide study for quantitation of sacroiliac uptake (procedure),SNOMED CT US Edition,2.16.840.1.113883.6.96,2024.09.24AA
Diagnostic Radiology,2.16.840.1.113883.3.464.1004.1081,2025-03-31,241410007,Indium-111 granulocyte study (procedure),SNOMED CT US Edition,2.16.840.1.113883.6.96,2024.09.24AA
Diagnostic Radiology,2.16.840.1.113883.3.464.1004.1081,2025-03-31,241411006,Tc99m mixed leukocyte study (procedure),SNOMED CT US Edition,2.16.840.1.113883.6.96,2024.09.24AA
Diagnostic Radiology,2.16.840.1.113883.3.464.1004.1081,2025-03-31,241412004,Tc99m granulocyte (phagocytosis) study (procedure),SNOMED CT US Edition,2.16.840.1.113883.6.96,2024.09.24AA
Diagnostic Radiology,2.16.840.1.113883.3.464.1004.1081,2025-03-31,241433008,Iron absorption measurement (procedure),SNOMED CT US Edition,2.16.840.1.113883.6.96,2024.09.24AA
Diagnostic Radiology,2.16.840.1.113883.3.464.1004.1081,2025-03-31,241439007,Positron emission tomography heart study (procedure),SNOMED CT US Edition,2.16.840.1.113883.6.96,2024.09.24AA
Diagnostic Radiology,2.16.840.1.113883.3.464.1004.1081,2025-03-31,241440009,Positron emission tomography myocardial glucose metabolism study (procedure),SNOMED CT US Edition,2.16.840.1.113883.6.96,2024.09.24AA
Diagnostic Radiology,2.16.840.1.113883.3.464.1004.1081,2025-03-31,241441008,Positron emission tomography myocardial rest study using N13 ammonia (procedure),SNOMED CT US Edition,2.16.840.1.113883.6.96,2024.09.24AA
Diagnostic Radiology,2.16.840.1.113883.3.464.1004.1081,2025-03-31,241442001,Positron emission tomography myocardial stress study using N13 ammonia (procedure),SNOMED CT US Edition,2.16.840.1.113883.6.96,2024.09.24AA
Diagnostic Radiology,2.16.840.1.113883.3.464.1004.1081,2025-03-31,241443006,Positron emission tomography study for localization of tumor (procedure),SNOMED CT US Edition,2.16.840.1.113883.6.96,2024.09.24AA
Diagnostic Radiology,2.16.840.1.113883.3.464.1004.1081,2025-03-31,241444000,Positron emission tomography study for tumor uptake of glucose (procedure),SNOMED CT US Edition,2.16.840.1.113883.6.96,2024.09.24AA
Diagnostic Radiology,2.16.840.1.113883.3.464.1004.1081,2025-03-31,241445004,Positron emission tomography study for tumor uptake of methionine (procedure),SNOMED CT US Edition,2.16.840.1.113883.6.96,2024.09.24AA
Diagnostic Radiology,2.16.840.1.113883.3.464.1004.1081,2025-03-31,241452002,Orbital B scan (procedure),SNOMED CT US Edition,2.16.840.1.113883.6.96,2024.09.24AA
Diagnostic Radiology,2.16.840.1.113883.3.464.1004.1081,2025-03-31,241489004,Hysterosalpingo contrast sonography (procedure),SNOMED CT US Edition,2.16.840.1.113883.6.96,2024.09.24AA
Diagnostic Radiology,2.16.840.1.113883.3.464.1004.1081,2025-03-31,241499009,Ultrasonography of wrist (procedure),SNOMED CT US Edition,2.16.840.1.113883.6.96,2024.09.24AA
Diagnostic Radiology,2.16.840.1.113883.3.464.1004.1081,2025-03-31,241500000,Ultrasonography of finger (procedure),SNOMED CT US Edition,2.16.840.1.113883.6.96,2024.09.24AA
Diagnostic Radiology,2.16.840.1.113883.3.464.1004.1081,2025-03-31,241504009,Ultrasonography of knee (procedure),SNOMED CT US Edition,2.16.840.1.113883.6.96,2024.09.24AA
Diagnostic Radiology,2.16.840.1.113883.3.464.1004.1081,2025-03-31,241505005,Ultrasonography of ankle (procedure),SNOMED CT US Edition,2.16.840.1.113883.6.96,2024.09.24AA
Diagnostic Radiology,2.16.840.1.113883.3.464.1004.1081,2025-03-31,241512001,Ultrasonography of Achilles tendon (procedure),SNOMED CT US Edition,2.16.840.1.113883.6.96,2024.09.24AA
Diagnostic Radiology,2.16.840.1.113883.3.464.1004.1081,2025-03-31,241518002,Computed tomography of posterior fossa (procedure),SNOMED CT US Edition,2.16.840.1.113883.6.96,2024.09.24AA
Diagnostic Radiology,2.16.840.1.113883.3.464.1004.1081,2025-03-31,241519005,Computed tomography of pituitary fossa (procedure),SNOMED CT US Edition,2.16.840.1.113883.6.96,2024.09.24AA
Diagnostic Radiology,2.16.840.1.113883.3.464.1004.1081,2025-03-31,241521000,Computed tomography of internal auditory meatus (procedure),SNOMED CT US Edition,2.16.840.1.113883.6.96,2024.09.24AA
Diagnostic Radiology,2.16.840.1.113883.3.464.1004.1081,2025-03-31,241522007,Computed tomography of petrous bones (procedure),SNOMED CT US Edition,2.16.840.1.113883.6.96,2024.09.24AA
Diagnostic Radiology,2.16.840.1.113883.3.464.1004.1081,2025-03-31,241523002,Computed tomography stereotactic localization (procedure),SNOMED CT US Edition,2.16.840.1.113883.6.96,2024.09.24AA
Diagnostic Radiology,2.16.840.1.113883.3.464.1004.1081,2025-03-31,241524008,Computed tomography cisternography (procedure),SNOMED CT US Edition,2.16.840.1.113883.6.96,2024.09.24AA
Diagnostic Radiology,2.16.840.1.113883.3.464.1004.1081,2025-03-31,241525009,Computed tomography air meatogram (procedure),SNOMED CT US Edition,2.16.840.1.113883.6.96,2024.09.24AA
Diagnostic Radiology,2.16.840.1.113883.3.464.1004.1081,2025-03-31,241526005,Computed tomography of paranasal sinuses (procedure),SNOMED CT US Edition,2.16.840.1.113883.6.96,2024.09.24AA
Diagnostic Radiology,2.16.840.1.113883.3.464.1004.1081,2025-03-31,241527001,Computed tomography of nasopharynx (procedure),SNOMED CT US Edition,2.16.840.1.113883.6.96,2024.09.24AA
Diagnostic Radiology,2.16.840.1.113883.3.464.1004.1081,2025-03-31,241529003,Computed tomography of salivary glands (procedure),SNOMED CT US Edition,2.16.840.1.113883.6.96,2024.09.24AA
Diagnostic Radiology,2.16.840.1.113883.3.464.1004.1081,2025-03-31,241530008,Computed tomography parotid gland (procedure),SNOMED CT US Edition,2.16.840.1.113883.6.96,2024.09.24AA
Diagnostic Radiology,2.16.840.1.113883.3.464.1004.1081,2025-03-31,241531007,Computed tomography submandibular gland (procedure),SNOMED CT US Edition,2.16.840.1.113883.6.96,2024.09.24AA
Diagnostic Radiology,2.16.840.1.113883.3.464.1004.1081,2025-03-31,241532000,Computed tomography sialogram (procedure),SNOMED CT US Edition,2.16.840.1.113883.6.96,2024.09.24AA
Diagnostic Radiology,2.16.840.1.113883.3.464.1004.1081,2025-03-31,241533005,Computed tomography parotid sialogram (procedure),SNOMED CT US Edition,2.16.840.1.113883.6.96,2024.09.24AA
Diagnostic Radiology,2.16.840.1.113883.3.464.1004.1081,2025-03-31,241534004,Computed tomography submandibular sialogram (procedure),SNOMED CT US Edition,2.16.840.1.113883.6.96,2024.09.24AA
Diagnostic Radiology,2.16.840.1.113883.3.464.1004.1081,2025-03-31,241535003,Computed tomography of soft tissues of neck (procedure),SNOMED CT US Edition,2.16.840.1.113883.6.96,2024.09.24AA
Diagnostic Radiology,2.16.840.1.113883.3.464.1004.1081,2025-03-31,241536002,Computed tomography of larynx (procedure),SNOMED CT US Edition,2.16.840.1.113883.6.96,2024.09.24AA
Diagnostic Radiology,2.16.840.1.113883.3.464.1004.1081,2025-03-31,241537006,Computed tomography of thyroid (procedure),SNOMED CT US Edition,2.16.840.1.113883.6.96,2024.09.24AA
Diagnostic Radiology,2.16.840.1.113883.3.464.1004.1081,2025-03-31,241538001,Computed tomography of parathyroid (procedure),SNOMED CT US Edition,2.16.840.1.113883.6.96,2024.09.24AA
Diagnostic Radiology,2.16.840.1.113883.3.464.1004.1081,2025-03-31,241539009,Computed tomography of breast (procedure),SNOMED CT US Edition,2.16.840.1.113883.6.96,2024.09.24AA
Diagnostic Radiology,2.16.840.1.113883.3.464.1004.1081,2025-03-31,241540006,Computed tomography of lungs (procedure),SNOMED CT US Edition,2.16.840.1.113883.6.96,2024.09.24AA
Diagnostic Radiology,2.16.840.1.113883.3.464.1004.1081,2025-03-31,241541005,High resolution computed tomography of lungs (procedure),SNOMED CT US Edition,2.16.840.1.113883.6.96,2024.09.24AA
Diagnostic Radiology,2.16.840.1.113883.3.464.1004.1081,2025-03-31,241542003,Computed tomography of lungs with diagnostic pneumothorax (procedure),SNOMED CT US Edition,2.16.840.1.113883.6.96,2024.09.24AA
Diagnostic Radiology,2.16.840.1.113883.3.464.1004.1081,2025-03-31,241543008,Computed tomography of mediastinum (procedure),SNOMED CT US Edition,2.16.840.1.113883.6.96,2024.09.24AA
