Value Set Name,Value Set OID,Value Set Version,Code,Definition,Code System,Code System OID,Code System Version
Diagnostic Radiology,2.16.840.1.113883.3.464.1004.1081,2025-03-31,252467008,Radionuclide limb blood flow assessment (procedure),SNOMED CT US Edition,2.16.840.1.113883.6.96,2024.09.24AA
Diagnostic Radiology,2.16.840.1.113883.3.464.1004.1081,2025-03-31,252573007,Taub test (procedure),SNOMED CT US Edition,2.16.840.1.113883.6.96,2024.09.24AA
Diagnostic Radiology,2.16.840.1.113883.3.464.1004.1081,2025-03-31,252642000,Barium coated food gastric transit study (procedure),SNOMED CT US Edition,2.16.840.1.113883.6.96,2024.09.24AA
Diagnostic Radiology,2.16.840.1.113883.3.464.1004.1081,2025-03-31,252643005,Bread barium swallow (procedure),SNOMED CT US Edition,2.16.840.1.113883.6.96,2024.09.24AA
Diagnostic Radiology,2.16.840.1.113883.3.464.1004.1081,2025-03-31,252644004,Marshmallow barium swallow (procedure),SNOMED CT US Edition,2.16.840.1.113883.6.96,2024.09.24AA
Diagnostic Radiology,2.16.840.1.113883.3.464.1004.1081,2025-03-31,252646002,Radionuclide liquid phase gastric emptying study (procedure),SNOMED CT US Edition,2.16.840.1.113883.6.96,2024.09.24AA
Diagnostic Radiology,2.16.840.1.113883.3.464.1004.1081,2025-03-31,252647006,Radionuclide solid phase gastric emptying study (procedure),SNOMED CT US Edition,2.16.840.1.113883.6.96,2024.09.24AA
Diagnostic Radiology,2.16.840.1.113883.3.464.1004.1081,2025-03-31,252674007,Radionuclide small intestine permeability study (procedure),SNOMED CT US Edition,2.16.840.1.113883.6.96,2024.09.24AA
Diagnostic Radiology,2.16.840.1.113883.3.464.1004.1081,2025-03-31,252679002,Colloid study for bleeding (procedure),SNOMED CT US Edition,2.16.840.1.113883.6.96,2024.09.24AA
Diagnostic Radiology,2.16.840.1.113883.3.464.1004.1081,2025-03-31,252680004,Radionuclide study for localization of tumor or inflammatory disease (procedure),SNOMED CT US Edition,2.16.840.1.113883.6.96,2024.09.24AA
Diagnostic Radiology,2.16.840.1.113883.3.464.1004.1081,2025-03-31,252682007,Protein-losing enteropathy study using radiolabeled chromium chloride (procedure),SNOMED CT US Edition,2.16.840.1.113883.6.96,2024.09.24AA
Diagnostic Radiology,2.16.840.1.113883.3.464.1004.1081,2025-03-31,252684008,Perfusion study - large intestine (procedure),SNOMED CT US Edition,2.16.840.1.113883.6.96,2024.09.24AA
Diagnostic Radiology,2.16.840.1.113883.3.464.1004.1081,2025-03-31,258172002,Stereotactic mammography (procedure),SNOMED CT US Edition,2.16.840.1.113883.6.96,2024.09.24AA
Diagnostic Radiology,2.16.840.1.113883.3.464.1004.1081,2025-03-31,258176004,Computed tomography guidance (procedure),SNOMED CT US Edition,2.16.840.1.113883.6.96,2024.09.24AA
Diagnostic Radiology,2.16.840.1.113883.3.464.1004.1081,2025-03-31,258177008,Magnetic resonance imaging guidance (procedure),SNOMED CT US Edition,2.16.840.1.113883.6.96,2024.09.24AA
Diagnostic Radiology,2.16.840.1.113883.3.464.1004.1081,2025-03-31,268428008,Erect plain X-ray of abdomen (procedure),SNOMED CT US Edition,2.16.840.1.113883.6.96,2024.09.24AA
Diagnostic Radiology,2.16.840.1.113883.3.464.1004.1081,2025-03-31,268434001,Contrast ventriculography of brain (procedure),SNOMED CT US Edition,2.16.840.1.113883.6.96,2024.09.24AA
Diagnostic Radiology,2.16.840.1.113883.3.464.1004.1081,2025-03-31,268441007,Stereotactic/stereoscopic investigation (procedure),SNOMED CT US Edition,2.16.840.1.113883.6.96,2024.09.24AA
Diagnostic Radiology,2.16.840.1.113883.3.464.1004.1081,2025-03-31,271318007,Isotope static scan heart (procedure),SNOMED CT US Edition,2.16.840.1.113883.6.96,2024.09.24AA
Diagnostic Radiology,2.16.840.1.113883.3.464.1004.1081,2025-03-31,271442007,Fetal anatomy study (procedure),SNOMED CT US Edition,2.16.840.1.113883.6.96,2024.09.24AA
Diagnostic Radiology,2.16.840.1.113883.3.464.1004.1081,2025-03-31,271455008,Dynamic non-imaging isotope study: brain (procedure),SNOMED CT US Edition,2.16.840.1.113883.6.96,2024.09.24AA
Diagnostic Radiology,2.16.840.1.113883.3.464.1004.1081,2025-03-31,271457000,Dynamic non-imaging isotope study: heart (procedure),SNOMED CT US Edition,2.16.840.1.113883.6.96,2024.09.24AA
Diagnostic Radiology,2.16.840.1.113883.3.464.1004.1081,2025-03-31,271459002,Dynamic non-imaging isotope study: urinary (procedure),SNOMED CT US Edition,2.16.840.1.113883.6.96,2024.09.24AA
Diagnostic Radiology,2.16.840.1.113883.3.464.1004.1081,2025-03-31,276015003,Plain X-ray of forefoot (procedure),SNOMED CT US Edition,2.16.840.1.113883.6.96,2024.09.24AA
Diagnostic Radiology,2.16.840.1.113883.3.464.1004.1081,2025-03-31,276017006,Gastrografin swallow (procedure),SNOMED CT US Edition,2.16.840.1.113883.6.96,2024.09.24AA
Diagnostic Radiology,2.16.840.1.113883.3.464.1004.1081,2025-03-31,276018001,Gastrografin meal (procedure),SNOMED CT US Edition,2.16.840.1.113883.6.96,2024.09.24AA
Diagnostic Radiology,2.16.840.1.113883.3.464.1004.1081,2025-03-31,276019009,Gastrografin enema (procedure),SNOMED CT US Edition,2.16.840.1.113883.6.96,2024.09.24AA
Diagnostic Radiology,2.16.840.1.113883.3.464.1004.1081,2025-03-31,276021004,Ultrasonography of carotid artery (procedure),SNOMED CT US Edition,2.16.840.1.113883.6.96,2024.09.24AA
Diagnostic Radiology,2.16.840.1.113883.3.464.1004.1081,2025-03-31,277458000,Single energy X-ray photon absorptiometry (procedure),SNOMED CT US Edition,2.16.840.1.113883.6.96,2024.09.24AA
Diagnostic Radiology,2.16.840.1.113883.3.464.1004.1081,2025-03-31,277583002,Percutaneous magnetic resonance guided aspiration (procedure),SNOMED CT US Edition,2.16.840.1.113883.6.96,2024.09.24AA
Diagnostic Radiology,2.16.840.1.113883.3.464.1004.1081,2025-03-31,277584008,Percutaneous computed tomography guided therapeutic drainage (procedure),SNOMED CT US Edition,2.16.840.1.113883.6.96,2024.09.24AA
Diagnostic Radiology,2.16.840.1.113883.3.464.1004.1081,2025-03-31,277585009,Percutaneous magnetic resonance guided therapeutic drainage (procedure),SNOMED CT US Edition,2.16.840.1.113883.6.96,2024.09.24AA
Diagnostic Radiology,2.16.840.1.113883.3.464.1004.1081,2025-03-31,277591006,Computed tomography guided biopsy (procedure),SNOMED CT US Edition,2.16.840.1.113883.6.96,2024.09.24AA
Diagnostic Radiology,2.16.840.1.113883.3.464.1004.1081,2025-03-31,277592004,Magnetic resonance imaging guided biopsy (procedure),SNOMED CT US Edition,2.16.840.1.113883.6.96,2024.09.24AA
Diagnostic Radiology,2.16.840.1.113883.3.464.1004.1081,2025-03-31,277673007,Plain X-ray guidance (procedure),SNOMED CT US Edition,2.16.840.1.113883.6.96,2024.09.24AA
Diagnostic Radiology,2.16.840.1.113883.3.464.1004.1081,2025-03-31,278009009,Computed tomography guided removal of foreign body (procedure),SNOMED CT US Edition,2.16.840.1.113883.6.96,2024.09.24AA
Diagnostic Radiology,2.16.840.1.113883.3.464.1004.1081,2025-03-31,278010004,Magnetic resonance imaging guided removal of foreign body (procedure),SNOMED CT US Edition,2.16.840.1.113883.6.96,2024.09.24AA
Diagnostic Radiology,2.16.840.1.113883.3.464.1004.1081,2025-03-31,279771007,Cardiovascular flow study imaging (procedure),SNOMED CT US Edition,2.16.840.1.113883.6.96,2024.09.24AA
Diagnostic Radiology,2.16.840.1.113883.3.464.1004.1081,2025-03-31,282721001,Fluoroscopic guidance (procedure),SNOMED CT US Edition,2.16.840.1.113883.6.96,2024.09.24AA
Diagnostic Radiology,2.16.840.1.113883.3.464.1004.1081,2025-03-31,287592005,Negative/double contrast pyelogram (procedure),SNOMED CT US Edition,2.16.840.1.113883.6.96,2024.09.24AA
Diagnostic Radiology,2.16.840.1.113883.3.464.1004.1081,2025-03-31,287593000,Postoperative cholangiography (procedure),SNOMED CT US Edition,2.16.840.1.113883.6.96,2024.09.24AA
Diagnostic Radiology,2.16.840.1.113883.3.464.1004.1081,2025-03-31,287601004,Pericardial contrast radiography (procedure),SNOMED CT US Edition,2.16.840.1.113883.6.96,2024.09.24AA
Diagnostic Radiology,2.16.840.1.113883.3.464.1004.1081,2025-03-31,287607000,Pneumohysterosalpingography (procedure),SNOMED CT US Edition,2.16.840.1.113883.6.96,2024.09.24AA
Diagnostic Radiology,2.16.840.1.113883.3.464.1004.1081,2025-03-31,302799008,Retrograde urethrogram (procedure),SNOMED CT US Edition,2.16.840.1.113883.6.96,2024.09.24AA
Diagnostic Radiology,2.16.840.1.113883.3.464.1004.1081,2025-03-31,303653007,Computed tomography of head (procedure),SNOMED CT US Edition,2.16.840.1.113883.6.96,2024.09.24AA
Diagnostic Radiology,2.16.840.1.113883.3.464.1004.1081,2025-03-31,303654001,Special computed tomography procedure of head (procedure),SNOMED CT US Edition,2.16.840.1.113883.6.96,2024.09.24AA
Diagnostic Radiology,2.16.840.1.113883.3.464.1004.1081,2025-03-31,303658003,Computed tomography of extracranial soft tissues of the head (procedure),SNOMED CT US Edition,2.16.840.1.113883.6.96,2024.09.24AA
Diagnostic Radiology,2.16.840.1.113883.3.464.1004.1081,2025-03-31,303662009,Computed tomography of intrathoracic structures (procedure),SNOMED CT US Edition,2.16.840.1.113883.6.96,2024.09.24AA
Diagnostic Radiology,2.16.840.1.113883.3.464.1004.1081,2025-03-31,303663004,Computed tomography of thoracic skeleton (procedure),SNOMED CT US Edition,2.16.840.1.113883.6.96,2024.09.24AA
Diagnostic Radiology,2.16.840.1.113883.3.464.1004.1081,2025-03-31,303664005,Special computed tomography procedure of thoracic region (procedure),SNOMED CT US Edition,2.16.840.1.113883.6.96,2024.09.24AA
Diagnostic Radiology,2.16.840.1.113883.3.464.1004.1081,2025-03-31,303665006,Computed tomography of aortic arch and great vessels (procedure),SNOMED CT US Edition,2.16.840.1.113883.6.96,2024.09.24AA
Diagnostic Radiology,2.16.840.1.113883.3.464.1004.1081,2025-03-31,303666007,Computed tomography of aortic aneurysm with contrast (procedure),SNOMED CT US Edition,2.16.840.1.113883.6.96,2024.09.24AA
Diagnostic Radiology,2.16.840.1.113883.3.464.1004.1081,2025-03-31,303668008,Computed tomography of intrathoracic respiratory structures (procedure),SNOMED CT US Edition,2.16.840.1.113883.6.96,2024.09.24AA
Diagnostic Radiology,2.16.840.1.113883.3.464.1004.1081,2025-03-31,303669000,Computed tomography of intrathoracic cardiovascular structures (procedure),SNOMED CT US Edition,2.16.840.1.113883.6.96,2024.09.24AA
Diagnostic Radiology,2.16.840.1.113883.3.464.1004.1081,2025-03-31,303671000,Computed tomography of abdominal vascular structure with contrast (procedure),SNOMED CT US Edition,2.16.840.1.113883.6.96,2024.09.24AA
Diagnostic Radiology,2.16.840.1.113883.3.464.1004.1081,2025-03-31,303673002,Computed tomography of pelvic organs (procedure),SNOMED CT US Edition,2.16.840.1.113883.6.96,2024.09.24AA
Diagnostic Radiology,2.16.840.1.113883.3.464.1004.1081,2025-03-31,303676005,Computed tomography of female pelvic organs (procedure),SNOMED CT US Edition,2.16.840.1.113883.6.96,2024.09.24AA
Diagnostic Radiology,2.16.840.1.113883.3.464.1004.1081,2025-03-31,303677001,Computed tomography of male pelvic organs (procedure),SNOMED CT US Edition,2.16.840.1.113883.6.96,2024.09.24AA
Diagnostic Radiology,2.16.840.1.113883.3.464.1004.1081,2025-03-31,303680000,Computed tomography of cardiovascular system (procedure),SNOMED CT US Edition,2.16.840.1.113883.6.96,2024.09.24AA
Diagnostic Radiology,2.16.840.1.113883.3.464.1004.1081,2025-03-31,303681001,Computed tomography of limb regions (procedure),SNOMED CT US Edition,2.16.840.1.113883.6.96,2024.09.24AA
Diagnostic Radiology,2.16.840.1.113883.3.464.1004.1081,2025-03-31,303686006,Computed tomography shoulder region structure (procedure),SNOMED CT US Edition,2.16.840.1.113883.6.96,2024.09.24AA
Diagnostic Radiology,2.16.840.1.113883.3.464.1004.1081,2025-03-31,303694004,Special computed tomography procedure of musculoskeletal system (procedure),SNOMED CT US Edition,2.16.840.1.113883.6.96,2024.09.24AA
Diagnostic Radiology,2.16.840.1.113883.3.464.1004.1081,2025-03-31,303695003,Computed tomography of back region (procedure),SNOMED CT US Edition,2.16.840.1.113883.6.96,2024.09.24AA
Diagnostic Radiology,2.16.840.1.113883.3.464.1004.1081,2025-03-31,303697006,Computed tomography of lumbar region (procedure),SNOMED CT US Edition,2.16.840.1.113883.6.96,2024.09.24AA
Diagnostic Radiology,2.16.840.1.113883.3.464.1004.1081,2025-03-31,303698001,Special computed tomography study (procedure),SNOMED CT US Edition,2.16.840.1.113883.6.96,2024.09.24AA
Diagnostic Radiology,2.16.840.1.113883.3.464.1004.1081,2025-03-31,303757000,Upper gastrointestinal tract contrast procedure (procedure),SNOMED CT US Edition,2.16.840.1.113883.6.96,2024.09.24AA
Diagnostic Radiology,2.16.840.1.113883.3.464.1004.1081,2025-03-31,303786002,Imaging of neck with contrast (procedure),SNOMED CT US Edition,2.16.840.1.113883.6.96,2024.09.24AA
Diagnostic Radiology,2.16.840.1.113883.3.464.1004.1081,2025-03-31,303867000,Tc99m-labeled colloid liver study - static (procedure),SNOMED CT US Edition,2.16.840.1.113883.6.96,2024.09.24AA
Diagnostic Radiology,2.16.840.1.113883.3.464.1004.1081,2025-03-31,303868005,Radionuclide urinary bladder studies (procedure),SNOMED CT US Edition,2.16.840.1.113883.6.96,2024.09.24AA
Diagnostic Radiology,2.16.840.1.113883.3.464.1004.1081,2025-03-31,303869002,Radionuclide female genital system study (procedure),SNOMED CT US Edition,2.16.840.1.113883.6.96,2024.09.24AA
Diagnostic Radiology,2.16.840.1.113883.3.464.1004.1081,2025-03-31,303870001,Radionuclide male genital system study (procedure),SNOMED CT US Edition,2.16.840.1.113883.6.96,2024.09.24AA
Diagnostic Radiology,2.16.840.1.113883.3.464.1004.1081,2025-03-31,303871002,Radionuclide urinary tract study (procedure),SNOMED CT US Edition,2.16.840.1.113883.6.96,2024.09.24AA
Diagnostic Radiology,2.16.840.1.113883.3.464.1004.1081,2025-03-31,303878008,Radionuclide study of thorax (procedure),SNOMED CT US Edition,2.16.840.1.113883.6.96,2024.09.24AA
Diagnostic Radiology,2.16.840.1.113883.3.464.1004.1081,2025-03-31,303879000,Radionuclide study of abdomen (procedure),SNOMED CT US Edition,2.16.840.1.113883.6.96,2024.09.24AA
Diagnostic Radiology,2.16.840.1.113883.3.464.1004.1081,2025-03-31,303883000,Radionuclide study of bone of head (procedure),SNOMED CT US Edition,2.16.840.1.113883.6.96,2024.09.24AA
Diagnostic Radiology,2.16.840.1.113883.3.464.1004.1081,2025-03-31,303897008,Radionuclide study of stomach (procedure),SNOMED CT US Edition,2.16.840.1.113883.6.96,2024.09.24AA
Diagnostic Radiology,2.16.840.1.113883.3.464.1004.1081,2025-03-31,303904005,Radionuclide study of respiratory function (procedure),SNOMED CT US Edition,2.16.840.1.113883.6.96,2024.09.24AA
Diagnostic Radiology,2.16.840.1.113883.3.464.1004.1081,2025-03-31,303905006,Radionuclide study of gastrointestinal function (procedure),SNOMED CT US Edition,2.16.840.1.113883.6.96,2024.09.24AA
Diagnostic Radiology,2.16.840.1.113883.3.464.1004.1081,2025-03-31,303907003,Radionuclide study of genitourinary function (procedure),SNOMED CT US Edition,2.16.840.1.113883.6.96,2024.09.24AA
Diagnostic Radiology,2.16.840.1.113883.3.464.1004.1081,2025-03-31,303909000,Radionuclide small intestine study (procedure),SNOMED CT US Edition,2.16.840.1.113883.6.96,2024.09.24AA
Diagnostic Radiology,2.16.840.1.113883.3.464.1004.1081,2025-03-31,303918003,Ultrasonography of male genital system (procedure),SNOMED CT US Edition,2.16.840.1.113883.6.96,2024.09.24AA
Diagnostic Radiology,2.16.840.1.113883.3.464.1004.1081,2025-03-31,303931008,Plain X-ray of lung (procedure),SNOMED CT US Edition,2.16.840.1.113883.6.96,2024.09.24AA
Diagnostic Radiology,2.16.840.1.113883.3.464.1004.1081,2025-03-31,303938002,Plain X-ray of neck (procedure),SNOMED CT US Edition,2.16.840.1.113883.6.96,2024.09.24AA
Diagnostic Radiology,2.16.840.1.113883.3.464.1004.1081,2025-03-31,303939005,Fluoroscopy of regions (procedure),SNOMED CT US Edition,2.16.840.1.113883.6.96,2024.09.24AA
Diagnostic Radiology,2.16.840.1.113883.3.464.1004.1081,2025-03-31,303940007,Fluoroscopy of head (procedure),SNOMED CT US Edition,2.16.840.1.113883.6.96,2024.09.24AA
Diagnostic Radiology,2.16.840.1.113883.3.464.1004.1081,2025-03-31,303941006,Fluoroscopy of abdomen (procedure),SNOMED CT US Edition,2.16.840.1.113883.6.96,2024.09.24AA
Diagnostic Radiology,2.16.840.1.113883.3.464.1004.1081,2025-03-31,303942004,Fluoroscopy of systems (procedure),SNOMED CT US Edition,2.16.840.1.113883.6.96,2024.09.24AA
Diagnostic Radiology,2.16.840.1.113883.3.464.1004.1081,2025-03-31,303943009,Digestive system fluoroscopy (procedure),SNOMED CT US Edition,2.16.840.1.113883.6.96,2024.09.24AA
Diagnostic Radiology,2.16.840.1.113883.3.464.1004.1081,2025-03-31,303944003,Urogenital system fluoroscopy (procedure),SNOMED CT US Edition,2.16.840.1.113883.6.96,2024.09.24AA
Diagnostic Radiology,2.16.840.1.113883.3.464.1004.1081,2025-03-31,303945002,Musculoskeletal fluoroscopy (procedure),SNOMED CT US Edition,2.16.840.1.113883.6.96,2024.09.24AA
Diagnostic Radiology,2.16.840.1.113883.3.464.1004.1081,2025-03-31,303946001,Respiratory system fluoroscopy (procedure),SNOMED CT US Edition,2.16.840.1.113883.6.96,2024.09.24AA
Diagnostic Radiology,2.16.840.1.113883.3.464.1004.1081,2025-03-31,305053005,Computed tomography angiography of aorta with contrast (procedure),SNOMED CT US Edition,2.16.840.1.113883.6.96,2024.09.24AA
Diagnostic Radiology,2.16.840.1.113883.3.464.1004.1081,2025-03-31,305436009,Radiculography (procedure),SNOMED CT US Edition,2.16.840.1.113883.6.96,2024.09.24AA
Diagnostic Radiology,2.16.840.1.113883.3.464.1004.1081,2025-03-31,306728006,Computed tomography of nervous system (procedure),SNOMED CT US Edition,2.16.840.1.113883.6.96,2024.09.24AA
Diagnostic Radiology,2.16.840.1.113883.3.464.1004.1081,2025-03-31,306991000,Aortic dissection protocol computed tomography with contrast (procedure),SNOMED CT US Edition,2.16.840.1.113883.6.96,2024.09.24AA
Diagnostic Radiology,2.16.840.1.113883.3.464.1004.1081,2025-03-31,306992007,Magnetic resonance imaging of aorta (procedure),SNOMED CT US Edition,2.16.840.1.113883.6.96,2024.09.24AA
Diagnostic Radiology,2.16.840.1.113883.3.464.1004.1081,2025-03-31,306993002,Magnetic resonance imaging of aortic aneurysm (procedure),SNOMED CT US Edition,2.16.840.1.113883.6.96,2024.09.24AA
Diagnostic Radiology,2.16.840.1.113883.3.464.1004.1081,2025-03-31,306994008,Magnetic resonance imaging of aortic arch and great vessels (procedure),SNOMED CT US Edition,2.16.840.1.113883.6.96,2024.09.24AA
Diagnostic Radiology,2.16.840.1.113883.3.464.1004.1081,2025-03-31,306996005,Aortic dissection protocol magnetic resonance imaging (procedure),SNOMED CT US Edition,2.16.840.1.113883.6.96,2024.09.24AA
Diagnostic Radiology,2.16.840.1.113883.3.464.1004.1081,2025-03-31,310810003,Plain X-ray of floor of mouth (procedure),SNOMED CT US Edition,2.16.840.1.113883.6.96,2024.09.24AA
Diagnostic Radiology,2.16.840.1.113883.3.464.1004.1081,2025-03-31,312681000,Bone density scan (procedure),SNOMED CT US Edition,2.16.840.1.113883.6.96,2024.09.24AA
Diagnostic Radiology,2.16.840.1.113883.3.464.1004.1081,2025-03-31,312725000,Duplex ultrasonography of veins of lower limb (procedure),SNOMED CT US Edition,2.16.840.1.113883.6.96,2024.09.24AA
Diagnostic Radiology,2.16.840.1.113883.3.464.1004.1081,2025-03-31,312726004,Duplex ultrasonography of arteries of upper limb (procedure),SNOMED CT US Edition,2.16.840.1.113883.6.96,2024.09.24AA
Diagnostic Radiology,2.16.840.1.113883.3.464.1004.1081,2025-03-31,312727008,Duplex ultrasonography of veins of upper limb (procedure),SNOMED CT US Edition,2.16.840.1.113883.6.96,2024.09.24AA
Diagnostic Radiology,2.16.840.1.113883.3.464.1004.1081,2025-03-31,314613007,Drainage of pancreatic lesion using computed tomography guidance (procedure),SNOMED CT US Edition,2.16.840.1.113883.6.96,2024.09.24AA
Diagnostic Radiology,2.16.840.1.113883.3.464.1004.1081,2025-03-31,314615000,Aspiration of pancreatic lesion using ultrasonic guidance (procedure),SNOMED CT US Edition,2.16.840.1.113883.6.96,2024.09.24AA
Diagnostic Radiology,2.16.840.1.113883.3.464.1004.1081,2025-03-31,314635004,Magnetic resonance cholangiopancreatography (procedure),SNOMED CT US Edition,2.16.840.1.113883.6.96,2024.09.24AA
Diagnostic Radiology,2.16.840.1.113883.3.464.1004.1081,2025-03-31,315292000,Contrast swallow (procedure),SNOMED CT US Edition,2.16.840.1.113883.6.96,2024.09.24AA
Diagnostic Radiology,2.16.840.1.113883.3.464.1004.1081,2025-03-31,315293005,Contrast meal (procedure),SNOMED CT US Edition,2.16.840.1.113883.6.96,2024.09.24AA
Diagnostic Radiology,2.16.840.1.113883.3.464.1004.1081,2025-03-31,315294004,Contrast enema (procedure),SNOMED CT US Edition,2.16.840.1.113883.6.96,2024.09.24AA
Diagnostic Radiology,2.16.840.1.113883.3.464.1004.1081,2025-03-31,346950004,Radiologic examination of colon by air contrast (procedure),SNOMED CT US Edition,2.16.840.1.113883.6.96,2024.09.24AA
Diagnostic Radiology,2.16.840.1.113883.3.464.1004.1081,2025-03-31,361238009,Vitamin B12 isotope studies (procedure),SNOMED CT US Edition,2.16.840.1.113883.6.96,2024.09.24AA
Diagnostic Radiology,2.16.840.1.113883.3.464.1004.1081,2025-03-31,363206008,Computed tomography special views and positions (procedure),SNOMED CT US Edition,2.16.840.1.113883.6.96,2024.09.24AA
Diagnostic Radiology,2.16.840.1.113883.3.464.1004.1081,2025-03-31,363332000,Ultrasonography by mode (procedure),SNOMED CT US Edition,2.16.840.1.113883.6.96,2024.09.24AA
Diagnostic Radiology,2.16.840.1.113883.3.464.1004.1081,2025-03-31,363680008,Radiographic imaging procedure (procedure),SNOMED CT US Edition,2.16.840.1.113883.6.96,2024.09.24AA
Diagnostic Radiology,2.16.840.1.113883.3.464.1004.1081,2025-03-31,370142005,Plain X-ray of head (procedure),SNOMED CT US Edition,2.16.840.1.113883.6.96,2024.09.24AA
Diagnostic Radiology,2.16.840.1.113883.3.464.1004.1081,2025-03-31,371003002,Ureterogram (procedure),SNOMED CT US Edition,2.16.840.1.113883.6.96,2024.09.24AA
Diagnostic Radiology,2.16.840.1.113883.3.464.1004.1081,2025-03-31,371575001,Tomographic imaging procedure (procedure),SNOMED CT US Edition,2.16.840.1.113883.6.96,2024.09.24AA
Diagnostic Radiology,2.16.840.1.113883.3.464.1004.1081,2025-03-31,372078009,Adrenal radioisotope scan (procedure),SNOMED CT US Edition,2.16.840.1.113883.6.96,2024.09.24AA
Diagnostic Radiology,2.16.840.1.113883.3.464.1004.1081,2025-03-31,372080003,Radioisotope scan of parathyroid (procedure),SNOMED CT US Edition,2.16.840.1.113883.6.96,2024.09.24AA
Diagnostic Radiology,2.16.840.1.113883.3.464.1004.1081,2025-03-31,372082006,Radioisotope scan of spleen (procedure),SNOMED CT US Edition,2.16.840.1.113883.6.96,2024.09.24AA
Diagnostic Radiology,2.16.840.1.113883.3.464.1004.1081,2025-03-31,372084007,Radioisotope scan of bone marrow (procedure),SNOMED CT US Edition,2.16.840.1.113883.6.96,2024.09.24AA
Diagnostic Radiology,2.16.840.1.113883.3.464.1004.1081,2025-03-31,373205008,Nuclear medicine imaging procedure (procedure),SNOMED CT US Edition,2.16.840.1.113883.6.96,2024.09.24AA
Diagnostic Radiology,2.16.840.1.113883.3.464.1004.1081,2025-03-31,385443001,Radionuclide imaging of thyroid (procedure),SNOMED CT US Edition,2.16.840.1.113883.6.96,2024.09.24AA
Diagnostic Radiology,2.16.840.1.113883.3.464.1004.1081,2025-03-31,386206008,Kidney imaging with function study (procedure),SNOMED CT US Edition,2.16.840.1.113883.6.96,2024.09.24AA
Diagnostic Radiology,2.16.840.1.113883.3.464.1004.1081,2025-03-31,386550008,Radioisotope function study of liver (procedure),SNOMED CT US Edition,2.16.840.1.113883.6.96,2024.09.24AA
Diagnostic Radiology,2.16.840.1.113883.3.464.1004.1081,2025-03-31,386718000,Endoscopic retrograde cholangiopancreatography (procedure),SNOMED CT US Edition,2.16.840.1.113883.6.96,2024.09.24AA
Diagnostic Radiology,2.16.840.1.113883.3.464.1004.1081,2025-03-31,386722005,Endoscopic retrograde cholangiography (procedure),SNOMED CT US Edition,2.16.840.1.113883.6.96,2024.09.24AA
Diagnostic Radiology,2.16.840.1.113883.3.464.1004.1081,2025-03-31,392010000,Optical coherence tomography (procedure),SNOMED CT US Edition,2.16.840.1.113883.6.96,2024.09.24AA
Diagnostic Radiology,2.16.840.1.113883.3.464.1004.1081,2025-03-31,394719009,Doppler ultrasonography of carotid artery (procedure),SNOMED CT US Edition,2.16.840.1.113883.6.96,2024.09.24AA
Diagnostic Radiology,2.16.840.1.113883.3.464.1004.1081,2025-03-31,396205005,Computed tomography of brain without radiopaque contrast (procedure),SNOMED CT US Edition,2.16.840.1.113883.6.96,2024.09.24AA
Diagnostic Radiology,2.16.840.1.113883.3.464.1004.1081,2025-03-31,396207002,Computed tomography of brain with radiopaque contrast (procedure),SNOMED CT US Edition,2.16.840.1.113883.6.96,2024.09.24AA
Diagnostic Radiology,2.16.840.1.113883.3.464.1004.1081,2025-03-31,397835000,Transesophageal echocardiographic valvular monitoring (regime/therapy),SNOMED CT US Edition,2.16.840.1.113883.6.96,2024.09.24AA
Diagnostic Radiology,2.16.840.1.113883.3.464.1004.1081,2025-03-31,397986006,Transesophageal echocardiographic monitoring (regime/therapy),SNOMED CT US Edition,2.16.840.1.113883.6.96,2024.09.24AA
Diagnostic Radiology,2.16.840.1.113883.3.464.1004.1081,2025-03-31,398305002,Transesophageal echocardiographic ventricular function monitoring (regime/therapy),SNOMED CT US Edition,2.16.840.1.113883.6.96,2024.09.24AA
Diagnostic Radiology,2.16.840.1.113883.3.464.1004.1081,2025-03-31,398765001,Therapeutic barium enema for reduction of intussusception (procedure),SNOMED CT US Edition,2.16.840.1.113883.6.96,2024.09.24AA
Diagnostic Radiology,2.16.840.1.113883.3.464.1004.1081,2025-03-31,399208008,Plain X-ray of chest (procedure),SNOMED CT US Edition,2.16.840.1.113883.6.96,2024.09.24AA
Diagnostic Radiology,2.16.840.1.113883.3.464.1004.1081,2025-03-31,399331006,Computed tomography without contrast (procedure),SNOMED CT US Edition,2.16.840.1.113883.6.96,2024.09.24AA
Diagnostic Radiology,2.16.840.1.113883.3.464.1004.1081,2025-03-31,404221001,Multiple gated acquisition scanning (procedure),SNOMED CT US Edition,2.16.840.1.113883.6.96,2024.09.24AA
Diagnostic Radiology,2.16.840.1.113883.3.464.1004.1081,2025-03-31,404222008,Radionuclide blood pool study (procedure),SNOMED CT US Edition,2.16.840.1.113883.6.96,2024.09.24AA
Diagnostic Radiology,2.16.840.1.113883.3.464.1004.1081,2025-03-31,405250000,Retrograde pyelogram (procedure),SNOMED CT US Edition,2.16.840.1.113883.6.96,2024.09.24AA
