Value Set Name,Value Set OID,Value Set Version,Code,Definition,Code System,Code System OID,Code System Version
Diagnostic Radiology,2.16.840.1.113883.3.464.1004.1081,2025-03-31,8151003,Echocardiography for detecting cardiac output (procedure),SNOMED CT US Edition,2.16.840.1.113883.6.96,2024.09.24AA
Diagnostic Radiology,2.16.840.1.113883.3.464.1004.1081,2025-03-31,8693001,Radionuclide identification of eye tumor (procedure),SNOMED CT US Edition,2.16.840.1.113883.6.96,2024.09.24AA
Diagnostic Radiology,2.16.840.1.113883.3.464.1004.1081,2025-03-31,8994009,Radioiron oral absorption study (procedure),SNOMED CT US Edition,2.16.840.1.113883.6.96,2024.09.24AA
Diagnostic Radiology,2.16.840.1.113883.3.464.1004.1081,2025-03-31,9518008,Fistulography of abdominal wall with contrast (procedure),SNOMED CT US Edition,2.16.840.1.113883.6.96,2024.09.24AA
Diagnostic Radiology,2.16.840.1.113883.3.464.1004.1081,2025-03-31,9704004,Computed tomography limited studies (procedure),SNOMED CT US Edition,2.16.840.1.113883.6.96,2024.09.24AA
Diagnostic Radiology,2.16.840.1.113883.3.464.1004.1081,2025-03-31,9988008,Computed tomography oblique (procedure),SNOMED CT US Edition,2.16.840.1.113883.6.96,2024.09.24AA
Diagnostic Radiology,2.16.840.1.113883.3.464.1004.1081,2025-03-31,10374007,"Echography, contact B-scan (procedure)",SNOMED CT US Edition,2.16.840.1.113883.6.96,2024.09.24AA
Diagnostic Radiology,2.16.840.1.113883.3.464.1004.1081,2025-03-31,11269009,Isotope study for plasma volume (procedure),SNOMED CT US Edition,2.16.840.1.113883.6.96,2024.09.24AA
Diagnostic Radiology,2.16.840.1.113883.3.464.1004.1081,2025-03-31,11278003,Kidney imaging with vascular flow and function study (procedure),SNOMED CT US Edition,2.16.840.1.113883.6.96,2024.09.24AA
Diagnostic Radiology,2.16.840.1.113883.3.464.1004.1081,2025-03-31,11390003,"Retroperitoneal echography, B-scan, limited (procedure)",SNOMED CT US Edition,2.16.840.1.113883.6.96,2024.09.24AA
Diagnostic Radiology,2.16.840.1.113883.3.464.1004.1081,2025-03-31,11760007,Fluoroscopy during operation (procedure),SNOMED CT US Edition,2.16.840.1.113883.6.96,2024.09.24AA
Diagnostic Radiology,2.16.840.1.113883.3.464.1004.1081,2025-03-31,11892002,Computed tomography sagittal (procedure),SNOMED CT US Edition,2.16.840.1.113883.6.96,2024.09.24AA
Diagnostic Radiology,2.16.840.1.113883.3.464.1004.1081,2025-03-31,11895000,Tracer study of eye (procedure),SNOMED CT US Edition,2.16.840.1.113883.6.96,2024.09.24AA
Diagnostic Radiology,2.16.840.1.113883.3.464.1004.1081,2025-03-31,11971003,Pulmonary ventilation-perfusion study by radioactive krypton (procedure),SNOMED CT US Edition,2.16.840.1.113883.6.96,2024.09.24AA
Diagnostic Radiology,2.16.840.1.113883.3.464.1004.1081,2025-03-31,12124007,Radioisotope scan of pancreas (procedure),SNOMED CT US Edition,2.16.840.1.113883.6.96,2024.09.24AA
Diagnostic Radiology,2.16.840.1.113883.3.464.1004.1081,2025-03-31,12341000,Isotope study for glomerular filtration rate (procedure),SNOMED CT US Edition,2.16.840.1.113883.6.96,2024.09.24AA
Diagnostic Radiology,2.16.840.1.113883.3.464.1004.1081,2025-03-31,12357000,"Radiologic examination of renal cyst, translumbar approach (procedure)",SNOMED CT US Edition,2.16.840.1.113883.6.96,2024.09.24AA
Diagnostic Radiology,2.16.840.1.113883.3.464.1004.1081,2025-03-31,12389009,Xeromammography (procedure),SNOMED CT US Edition,2.16.840.1.113883.6.96,2024.09.24AA
Diagnostic Radiology,2.16.840.1.113883.3.464.1004.1081,2025-03-31,12749000,Radiologic guidance for percutaneous placement of enteroclysis tube (procedure),SNOMED CT US Edition,2.16.840.1.113883.6.96,2024.09.24AA
Diagnostic Radiology,2.16.840.1.113883.3.464.1004.1081,2025-03-31,13088001,Corpora cavernosography (procedure),SNOMED CT US Edition,2.16.840.1.113883.6.96,2024.09.24AA
Diagnostic Radiology,2.16.840.1.113883.3.464.1004.1081,2025-03-31,13205008,Transvaginal echography (procedure),SNOMED CT US Edition,2.16.840.1.113883.6.96,2024.09.24AA
Diagnostic Radiology,2.16.840.1.113883.3.464.1004.1081,2025-03-31,13256004,"Dynamic function study, blood clearance (procedure)",SNOMED CT US Edition,2.16.840.1.113883.6.96,2024.09.24AA
Diagnostic Radiology,2.16.840.1.113883.3.464.1004.1081,2025-03-31,13378009,Thyroid uptake with discharge (procedure),SNOMED CT US Edition,2.16.840.1.113883.6.96,2024.09.24AA
Diagnostic Radiology,2.16.840.1.113883.3.464.1004.1081,2025-03-31,13450007,Mammary ductogram of multiple ducts (procedure),SNOMED CT US Edition,2.16.840.1.113883.6.96,2024.09.24AA
Diagnostic Radiology,2.16.840.1.113883.3.464.1004.1081,2025-03-31,13518004,Computed tomography without intravenous contrast followed by intravenous contrast and more sections (procedure),SNOMED CT US Edition,2.16.840.1.113883.6.96,2024.09.24AA
Diagnostic Radiology,2.16.840.1.113883.3.464.1004.1081,2025-03-31,13845008,Gastrointestinal aspirate for localization of blood loss (procedure),SNOMED CT US Edition,2.16.840.1.113883.6.96,2024.09.24AA
Diagnostic Radiology,2.16.840.1.113883.3.464.1004.1081,2025-03-31,14211004,Computed tomography guidance for needle biopsy (procedure),SNOMED CT US Edition,2.16.840.1.113883.6.96,2024.09.24AA
Diagnostic Radiology,2.16.840.1.113883.3.464.1004.1081,2025-03-31,15282006,"Fetal echocardiography, real time with image documentation (2D) with M-mode recording (procedure)",SNOMED CT US Edition,2.16.840.1.113883.6.96,2024.09.24AA
Diagnostic Radiology,2.16.840.1.113883.3.464.1004.1081,2025-03-31,15351005,Radiocalcium absorption study (procedure),SNOMED CT US Edition,2.16.840.1.113883.6.96,2024.09.24AA
Diagnostic Radiology,2.16.840.1.113883.3.464.1004.1081,2025-03-31,15364006,"Scanning or imaging, perfusion study, particulate (procedure)",SNOMED CT US Edition,2.16.840.1.113883.6.96,2024.09.24AA
Diagnostic Radiology,2.16.840.1.113883.3.464.1004.1081,2025-03-31,15749009,"Cerebral ventriculography, air contrast (procedure)",SNOMED CT US Edition,2.16.840.1.113883.6.96,2024.09.24AA
Diagnostic Radiology,2.16.840.1.113883.3.464.1004.1081,2025-03-31,16278002,Radiologic supervision and interpretation of procedure (procedure),SNOMED CT US Edition,2.16.840.1.113883.6.96,2024.09.24AA
Diagnostic Radiology,2.16.840.1.113883.3.464.1004.1081,2025-03-31,16310003,Ultrasonography (procedure),SNOMED CT US Edition,2.16.840.1.113883.6.96,2024.09.24AA
Diagnostic Radiology,2.16.840.1.113883.3.464.1004.1081,2025-03-31,16747000,Percutaneous transhepatic cholangiography (procedure),SNOMED CT US Edition,2.16.840.1.113883.6.96,2024.09.24AA
Diagnostic Radiology,2.16.840.1.113883.3.464.1004.1081,2025-03-31,16910009,Oral contrast cholecystography (procedure),SNOMED CT US Edition,2.16.840.1.113883.6.96,2024.09.24AA
Diagnostic Radiology,2.16.840.1.113883.3.464.1004.1081,2025-03-31,17026004,Radionuclide tissue clearance study (procedure),SNOMED CT US Edition,2.16.840.1.113883.6.96,2024.09.24AA
Diagnostic Radiology,2.16.840.1.113883.3.464.1004.1081,2025-03-31,17375006,Ultrasonic guidance for renal pelvis aspiration (procedure),SNOMED CT US Edition,2.16.840.1.113883.6.96,2024.09.24AA
Diagnostic Radiology,2.16.840.1.113883.3.464.1004.1081,2025-03-31,17624002,"Splenoportography, positive contrast (procedure)",SNOMED CT US Edition,2.16.840.1.113883.6.96,2024.09.24AA
Diagnostic Radiology,2.16.840.1.113883.3.464.1004.1081,2025-03-31,17724006,Continuous wave Doppler analog wave form analysis of upper extremity arteries (procedure),SNOMED CT US Edition,2.16.840.1.113883.6.96,2024.09.24AA
Diagnostic Radiology,2.16.840.1.113883.3.464.1004.1081,2025-03-31,17776005,Arthrography of elbow (procedure),SNOMED CT US Edition,2.16.840.1.113883.6.96,2024.09.24AA
Diagnostic Radiology,2.16.840.1.113883.3.464.1004.1081,2025-03-31,17984001,Acute gastrointestinal blood loss imaging (procedure),SNOMED CT US Edition,2.16.840.1.113883.6.96,2024.09.24AA
Diagnostic Radiology,2.16.840.1.113883.3.464.1004.1081,2025-03-31,18102001,Mammary ductogram (procedure),SNOMED CT US Edition,2.16.840.1.113883.6.96,2024.09.24AA
Diagnostic Radiology,2.16.840.1.113883.3.464.1004.1081,2025-03-31,18370004,Radiologic examination of upper gastrointestinal tract with kidney-ureter-bladder (procedure),SNOMED CT US Edition,2.16.840.1.113883.6.96,2024.09.24AA
Diagnostic Radiology,2.16.840.1.113883.3.464.1004.1081,2025-03-31,18479002,Testicular imaging with vascular flow (procedure),SNOMED CT US Edition,2.16.840.1.113883.6.96,2024.09.24AA
Diagnostic Radiology,2.16.840.1.113883.3.464.1004.1081,2025-03-31,18499008,"Radionuclide study, protein kinetics (procedure)",SNOMED CT US Edition,2.16.840.1.113883.6.96,2024.09.24AA
Diagnostic Radiology,2.16.840.1.113883.3.464.1004.1081,2025-03-31,18640002,"Echography, M-mode (procedure)",SNOMED CT US Edition,2.16.840.1.113883.6.96,2024.09.24AA
Diagnostic Radiology,2.16.840.1.113883.3.464.1004.1081,2025-03-31,18848007,"Echography of chest, B-scan with image documentation (procedure)",SNOMED CT US Edition,2.16.840.1.113883.6.96,2024.09.24AA
Diagnostic Radiology,2.16.840.1.113883.3.464.1004.1081,2025-03-31,19086005,Radioisotope study of respiratory system (procedure),SNOMED CT US Edition,2.16.840.1.113883.6.96,2024.09.24AA
Diagnostic Radiology,2.16.840.1.113883.3.464.1004.1081,2025-03-31,19252005,Isotope study for gastrointestinal blood loss (procedure),SNOMED CT US Edition,2.16.840.1.113883.6.96,2024.09.24AA
Diagnostic Radiology,2.16.840.1.113883.3.464.1004.1081,2025-03-31,20384009,Radioisotope scan of pituitary (procedure),SNOMED CT US Edition,2.16.840.1.113883.6.96,2024.09.24AA
Diagnostic Radiology,2.16.840.1.113883.3.464.1004.1081,2025-03-31,20603005,Special echography procedure (procedure),SNOMED CT US Edition,2.16.840.1.113883.6.96,2024.09.24AA
Diagnostic Radiology,2.16.840.1.113883.3.464.1004.1081,2025-03-31,20630000,Laparoscopic cholecystectomy with cholangiography (procedure),SNOMED CT US Edition,2.16.840.1.113883.6.96,2024.09.24AA
Diagnostic Radiology,2.16.840.1.113883.3.464.1004.1081,2025-03-31,20740007,"Pelvic echography, B-scan, complete (procedure)",SNOMED CT US Edition,2.16.840.1.113883.6.96,2024.09.24AA
Diagnostic Radiology,2.16.840.1.113883.3.464.1004.1081,2025-03-31,20836009,Computed tomography of posterior fossa with contrast (procedure),SNOMED CT US Edition,2.16.840.1.113883.6.96,2024.09.24AA
Diagnostic Radiology,2.16.840.1.113883.3.464.1004.1081,2025-03-31,21623001,Fetal biophysical profile (procedure),SNOMED CT US Edition,2.16.840.1.113883.6.96,2024.09.24AA
Diagnostic Radiology,2.16.840.1.113883.3.464.1004.1081,2025-03-31,22034001,"Echography of prostate, transrectal approach (procedure)",SNOMED CT US Edition,2.16.840.1.113883.6.96,2024.09.24AA
Diagnostic Radiology,2.16.840.1.113883.3.464.1004.1081,2025-03-31,22059005,Computed tomography bone density study (procedure),SNOMED CT US Edition,2.16.840.1.113883.6.96,2024.09.24AA
Diagnostic Radiology,2.16.840.1.113883.3.464.1004.1081,2025-03-31,22089003,Pulmonary ventilation-perfusion study by radioactive oxygen (procedure),SNOMED CT US Edition,2.16.840.1.113883.6.96,2024.09.24AA
Diagnostic Radiology,2.16.840.1.113883.3.464.1004.1081,2025-03-31,22400007,Computed tomography 3 dimensional reconstruction (procedure),SNOMED CT US Edition,2.16.840.1.113883.6.96,2024.09.24AA
Diagnostic Radiology,2.16.840.1.113883.3.464.1004.1081,2025-03-31,22760005,Xeroradiography (procedure),SNOMED CT US Edition,2.16.840.1.113883.6.96,2024.09.24AA
Diagnostic Radiology,2.16.840.1.113883.3.464.1004.1081,2025-03-31,22761009,Perineogram (procedure),SNOMED CT US Edition,2.16.840.1.113883.6.96,2024.09.24AA
Diagnostic Radiology,2.16.840.1.113883.3.464.1004.1081,2025-03-31,22791004,Plain X-ray of lumbar and sacral spine (procedure),SNOMED CT US Edition,2.16.840.1.113883.6.96,2024.09.24AA
Diagnostic Radiology,2.16.840.1.113883.3.464.1004.1081,2025-03-31,23225008,Gastrointestinal protein loss study (procedure),SNOMED CT US Edition,2.16.840.1.113883.6.96,2024.09.24AA
Diagnostic Radiology,2.16.840.1.113883.3.464.1004.1081,2025-03-31,23572007,Transmission bone density study (procedure),SNOMED CT US Edition,2.16.840.1.113883.6.96,2024.09.24AA
Diagnostic Radiology,2.16.840.1.113883.3.464.1004.1081,2025-03-31,23738001,Ultrasonography of digestive system (procedure),SNOMED CT US Edition,2.16.840.1.113883.6.96,2024.09.24AA
Diagnostic Radiology,2.16.840.1.113883.3.464.1004.1081,2025-03-31,23818008,"Scanning or imaging, perfusion study, gaseous (procedure)",SNOMED CT US Edition,2.16.840.1.113883.6.96,2024.09.24AA
Diagnostic Radiology,2.16.840.1.113883.3.464.1004.1081,2025-03-31,23931002,Ultrasonography of head and neck (procedure),SNOMED CT US Edition,2.16.840.1.113883.6.96,2024.09.24AA
Diagnostic Radiology,2.16.840.1.113883.3.464.1004.1081,2025-03-31,24058001,Echocardiography for determining posterior left ventricular wall thickness (procedure),SNOMED CT US Edition,2.16.840.1.113883.6.96,2024.09.24AA
Diagnostic Radiology,2.16.840.1.113883.3.464.1004.1081,2025-03-31,24135002,Ultrasonography of total body (procedure),SNOMED CT US Edition,2.16.840.1.113883.6.96,2024.09.24AA
Diagnostic Radiology,2.16.840.1.113883.3.464.1004.1081,2025-03-31,24623002,Screening mammography (procedure),SNOMED CT US Edition,2.16.840.1.113883.6.96,2024.09.24AA
Diagnostic Radiology,2.16.840.1.113883.3.464.1004.1081,2025-03-31,24646000,Translumbar angiography of abdominal aorta with serialography (procedure),SNOMED CT US Edition,2.16.840.1.113883.6.96,2024.09.24AA
Diagnostic Radiology,2.16.840.1.113883.3.464.1004.1081,2025-03-31,24689001,"Computed tomography guidance for treatment planning, external beam radiation therapy (procedure)",SNOMED CT US Edition,2.16.840.1.113883.6.96,2024.09.24AA
Diagnostic Radiology,2.16.840.1.113883.3.464.1004.1081,2025-03-31,24737001,Echography of scrotum and contents (procedure),SNOMED CT US Edition,2.16.840.1.113883.6.96,2024.09.24AA
Diagnostic Radiology,2.16.840.1.113883.3.464.1004.1081,2025-03-31,24848001,Pelvic echography (procedure),SNOMED CT US Edition,2.16.840.1.113883.6.96,2024.09.24AA
Diagnostic Radiology,2.16.840.1.113883.3.464.1004.1081,2025-03-31,25411007,Hysterogram (procedure),SNOMED CT US Edition,2.16.840.1.113883.6.96,2024.09.24AA
Diagnostic Radiology,2.16.840.1.113883.3.464.1004.1081,2025-03-31,25850001,Ultrasonography of thorax (procedure),SNOMED CT US Edition,2.16.840.1.113883.6.96,2024.09.24AA
Diagnostic Radiology,2.16.840.1.113883.3.464.1004.1081,2025-03-31,26946001,Computed tomography of upper extremity with contrast (procedure),SNOMED CT US Edition,2.16.840.1.113883.6.96,2024.09.24AA
Diagnostic Radiology,2.16.840.1.113883.3.464.1004.1081,2025-03-31,27498003,Radiography of bilateral bronchi with contrast (procedure),SNOMED CT US Edition,2.16.840.1.113883.6.96,2024.09.24AA
Diagnostic Radiology,2.16.840.1.113883.3.464.1004.1081,2025-03-31,27851003,Myelography of entire spinal canal (procedure),SNOMED CT US Edition,2.16.840.1.113883.6.96,2024.09.24AA
Diagnostic Radiology,2.16.840.1.113883.3.464.1004.1081,2025-03-31,28033003,Needle biopsy of chest with fluoroscopy guided localization (procedure),SNOMED CT US Edition,2.16.840.1.113883.6.96,2024.09.24AA
Diagnostic Radiology,2.16.840.1.113883.3.464.1004.1081,2025-03-31,28337005,Red cell survival study with splenic sequestration (procedure),SNOMED CT US Edition,2.16.840.1.113883.6.96,2024.09.24AA
Diagnostic Radiology,2.16.840.1.113883.3.464.1004.1081,2025-03-31,28339008,Thoracic myelography (procedure),SNOMED CT US Edition,2.16.840.1.113883.6.96,2024.09.24AA
Diagnostic Radiology,2.16.840.1.113883.3.464.1004.1081,2025-03-31,28367004,Cholangiography (procedure),SNOMED CT US Edition,2.16.840.1.113883.6.96,2024.09.24AA
Diagnostic Radiology,2.16.840.1.113883.3.464.1004.1081,2025-03-31,28514000,Tomography of bilateral kidneys (procedure),SNOMED CT US Edition,2.16.840.1.113883.6.96,2024.09.24AA
Diagnostic Radiology,2.16.840.1.113883.3.464.1004.1081,2025-03-31,28566009,"Echography, M-mode, complete (procedure)",SNOMED CT US Edition,2.16.840.1.113883.6.96,2024.09.24AA
Diagnostic Radiology,2.16.840.1.113883.3.464.1004.1081,2025-03-31,28686001,Nephrotomogram (procedure),SNOMED CT US Edition,2.16.840.1.113883.6.96,2024.09.24AA
Diagnostic Radiology,2.16.840.1.113883.3.464.1004.1081,2025-03-31,28687005,Transcatheter therapy by infusion with angiography (procedure),SNOMED CT US Edition,2.16.840.1.113883.6.96,2024.09.24AA
Diagnostic Radiology,2.16.840.1.113883.3.464.1004.1081,2025-03-31,28806001,"Angiocardiography by serialography, multi-plane (procedure)",SNOMED CT US Edition,2.16.840.1.113883.6.96,2024.09.24AA
Diagnostic Radiology,2.16.840.1.113883.3.464.1004.1081,2025-03-31,28894006,Fluoroscopic localization for transbronchial biopsy and brushing (procedure),SNOMED CT US Edition,2.16.840.1.113883.6.96,2024.09.24AA
Diagnostic Radiology,2.16.840.1.113883.3.464.1004.1081,2025-03-31,29117008,"Angiocardiography, positive contrast (procedure)",SNOMED CT US Edition,2.16.840.1.113883.6.96,2024.09.24AA
Diagnostic Radiology,2.16.840.1.113883.3.464.1004.1081,2025-03-31,29166005,Radiologic examination of upper gastrointestinal tract and small bowel with serial films (procedure),SNOMED CT US Edition,2.16.840.1.113883.6.96,2024.09.24AA
Diagnostic Radiology,2.16.840.1.113883.3.464.1004.1081,2025-03-31,29559003,"Radioiodohippurate sodium renogram, multiple probes (procedure)",SNOMED CT US Edition,2.16.840.1.113883.6.96,2024.09.24AA
Diagnostic Radiology,2.16.840.1.113883.3.464.1004.1081,2025-03-31,29567006,Magnetic resonance imaging of brain and brain stem (procedure),SNOMED CT US Edition,2.16.840.1.113883.6.96,2024.09.24AA
Diagnostic Radiology,2.16.840.1.113883.3.464.1004.1081,2025-03-31,29845000,Xenon flow scan of cardiovascular system (procedure),SNOMED CT US Edition,2.16.840.1.113883.6.96,2024.09.24AA
Diagnostic Radiology,2.16.840.1.113883.3.464.1004.1081,2025-03-31,29967000,"Echography, scan B-mode for placement of radiation fields (procedure)",SNOMED CT US Edition,2.16.840.1.113883.6.96,2024.09.24AA
Diagnostic Radiology,2.16.840.1.113883.3.464.1004.1081,2025-03-31,30439001,Venography of inferior vena cava with serialography (procedure),SNOMED CT US Edition,2.16.840.1.113883.6.96,2024.09.24AA
Diagnostic Radiology,2.16.840.1.113883.3.464.1004.1081,2025-03-31,30462004,"Echography of breast, B-scan (procedure)",SNOMED CT US Edition,2.16.840.1.113883.6.96,2024.09.24AA
Diagnostic Radiology,2.16.840.1.113883.3.464.1004.1081,2025-03-31,30726001,Ultrasonic guidance for thoracentesis (procedure),SNOMED CT US Edition,2.16.840.1.113883.6.96,2024.09.24AA
Diagnostic Radiology,2.16.840.1.113883.3.464.1004.1081,2025-03-31,30918004,Radionuclide venous thrombosis study (procedure),SNOMED CT US Edition,2.16.840.1.113883.6.96,2024.09.24AA
Diagnostic Radiology,2.16.840.1.113883.3.464.1004.1081,2025-03-31,30957007,Magnetic resonance imaging of orbit (procedure),SNOMED CT US Edition,2.16.840.1.113883.6.96,2024.09.24AA
Diagnostic Radiology,2.16.840.1.113883.3.464.1004.1081,2025-03-31,31643000,Angiography of upper extremity arteries with serialography (procedure),SNOMED CT US Edition,2.16.840.1.113883.6.96,2024.09.24AA
Diagnostic Radiology,2.16.840.1.113883.3.464.1004.1081,2025-03-31,31683008,"Retroperitoneal echography, B-scan, complete (procedure)",SNOMED CT US Edition,2.16.840.1.113883.6.96,2024.09.24AA
Diagnostic Radiology,2.16.840.1.113883.3.464.1004.1081,2025-03-31,31800006,Selective angiocardiography (procedure),SNOMED CT US Edition,2.16.840.1.113883.6.96,2024.09.24AA
Diagnostic Radiology,2.16.840.1.113883.3.464.1004.1081,2025-03-31,31911002,Radiography of kidney-ureter-bladder (procedure),SNOMED CT US Edition,2.16.840.1.113883.6.96,2024.09.24AA
Diagnostic Radiology,2.16.840.1.113883.3.464.1004.1081,2025-03-31,31962004,"Pulmonary perfusion imaging, particulate (procedure)",SNOMED CT US Edition,2.16.840.1.113883.6.96,2024.09.24AA
Diagnostic Radiology,2.16.840.1.113883.3.464.1004.1081,2025-03-31,31998007,"Echography, scan B-mode for fetal growth rate (procedure)",SNOMED CT US Edition,2.16.840.1.113883.6.96,2024.09.24AA
Diagnostic Radiology,2.16.840.1.113883.3.464.1004.1081,2025-03-31,32012009,Radioisotope scan of head (procedure),SNOMED CT US Edition,2.16.840.1.113883.6.96,2024.09.24AA
Diagnostic Radiology,2.16.840.1.113883.3.464.1004.1081,2025-03-31,32265006,Intravenous pyelogram (procedure),SNOMED CT US Edition,2.16.840.1.113883.6.96,2024.09.24AA
Diagnostic Radiology,2.16.840.1.113883.3.464.1004.1081,2025-03-31,32345002,Gastrointestinal isotope fat absorption study (procedure),SNOMED CT US Edition,2.16.840.1.113883.6.96,2024.09.24AA
Diagnostic Radiology,2.16.840.1.113883.3.464.1004.1081,2025-03-31,32729002,Thyroid uptake with thyroid suppression (procedure),SNOMED CT US Edition,2.16.840.1.113883.6.96,2024.09.24AA
Diagnostic Radiology,2.16.840.1.113883.3.464.1004.1081,2025-03-31,32962002,Computed tomography of abdomen with contrast (procedure),SNOMED CT US Edition,2.16.840.1.113883.6.96,2024.09.24AA
Diagnostic Radiology,2.16.840.1.113883.3.464.1004.1081,2025-03-31,33527008,Aspiration of cyst using ultrasonic guidance (procedure),SNOMED CT US Edition,2.16.840.1.113883.6.96,2024.09.24AA
Diagnostic Radiology,2.16.840.1.113883.3.464.1004.1081,2025-03-31,33677003,Isotope study of blood volume (procedure),SNOMED CT US Edition,2.16.840.1.113883.6.96,2024.09.24AA
Diagnostic Radiology,2.16.840.1.113883.3.464.1004.1081,2025-03-31,34227000,Computed tomography of brain (procedure),SNOMED CT US Edition,2.16.840.1.113883.6.96,2024.09.24AA
Diagnostic Radiology,2.16.840.1.113883.3.464.1004.1081,2025-03-31,35202002,Scanning or imaging with vascular flow (procedure),SNOMED CT US Edition,2.16.840.1.113883.6.96,2024.09.24AA
Diagnostic Radiology,2.16.840.1.113883.3.464.1004.1081,2025-03-31,35249003,Magnetic resonance imaging of face (procedure),SNOMED CT US Edition,2.16.840.1.113883.6.96,2024.09.24AA
Diagnostic Radiology,2.16.840.1.113883.3.464.1004.1081,2025-03-31,35621002,Cardiac blood pool imaging (procedure),SNOMED CT US Edition,2.16.840.1.113883.6.96,2024.09.24AA
Diagnostic Radiology,2.16.840.1.113883.3.464.1004.1081,2025-03-31,35757004,Echocardiography for determining ventricular contraction (procedure),SNOMED CT US Edition,2.16.840.1.113883.6.96,2024.09.24AA
Diagnostic Radiology,2.16.840.1.113883.3.464.1004.1081,2025-03-31,36624001,Gastrointestinal blood loss study by stool counting (procedure),SNOMED CT US Edition,2.16.840.1.113883.6.96,2024.09.24AA
Diagnostic Radiology,2.16.840.1.113883.3.464.1004.1081,2025-03-31,36870006,"Echoencephalography, A-mode (procedure)",SNOMED CT US Edition,2.16.840.1.113883.6.96,2024.09.24AA
Diagnostic Radiology,2.16.840.1.113883.3.464.1004.1081,2025-03-31,36960008,Intra-abdominal phlebography (procedure),SNOMED CT US Edition,2.16.840.1.113883.6.96,2024.09.24AA
Diagnostic Radiology,2.16.840.1.113883.3.464.1004.1081,2025-03-31,37090007,Placentography (procedure),SNOMED CT US Edition,2.16.840.1.113883.6.96,2024.09.24AA
Diagnostic Radiology,2.16.840.1.113883.3.464.1004.1081,2025-03-31,37348007,"Diagnostic radiography with contrast media by injection, positive contrast (procedure)",SNOMED CT US Edition,2.16.840.1.113883.6.96,2024.09.24AA
Diagnostic Radiology,2.16.840.1.113883.3.464.1004.1081,2025-03-31,37385004,Diagnostic radiography of upper gastrointestinal tract with serial films (procedure),SNOMED CT US Edition,2.16.840.1.113883.6.96,2024.09.24AA
Diagnostic Radiology,2.16.840.1.113883.3.464.1004.1081,2025-03-31,37403009,Sphincterotomy of sphincter of Oddi by endoscopic retrograde cholangiopancreatography (procedure),SNOMED CT US Edition,2.16.840.1.113883.6.96,2024.09.24AA
Diagnostic Radiology,2.16.840.1.113883.3.464.1004.1081,2025-03-31,37707006,Radionuclide study of coronary blood flow (regime/therapy),SNOMED CT US Edition,2.16.840.1.113883.6.96,2024.09.24AA
Diagnostic Radiology,2.16.840.1.113883.3.464.1004.1081,2025-03-31,37859006,Pulmonary ventilation perfusion study (procedure),SNOMED CT US Edition,2.16.840.1.113883.6.96,2024.09.24AA
Diagnostic Radiology,2.16.840.1.113883.3.464.1004.1081,2025-03-31,38930009,Fluoroscopy of chest (procedure),SNOMED CT US Edition,2.16.840.1.113883.6.96,2024.09.24AA
Diagnostic Radiology,2.16.840.1.113883.3.464.1004.1081,2025-03-31,39305005,Oral contrast cholangiography (procedure),SNOMED CT US Edition,2.16.840.1.113883.6.96,2024.09.24AA
Diagnostic Radiology,2.16.840.1.113883.3.464.1004.1081,2025-03-31,40008005,Plethysmometry (procedure),SNOMED CT US Edition,2.16.840.1.113883.6.96,2024.09.24AA
Diagnostic Radiology,2.16.840.1.113883.3.464.1004.1081,2025-03-31,40357002,Echocardiography for determining mitral and tricuspid valve motion (procedure),SNOMED CT US Edition,2.16.840.1.113883.6.96,2024.09.24AA
Diagnostic Radiology,2.16.840.1.113883.3.464.1004.1081,2025-03-31,40371005,Ultrasonography for midline shift of brain (procedure),SNOMED CT US Edition,2.16.840.1.113883.6.96,2024.09.24AA
Diagnostic Radiology,2.16.840.1.113883.3.464.1004.1081,2025-03-31,40701008,Echocardiography (procedure),SNOMED CT US Edition,2.16.840.1.113883.6.96,2024.09.24AA
Diagnostic Radiology,2.16.840.1.113883.3.464.1004.1081,2025-03-31,40892001,Special ultrasonic display or imaging technique (procedure),SNOMED CT US Edition,2.16.840.1.113883.6.96,2024.09.24AA
Diagnostic Radiology,2.16.840.1.113883.3.464.1004.1081,2025-03-31,41051004,"Echography, A-mode with amplitude quantitation (procedure)",SNOMED CT US Edition,2.16.840.1.113883.6.96,2024.09.24AA
Diagnostic Radiology,2.16.840.1.113883.3.464.1004.1081,2025-03-31,41209002,Transcatheter therapy for embolization with angiography (procedure),SNOMED CT US Edition,2.16.840.1.113883.6.96,2024.09.24AA
Diagnostic Radiology,2.16.840.1.113883.3.464.1004.1081,2025-03-31,41333006,Magnetic resonance imaging of lumbar spine with contrast (procedure),SNOMED CT US Edition,2.16.840.1.113883.6.96,2024.09.24AA
Diagnostic Radiology,2.16.840.1.113883.3.464.1004.1081,2025-03-31,41380003,Radioisotope scan for myocardial infarction (procedure),SNOMED CT US Edition,2.16.840.1.113883.6.96,2024.09.24AA
Diagnostic Radiology,2.16.840.1.113883.3.464.1004.1081,2025-03-31,41440006,Radioisotope brain imaging (procedure),SNOMED CT US Edition,2.16.840.1.113883.6.96,2024.09.24AA
