Value Set Name,Value Set OID,Code,Definition,Code System,Code System OID
AXR Competing Diagnosis,2.16.840.1.113883.3.464.1004.2245,1179406007,Infection of urinary tract caused by Pseudomonas aeruginosa (disorder),SNOMED CT US Edition,2.16.840.1.113883.6.96
AXR Competing Diagnosis,2.16.840.1.113883.3.464.1004.2245,1179407003,Inflammation of colon caused by Salmonella enterica enterica serovar Typhi (disorder),SNOMED CT US Edition,2.16.840.1.113883.6.96
AXR Competing Diagnosis,2.16.840.1.113883.3.464.1004.2245,1179682002,Prostatitis category I (National Institute of Health classification) (disorder),SNOMED CT US Edition,2.16.840.1.113883.6.96
AXR Competing Diagnosis,2.16.840.1.113883.3.464.1004.2245,1179689006,Prostatitis category II (National Institute of Health classification) (disorder),SNOMED CT US Edition,2.16.840.1.113883.6.96
AXR Competing Diagnosis,2.16.840.1.113883.3.464.1004.2245,1179690002,Prostatitis category III (National Institute of Health classification) (disorder),SNOMED CT US Edition,2.16.840.1.113883.6.96
AXR Competing Diagnosis,2.16.840.1.113883.3.464.1004.2245,1179692005,Prostatitis category IIIa (National Institute of Health classification) (disorder),SNOMED CT US Edition,2.16.840.1.113883.6.96
AXR Competing Diagnosis,2.16.840.1.113883.3.464.1004.2245,1179694006,Prostatitis category IIIb (National Institute of Health classification) (disorder),SNOMED CT US Edition,2.16.840.1.113883.6.96
AXR Competing Diagnosis,2.16.840.1.113883.3.464.1004.2245,1186725001,"Warts, immunodeficiency, lymphedema, anogenital dysplasia syndrome (disorder)",SNOMED CT US Edition,2.16.840.1.113883.6.96
AXR Competing Diagnosis,2.16.840.1.113883.3.464.1004.2245,1186999007,Infectious mononucleosis caused by Toxoplasma (disorder),SNOMED CT US Edition,2.16.840.1.113883.6.96
AXR Competing Diagnosis,2.16.840.1.113883.3.464.1004.2245,1187631004,Viral gastroenteritis caused by Sapovirus (disorder),SNOMED CT US Edition,2.16.840.1.113883.6.96
AXR Competing Diagnosis,2.16.840.1.113883.3.464.1004.2245,1193649002,Inflammation of small intestine caused by Aspergillus (disorder),SNOMED CT US Edition,2.16.840.1.113883.6.96
AXR Competing Diagnosis,2.16.840.1.113883.3.464.1004.2245,1193650002,Inflammation of intestine caused by Aspergillus (disorder),SNOMED CT US Edition,2.16.840.1.113883.6.96
AXR Competing Diagnosis,2.16.840.1.113883.3.464.1004.2245,1193651003,Inflammation of intestine caused by Blastomyces dermatitidis (disorder),SNOMED CT US Edition,2.16.840.1.113883.6.96
AXR Competing Diagnosis,2.16.840.1.113883.3.464.1004.2245,1193652005,Inflammation of small intestine caused by Blastomyces dermatitidis (disorder),SNOMED CT US Edition,2.16.840.1.113883.6.96
AXR Competing Diagnosis,2.16.840.1.113883.3.464.1004.2245,1193658009,Inflammation of small intestine caused by enterohemorrhagic Escherichia coli (disorder),SNOMED CT US Edition,2.16.840.1.113883.6.96
AXR Competing Diagnosis,2.16.840.1.113883.3.464.1004.2245,1193660006,Inflammation of intestine caused by enterohemorrhagic Escherichia coli (disorder),SNOMED CT US Edition,2.16.840.1.113883.6.96
AXR Competing Diagnosis,2.16.840.1.113883.3.464.1004.2245,1193681006,Inflammation of small intestine caused by enteroinvasive Escherichia coli (disorder),SNOMED CT US Edition,2.16.840.1.113883.6.96
AXR Competing Diagnosis,2.16.840.1.113883.3.464.1004.2245,1193682004,Inflammation of intestine caused by enteroinvasive Escherichia coli (disorder),SNOMED CT US Edition,2.16.840.1.113883.6.96
AXR Competing Diagnosis,2.16.840.1.113883.3.464.1004.2245,1193684003,Inflammation of small intestine caused by enteropathogenic Escherichia coli (disorder),SNOMED CT US Edition,2.16.840.1.113883.6.96
AXR Competing Diagnosis,2.16.840.1.113883.3.464.1004.2245,1193685002,Inflammation of intestine caused by enteropathogenic Escherichia coli (disorder),SNOMED CT US Edition,2.16.840.1.113883.6.96
AXR Competing Diagnosis,2.16.840.1.113883.3.464.1004.2245,1193687005,Inflammation of small intestine caused by enterotoxigenic Escherichia coli (disorder),SNOMED CT US Edition,2.16.840.1.113883.6.96
AXR Competing Diagnosis,2.16.840.1.113883.3.464.1004.2245,1193688000,Inflammation of intestine caused by enterotoxigenic Escherichia coli (disorder),SNOMED CT US Edition,2.16.840.1.113883.6.96
AXR Competing Diagnosis,2.16.840.1.113883.3.464.1004.2245,1193729000,Inflammation of small intestine caused by Actinomyces (disorder),SNOMED CT US Edition,2.16.840.1.113883.6.96
AXR Competing Diagnosis,2.16.840.1.113883.3.464.1004.2245,1193731009,Inflammation of intestine caused by Actinomyces (disorder),SNOMED CT US Edition,2.16.840.1.113883.6.96
AXR Competing Diagnosis,2.16.840.1.113883.3.464.1004.2245,1193732002,Inflammation of small intestine caused by Enterobacter (disorder),SNOMED CT US Edition,2.16.840.1.113883.6.96
AXR Competing Diagnosis,2.16.840.1.113883.3.464.1004.2245,1193733007,Inflammation of intestine caused by Enterobacter (disorder),SNOMED CT US Edition,2.16.840.1.113883.6.96
AXR Competing Diagnosis,2.16.840.1.113883.3.464.1004.2245,1193735000,Inflammation of small intestine caused by methicillin-resistant Staphylococcus aureus (disorder),SNOMED CT US Edition,2.16.840.1.113883.6.96
AXR Competing Diagnosis,2.16.840.1.113883.3.464.1004.2245,1193736004,Inflammation of intestine caused by methicillin-resistant Staphylococcus aureus (disorder),SNOMED CT US Edition,2.16.840.1.113883.6.96
AXR Competing Diagnosis,2.16.840.1.113883.3.464.1004.2245,1193737008,Inflammation of small intestine caused by Mycobacterium (disorder),SNOMED CT US Edition,2.16.840.1.113883.6.96
AXR Competing Diagnosis,2.16.840.1.113883.3.464.1004.2245,1193738003,Inflammation of intestine caused by Mycobacterium (disorder),SNOMED CT US Edition,2.16.840.1.113883.6.96
AXR Competing Diagnosis,2.16.840.1.113883.3.464.1004.2245,1193739006,Inflammation of small intestine caused by non-tuberculous Mycobacterium (disorder),SNOMED CT US Edition,2.16.840.1.113883.6.96
AXR Competing Diagnosis,2.16.840.1.113883.3.464.1004.2245,1193740008,Inflammation of intestine caused by non-tuberculous Mycobacterium (disorder),SNOMED CT US Edition,2.16.840.1.113883.6.96
AXR Competing Diagnosis,2.16.840.1.113883.3.464.1004.2245,1193741007,Inflammation of small intestine caused by Shigella boydii (disorder),SNOMED CT US Edition,2.16.840.1.113883.6.96
AXR Competing Diagnosis,2.16.840.1.113883.3.464.1004.2245,1193742000,Inflammation of intestine caused by Shigella boydii (disorder),SNOMED CT US Edition,2.16.840.1.113883.6.96
AXR Competing Diagnosis,2.16.840.1.113883.3.464.1004.2245,1193743005,Inflammation of small intestine caused by Shigella dysenteriae (disorder),SNOMED CT US Edition,2.16.840.1.113883.6.96
AXR Competing Diagnosis,2.16.840.1.113883.3.464.1004.2245,1193744004,Inflammation of intestine caused by Shigella dysenteriae (disorder),SNOMED CT US Edition,2.16.840.1.113883.6.96
AXR Competing Diagnosis,2.16.840.1.113883.3.464.1004.2245,1193745003,Inflammation of small intestine caused by Shigella flexneri (disorder),SNOMED CT US Edition,2.16.840.1.113883.6.96
AXR Competing Diagnosis,2.16.840.1.113883.3.464.1004.2245,1193746002,Inflammation of intestine caused by Shigella flexneri (disorder),SNOMED CT US Edition,2.16.840.1.113883.6.96
AXR Competing Diagnosis,2.16.840.1.113883.3.464.1004.2245,1193747006,Inflammation of small intestine caused by Shigella sonnei (disorder),SNOMED CT US Edition,2.16.840.1.113883.6.96
AXR Competing Diagnosis,2.16.840.1.113883.3.464.1004.2245,1193748001,Inflammation of intestine caused by Shigella sonnei (disorder),SNOMED CT US Edition,2.16.840.1.113883.6.96
AXR Competing Diagnosis,2.16.840.1.113883.3.464.1004.2245,1193749009,Inflammation of small intestine caused by Vibrio cholerae (disorder),SNOMED CT US Edition,2.16.840.1.113883.6.96
AXR Competing Diagnosis,2.16.840.1.113883.3.464.1004.2245,1193750009,Inflammation of intestine caused by Vibrio cholerae (disorder),SNOMED CT US Edition,2.16.840.1.113883.6.96
AXR Competing Diagnosis,2.16.840.1.113883.3.464.1004.2245,1193751008,Inflammation of small intestine due to human immunodeficiency virus disease (disorder),SNOMED CT US Edition,2.16.840.1.113883.6.96
AXR Competing Diagnosis,2.16.840.1.113883.3.464.1004.2245,1193752001,Inflammation of intestine due to human immunodeficiency virus disease (disorder),SNOMED CT US Edition,2.16.840.1.113883.6.96
AXR Competing Diagnosis,2.16.840.1.113883.3.464.1004.2245,1193798000,Inflammation of small intestine caused by protozoan (disorder),SNOMED CT US Edition,2.16.840.1.113883.6.96
AXR Competing Diagnosis,2.16.840.1.113883.3.464.1004.2245,1193799008,Inflammation of intestine caused by protozoan (disorder),SNOMED CT US Edition,2.16.840.1.113883.6.96
AXR Competing Diagnosis,2.16.840.1.113883.3.464.1004.2245,1193800007,Inflammation of small intestine caused by Cryptosporidium (disorder),SNOMED CT US Edition,2.16.840.1.113883.6.96
AXR Competing Diagnosis,2.16.840.1.113883.3.464.1004.2245,1193801006,Inflammation of intestine caused by Cryptosporidium (disorder),SNOMED CT US Edition,2.16.840.1.113883.6.96
AXR Competing Diagnosis,2.16.840.1.113883.3.464.1004.2245,1193802004,Inflammation of small intestine caused by Entamoeba histolytica (disorder),SNOMED CT US Edition,2.16.840.1.113883.6.96
AXR Competing Diagnosis,2.16.840.1.113883.3.464.1004.2245,1193803009,Inflammation of intestine caused by Entamoeba histolytica (disorder),SNOMED CT US Edition,2.16.840.1.113883.6.96
AXR Competing Diagnosis,2.16.840.1.113883.3.464.1004.2245,1193804003,Inflammation of small intestine caused by Giardia lamblia (disorder),SNOMED CT US Edition,2.16.840.1.113883.6.96
AXR Competing Diagnosis,2.16.840.1.113883.3.464.1004.2245,1193805002,Inflammation of intestine caused by Giardia lamblia (disorder),SNOMED CT US Edition,2.16.840.1.113883.6.96
AXR Competing Diagnosis,2.16.840.1.113883.3.464.1004.2245,1193806001,Eosinophilic inflammation of small intestine caused by Ancylostoma caninum (disorder),SNOMED CT US Edition,2.16.840.1.113883.6.96
AXR Competing Diagnosis,2.16.840.1.113883.3.464.1004.2245,1193807005,Eosinophilic inflammation of intestine caused by Ancylostoma caninum (disorder),SNOMED CT US Edition,2.16.840.1.113883.6.96
AXR Competing Diagnosis,2.16.840.1.113883.3.464.1004.2245,1197013001,Infection of gingiva caused by Mycobacterium tuberculosis complex (disorder),SNOMED CT US Edition,2.16.840.1.113883.6.96
AXR Competing Diagnosis,2.16.840.1.113883.3.464.1004.2245,1197032007,Disseminated pyogenic granuloma of gingiva (disorder),SNOMED CT US Edition,2.16.840.1.113883.6.96
AXR Competing Diagnosis,2.16.840.1.113883.3.464.1004.2245,1197333008,Verruca vulgaris of eyelid (disorder),SNOMED CT US Edition,2.16.840.1.113883.6.96
AXR Competing Diagnosis,2.16.840.1.113883.3.464.1004.2245,1197369000,Colitis caused by Chlamydia trachomatis (disorder),SNOMED CT US Edition,2.16.840.1.113883.6.96
AXR Competing Diagnosis,2.16.840.1.113883.3.464.1004.2245,1208910001,Acute bacterial endophthalmitis following surgical procedure (disorder),SNOMED CT US Edition,2.16.840.1.113883.6.96
AXR Competing Diagnosis,2.16.840.1.113883.3.464.1004.2245,1217295005,Infection of heart caused by Salmonella enterica enterica serovar Typhi (disorder),SNOMED CT US Edition,2.16.840.1.113883.6.96
AXR Competing Diagnosis,2.16.840.1.113883.3.464.1004.2245,1217670003,Chronic endophthalmitis caused by Bacteria following surgical procedure (disorder),SNOMED CT US Edition,2.16.840.1.113883.6.96
AXR Competing Diagnosis,2.16.840.1.113883.3.464.1004.2245,1217671004,Chronic follicular conjunctivitis caused by Chlamydia (disorder),SNOMED CT US Edition,2.16.840.1.113883.6.96
AXR Competing Diagnosis,2.16.840.1.113883.3.464.1004.2245,1222580004,Hepatitis caused by Toxoplasma gondii (disorder),SNOMED CT US Edition,2.16.840.1.113883.6.96
AXR Competing Diagnosis,2.16.840.1.113883.3.464.1004.2245,1230394004,Infection caused by extended spectrum beta-lactamase producing Proteus mirabilis (disorder),SNOMED CT US Edition,2.16.840.1.113883.6.96
AXR Competing Diagnosis,2.16.840.1.113883.3.464.1004.2245,1230395003,Infection caused by extended spectrum beta-lactamase producing Klebsiella oxytoca (disorder),SNOMED CT US Edition,2.16.840.1.113883.6.96
AXR Competing Diagnosis,2.16.840.1.113883.3.464.1004.2245,1231140009,Lemierre syndrome (disorder),SNOMED CT US Edition,2.16.840.1.113883.6.96
AXR Competing Diagnosis,2.16.840.1.113883.3.464.1004.2245,1231280005,Endogenous endophthalmitis caused by Bacteria (disorder),SNOMED CT US Edition,2.16.840.1.113883.6.96
AXR Competing Diagnosis,2.16.840.1.113883.3.464.1004.2245,1231377006,Inflammation of small intestine caused by Escherichia coli (disorder),SNOMED CT US Edition,2.16.840.1.113883.6.96
AXR Competing Diagnosis,2.16.840.1.113883.3.464.1004.2245,1231378001,Inflammation of intestine caused by Escherichia coli (disorder),SNOMED CT US Edition,2.16.840.1.113883.6.96
AXR Competing Diagnosis,2.16.840.1.113883.3.464.1004.2245,1231379009,Inflammation of small intestine caused by Shigella (disorder),SNOMED CT US Edition,2.16.840.1.113883.6.96
AXR Competing Diagnosis,2.16.840.1.113883.3.464.1004.2245,1231380007,Inflammation of intestine caused by Shigella (disorder),SNOMED CT US Edition,2.16.840.1.113883.6.96
AXR Competing Diagnosis,2.16.840.1.113883.3.464.1004.2245,1231639008,Granuloma pyogenicum of conjunctiva (disorder),SNOMED CT US Edition,2.16.840.1.113883.6.96
AXR Competing Diagnosis,2.16.840.1.113883.3.464.1004.2245,1231646004,Bacterial endophthalmitis due to and following traumatic injury (disorder),SNOMED CT US Edition,2.16.840.1.113883.6.96
AXR Competing Diagnosis,2.16.840.1.113883.3.464.1004.2245,1231669001,Infection of orbit caused by Mycobacterium tuberculosis (disorder),SNOMED CT US Edition,2.16.840.1.113883.6.96
AXR Competing Diagnosis,2.16.840.1.113883.3.464.1004.2245,1231700006,Endophthalmitis caused by Bacteria following surgical procedure (disorder),SNOMED CT US Edition,2.16.840.1.113883.6.96
AXR Competing Diagnosis,2.16.840.1.113883.3.464.1004.2245,1235004000,Lymphadenitis caused by Toxoplasma gondii (disorder),SNOMED CT US Edition,2.16.840.1.113883.6.96
AXR Competing Diagnosis,2.16.840.1.113883.3.464.1004.2245,1236994002,Inflammation of anterior margin of left lower eyelid caused by Staphylococcus (disorder),SNOMED CT US Edition,2.16.840.1.113883.6.96
AXR Competing Diagnosis,2.16.840.1.113883.3.464.1004.2245,1236995001,Inflammation of anterior margin of left upper eyelid caused by Staphylococcus (disorder),SNOMED CT US Edition,2.16.840.1.113883.6.96
AXR Competing Diagnosis,2.16.840.1.113883.3.464.1004.2245,1236996000,Inflammation of anterior margin of right upper eyelid caused by Staphylococcus (disorder),SNOMED CT US Edition,2.16.840.1.113883.6.96
AXR Competing Diagnosis,2.16.840.1.113883.3.464.1004.2245,1236997009,Inflammation of anterior margin of right lower eyelid caused by Staphylococcus (disorder),SNOMED CT US Edition,2.16.840.1.113883.6.96
AXR Competing Diagnosis,2.16.840.1.113883.3.464.1004.2245,1237436002,Inflammation of anterior margin of upper eyelid caused by Staphylococcus (disorder),SNOMED CT US Edition,2.16.840.1.113883.6.96
AXR Competing Diagnosis,2.16.840.1.113883.3.464.1004.2245,1237437006,Inflammation of anterior margin of lower eyelid caused by Staphylococcus (disorder),SNOMED CT US Edition,2.16.840.1.113883.6.96
AXR Competing Diagnosis,2.16.840.1.113883.3.464.1004.2245,1251354003,Infection of skin following cosmetic surgical procedure (disorder),SNOMED CT US Edition,2.16.840.1.113883.6.96
AXR Competing Diagnosis,2.16.840.1.113883.3.464.1004.2245,1251524009,Foreign body in skin of lower leg with infection (disorder),SNOMED CT US Edition,2.16.840.1.113883.6.96
AXR Competing Diagnosis,2.16.840.1.113883.3.464.1004.2245,1254927005,Infection of skin due to and following laser procedure on skin (disorder),SNOMED CT US Edition,2.16.840.1.113883.6.96
AXR Competing Diagnosis,2.16.840.1.113883.3.464.1004.2245,1255627000,Post-renal transplant nephropathy caused by BK polyomavirus (disorder),SNOMED CT US Edition,2.16.840.1.113883.6.96
AXR Competing Diagnosis,2.16.840.1.113883.3.464.1004.2245,1256045009,Superficial vegetating pyoderma gangrenosum (disorder),SNOMED CT US Edition,2.16.840.1.113883.6.96
AXR Competing Diagnosis,2.16.840.1.113883.3.464.1004.2245,1256055008,Ulcerative pyoderma gangrenosum (disorder),SNOMED CT US Edition,2.16.840.1.113883.6.96
AXR Competing Diagnosis,2.16.840.1.113883.3.464.1004.2245,1256078002,Pyoderma gangrenosum due to inflammatory bowel disease (disorder),SNOMED CT US Edition,2.16.840.1.113883.6.96
AXR Competing Diagnosis,2.16.840.1.113883.3.464.1004.2245,1256079005,Pyoderma gangrenosum due to inflammatory polyarthropathy (disorder),SNOMED CT US Edition,2.16.840.1.113883.6.96
AXR Competing Diagnosis,2.16.840.1.113883.3.464.1004.2245,1256081007,Pustular pyoderma gangrenosum (disorder),SNOMED CT US Edition,2.16.840.1.113883.6.96
AXR Competing Diagnosis,2.16.840.1.113883.3.464.1004.2245,1258923000,Infection caused by Neisseria gonorrhoeae during puerperium (disorder),SNOMED CT US Edition,2.16.840.1.113883.6.96
AXR Competing Diagnosis,2.16.840.1.113883.3.464.1004.2245,1258958003,Acute bacterial simple cystitis (disorder),SNOMED CT US Edition,2.16.840.1.113883.6.96
AXR Competing Diagnosis,2.16.840.1.113883.3.464.1004.2245,1258979003,Pyoderma gangrenosum due to hematological disorder (disorder),SNOMED CT US Edition,2.16.840.1.113883.6.96
AXR Competing Diagnosis,2.16.840.1.113883.3.464.1004.2245,1263771009,Acute on chronic pelvic inflammatory disease (disorder),SNOMED CT US Edition,2.16.840.1.113883.6.96
AXR Competing Diagnosis,2.16.840.1.113883.3.464.1004.2245,1264130004,Tetanus following ectopic pregnancy (disorder),SNOMED CT US Edition,2.16.840.1.113883.6.96
AXR Competing Diagnosis,2.16.840.1.113883.3.464.1004.2245,1264131000,Tetanus following molar pregnancy (disorder),SNOMED CT US Edition,2.16.840.1.113883.6.96
AXR Competing Diagnosis,2.16.840.1.113883.3.464.1004.2245,1264160009,Salpingo-oophoritis following molar pregnancy (disorder),SNOMED CT US Edition,2.16.840.1.113883.6.96
AXR Competing Diagnosis,2.16.840.1.113883.3.464.1004.2245,1264161008,Salpingo-oophoritis following ectopic pregnancy (disorder),SNOMED CT US Edition,2.16.840.1.113883.6.96
AXR Competing Diagnosis,2.16.840.1.113883.3.464.1004.2245,1264215002,Fetal infection caused by Streptococcus group B (disorder),SNOMED CT US Edition,2.16.840.1.113883.6.96
AXR Competing Diagnosis,2.16.840.1.113883.3.464.1004.2245,1264216001,Early neonatal infection caused by Streptococcus group B (disorder),SNOMED CT US Edition,2.16.840.1.113883.6.96
AXR Competing Diagnosis,2.16.840.1.113883.3.464.1004.2245,1264217005,Fetal infection caused by bacterium (disorder),SNOMED CT US Edition,2.16.840.1.113883.6.96
AXR Competing Diagnosis,2.16.840.1.113883.3.464.1004.2245,1264218000,Early neonatal infection caused by bacterium (disorder),SNOMED CT US Edition,2.16.840.1.113883.6.96
AXR Competing Diagnosis,2.16.840.1.113883.3.464.1004.2245,1264219008,Early neonatal infection caused by Anaerobic bacterium (disorder),SNOMED CT US Edition,2.16.840.1.113883.6.96
AXR Competing Diagnosis,2.16.840.1.113883.3.464.1004.2245,1264220002,Fetal infection caused by Anaerobic bacterium (disorder),SNOMED CT US Edition,2.16.840.1.113883.6.96
AXR Competing Diagnosis,2.16.840.1.113883.3.464.1004.2245,1264223000,Fetal infection caused by Escherichia coli (disorder),SNOMED CT US Edition,2.16.840.1.113883.6.96
AXR Competing Diagnosis,2.16.840.1.113883.3.464.1004.2245,1264224006,Early neonatal infection caused by Escherichia coli (disorder),SNOMED CT US Edition,2.16.840.1.113883.6.96
AXR Competing Diagnosis,2.16.840.1.113883.3.464.1004.2245,1264225007,Fetal infection caused by Staphylococcus aureus (disorder),SNOMED CT US Edition,2.16.840.1.113883.6.96
AXR Competing Diagnosis,2.16.840.1.113883.3.464.1004.2245,1264226008,Early neonatal infection caused by Staphylococcus aureus (disorder),SNOMED CT US Edition,2.16.840.1.113883.6.96
AXR Competing Diagnosis,2.16.840.1.113883.3.464.1004.2245,1264236000,Urinary tract infection following molar pregnancy (disorder),SNOMED CT US Edition,2.16.840.1.113883.6.96
AXR Competing Diagnosis,2.16.840.1.113883.3.464.1004.2245,1264237009,Urinary tract infection following ectopic pregnancy (disorder),SNOMED CT US Edition,2.16.840.1.113883.6.96
AXR Competing Diagnosis,2.16.840.1.113883.3.464.1004.2245,1264269000,Chorioamnionitis caused by Bacteria (disorder),SNOMED CT US Edition,2.16.840.1.113883.6.96
AXR Competing Diagnosis,2.16.840.1.113883.3.464.1004.2245,1264305006,Foreign body in skin of middle finger with infection (disorder),SNOMED CT US Edition,2.16.840.1.113883.6.96
AXR Competing Diagnosis,2.16.840.1.113883.3.464.1004.2245,1268342009,Progressive internal resorption of tooth caused by bacteria (disorder),SNOMED CT US Edition,2.16.840.1.113883.6.96
AXR Competing Diagnosis,2.16.840.1.113883.3.464.1004.2245,1269493005,Resorption of tooth caused by bacteria (disorder),SNOMED CT US Edition,2.16.840.1.113883.6.96
AXR Competing Diagnosis,2.16.840.1.113883.3.464.1004.2245,1269516003,Lyme neuroborreliosis (disorder),SNOMED CT US Edition,2.16.840.1.113883.6.96
AXR Competing Diagnosis,2.16.840.1.113883.3.464.1004.2245,1279671006,Relapsing fever caused by Borrelia miyamotoi (disorder),SNOMED CT US Edition,2.16.840.1.113883.6.96
AXR Competing Diagnosis,2.16.840.1.113883.3.464.1004.2245,1279672004,Relapsing fever caused by Borrelia latyschewii (disorder),SNOMED CT US Edition,2.16.840.1.113883.6.96
AXR Competing Diagnosis,2.16.840.1.113883.3.464.1004.2245,1279673009,Infection caused by Borrelia latyschewii (disorder),SNOMED CT US Edition,2.16.840.1.113883.6.96
AXR Competing Diagnosis,2.16.840.1.113883.3.464.1004.2245,1279678000,Relapsing fever caused by Borrelia hermsii (disorder),SNOMED CT US Edition,2.16.840.1.113883.6.96
AXR Competing Diagnosis,2.16.840.1.113883.3.464.1004.2245,1279679008,Infection caused by Borrelia hermsii (disorder),SNOMED CT US Edition,2.16.840.1.113883.6.96
AXR Competing Diagnosis,2.16.840.1.113883.3.464.1004.2245,1279680006,Relapsing fever caused by Borrelia venezuelensis (disorder),SNOMED CT US Edition,2.16.840.1.113883.6.96
AXR Competing Diagnosis,2.16.840.1.113883.3.464.1004.2245,1279681005,Infection caused by Borrelia venezuelensis (disorder),SNOMED CT US Edition,2.16.840.1.113883.6.96
AXR Competing Diagnosis,2.16.840.1.113883.3.464.1004.2245,1279682003,Relapsing fever caused by Borrelia mazzottii (disorder),SNOMED CT US Edition,2.16.840.1.113883.6.96
AXR Competing Diagnosis,2.16.840.1.113883.3.464.1004.2245,1279683008,Infection caused by Borrelia mazzottii (disorder),SNOMED CT US Edition,2.16.840.1.113883.6.96
AXR Competing Diagnosis,2.16.840.1.113883.3.464.1004.2245,1279687009,Relapsing fever caused by Borrelia hispanica (disorder),SNOMED CT US Edition,2.16.840.1.113883.6.96
AXR Competing Diagnosis,2.16.840.1.113883.3.464.1004.2245,1279688004,Infection caused by Borrelia hispanica (disorder),SNOMED CT US Edition,2.16.840.1.113883.6.96
AXR Competing Diagnosis,2.16.840.1.113883.3.464.1004.2245,1279689007,Relapsing fever caused by Borrelia duttonii (disorder),SNOMED CT US Edition,2.16.840.1.113883.6.96
AXR Competing Diagnosis,2.16.840.1.113883.3.464.1004.2245,1279690003,Infection caused by Borrelia duttonii (disorder),SNOMED CT US Edition,2.16.840.1.113883.6.96
AXR Competing Diagnosis,2.16.840.1.113883.3.464.1004.2245,1279691004,Relapsing fever caused by Borrelia parkeri (disorder),SNOMED CT US Edition,2.16.840.1.113883.6.96
AXR Competing Diagnosis,2.16.840.1.113883.3.464.1004.2245,1279692006,Infection caused by Borrelia parkeri (disorder),SNOMED CT US Edition,2.16.840.1.113883.6.96
AXR Competing Diagnosis,2.16.840.1.113883.3.464.1004.2245,1279695008,Relapsing fever caused by Borrelia persica (disorder),SNOMED CT US Edition,2.16.840.1.113883.6.96
AXR Competing Diagnosis,2.16.840.1.113883.3.464.1004.2245,1279696009,Infection caused by Borrelia persica (disorder),SNOMED CT US Edition,2.16.840.1.113883.6.96
AXR Competing Diagnosis,2.16.840.1.113883.3.464.1004.2245,1279698005,Relapsing fever caused by Borrelia caucasica (disorder),SNOMED CT US Edition,2.16.840.1.113883.6.96
AXR Competing Diagnosis,2.16.840.1.113883.3.464.1004.2245,1279699002,Infection caused by Borrelia caucasica (disorder),SNOMED CT US Edition,2.16.840.1.113883.6.96
AXR Competing Diagnosis,2.16.840.1.113883.3.464.1004.2245,1279983005,Foreign body in skin of great toe with infection (disorder),SNOMED CT US Edition,2.16.840.1.113883.6.96
AXR Competing Diagnosis,2.16.840.1.113883.3.464.1004.2245,1279984004,Foreign body in skin of ring finger with infection (disorder),SNOMED CT US Edition,2.16.840.1.113883.6.96
AXR Competing Diagnosis,2.16.840.1.113883.3.464.1004.2245,1279985003,Foreign body in skin of thumb with infection (disorder),SNOMED CT US Edition,2.16.840.1.113883.6.96
AXR Competing Diagnosis,2.16.840.1.113883.3.464.1004.2245,1285578005,Infection of intestine caused by Clostridium botulinum in adulthood (disorder),SNOMED CT US Edition,2.16.840.1.113883.6.96
AXR Competing Diagnosis,2.16.840.1.113883.3.464.1004.2245,1285590007,Infection of intestine caused by Clostridium botulinum (disorder),SNOMED CT US Edition,2.16.840.1.113883.6.96
AXR Competing Diagnosis,2.16.840.1.113883.3.464.1004.2245,1286779006,Conjunctivitis caused by Mycobacterium tuberculosis (disorder),SNOMED CT US Edition,2.16.840.1.113883.6.96
AXR Competing Diagnosis,2.16.840.1.113883.3.464.1004.2245,1286780009,Episcleritis caused by Mycobacterium tuberculosis (disorder),SNOMED CT US Edition,2.16.840.1.113883.6.96
AXR Competing Diagnosis,2.16.840.1.113883.3.464.1004.2245,1287059003,Neonatal infection of skin caused by Candida (disorder),SNOMED CT US Edition,2.16.840.1.113883.6.96
AXR Competing Diagnosis,2.16.840.1.113883.3.464.1004.2245,1287188004,Eruption of skin caused by Salmonella (disorder),SNOMED CT US Edition,2.16.840.1.113883.6.96
AXR Competing Diagnosis,2.16.840.1.113883.3.464.1004.2245,1287189007,Eruption of skin caused by Salmonella enterica enterica serovar Typhi (disorder),SNOMED CT US Edition,2.16.840.1.113883.6.96
