Value Set Name,Value Set OID,Code,Definition,Code System,Code System OID
AXR Competing Diagnosis,2.16.840.1.113883.3.464.1004.2245,449083008,Sepsis caused by Salmonella (disorder),SNOMED CT US Edition,2.16.840.1.113883.6.96
AXR Competing Diagnosis,2.16.840.1.113883.3.464.1004.2245,449084002,Sepsis caused by Serratia (disorder),SNOMED CT US Edition,2.16.840.1.113883.6.96
AXR Competing Diagnosis,2.16.840.1.113883.3.464.1004.2245,449335002,Sepsis caused by Listeria monocytogenes (disorder),SNOMED CT US Edition,2.16.840.1.113883.6.96
AXR Competing Diagnosis,2.16.840.1.113883.3.464.1004.2245,449504009,Sepsis caused by Streptococcus pyogenes (disorder),SNOMED CT US Edition,2.16.840.1.113883.6.96
AXR Competing Diagnosis,2.16.840.1.113883.3.464.1004.2245,449505005,Sepsis caused by coagulase negative Staphylococcus (disorder),SNOMED CT US Edition,2.16.840.1.113883.6.96
AXR Competing Diagnosis,2.16.840.1.113883.3.464.1004.2245,449546000,Sepsis caused by Haemophilus influenzae type b (disorder),SNOMED CT US Edition,2.16.840.1.113883.6.96
AXR Competing Diagnosis,2.16.840.1.113883.3.464.1004.2245,449642006,Superficial injury of lower leg with infection (disorder),SNOMED CT US Edition,2.16.840.1.113883.6.96
AXR Competing Diagnosis,2.16.840.1.113883.3.464.1004.2245,449643001,Nonvenomous insect bite of lower leg with infection (disorder),SNOMED CT US Edition,2.16.840.1.113883.6.96
AXR Competing Diagnosis,2.16.840.1.113883.3.464.1004.2245,449688000,Blister of lower limb with infection (disorder),SNOMED CT US Edition,2.16.840.1.113883.6.96
AXR Competing Diagnosis,2.16.840.1.113883.3.464.1004.2245,449689008,Blister of lower leg with infection (disorder),SNOMED CT US Edition,2.16.840.1.113883.6.96
AXR Competing Diagnosis,2.16.840.1.113883.3.464.1004.2245,449773001,Interstitial glossitis (disorder),SNOMED CT US Edition,2.16.840.1.113883.6.96
AXR Competing Diagnosis,2.16.840.1.113883.3.464.1004.2245,449776009,Luetic glossitis (disorder),SNOMED CT US Edition,2.16.840.1.113883.6.96
AXR Competing Diagnosis,2.16.840.1.113883.3.464.1004.2245,449850000,Infection caused by Theileria equi (disorder),SNOMED CT US Edition,2.16.840.1.113883.6.96
AXR Competing Diagnosis,2.16.840.1.113883.3.464.1004.2245,449900006,Necrotizing fasciitis caused by Streptococcus pyogenes (disorder),SNOMED CT US Edition,2.16.840.1.113883.6.96
AXR Competing Diagnosis,2.16.840.1.113883.3.464.1004.2245,449908004,Aggressive periodontitis (disorder),SNOMED CT US Edition,2.16.840.1.113883.6.96
AXR Competing Diagnosis,2.16.840.1.113883.3.464.1004.2245,450861006,Infection caused by Grimontia hollisae (disorder),SNOMED CT US Edition,2.16.840.1.113883.6.96
AXR Competing Diagnosis,2.16.840.1.113883.3.464.1004.2245,460317007,Myocarditis caused by Rickettsia (disorder),SNOMED CT US Edition,2.16.840.1.113883.6.96
AXR Competing Diagnosis,2.16.840.1.113883.3.464.1004.2245,460352004,Myocarditis caused by Spirochaetales (disorder),SNOMED CT US Edition,2.16.840.1.113883.6.96
AXR Competing Diagnosis,2.16.840.1.113883.3.464.1004.2245,460439008,Pericarditis caused by Haemophilus (disorder),SNOMED CT US Edition,2.16.840.1.113883.6.96
AXR Competing Diagnosis,2.16.840.1.113883.3.464.1004.2245,460440005,Pericarditis with pericardial effusion caused by Mycobacterium tuberculosis complex (disorder),SNOMED CT US Edition,2.16.840.1.113883.6.96
AXR Competing Diagnosis,2.16.840.1.113883.3.464.1004.2245,460457009,Constrictive pericarditis caused by bacteria (disorder),SNOMED CT US Edition,2.16.840.1.113883.6.96
AXR Competing Diagnosis,2.16.840.1.113883.3.464.1004.2245,460464006,Constrictive pericarditis caused by Mycobacterium tuberculosis complex (disorder),SNOMED CT US Edition,2.16.840.1.113883.6.96
AXR Competing Diagnosis,2.16.840.1.113883.3.464.1004.2245,460618008,Endocarditis caused by Chlamydia (disorder),SNOMED CT US Edition,2.16.840.1.113883.6.96
AXR Competing Diagnosis,2.16.840.1.113883.3.464.1004.2245,460620006,Myocarditis caused by Borrelia (disorder),SNOMED CT US Edition,2.16.840.1.113883.6.96
AXR Competing Diagnosis,2.16.840.1.113883.3.464.1004.2245,472822008,Far eastern spotted fever (disorder),SNOMED CT US Edition,2.16.840.1.113883.6.96
AXR Competing Diagnosis,2.16.840.1.113883.3.464.1004.2245,473082004,Infection and inflammation associated with retained intrauterine contraceptive device (disorder),SNOMED CT US Edition,2.16.840.1.113883.6.96
AXR Competing Diagnosis,2.16.840.1.113883.3.464.1004.2245,609338009,"Abrasion and/or friction burn of upper limb, infected (disorder)",SNOMED CT US Edition,2.16.840.1.113883.6.96
AXR Competing Diagnosis,2.16.840.1.113883.3.464.1004.2245,609351004,Abrasion and/or friction burn of lower leg with infection (disorder),SNOMED CT US Edition,2.16.840.1.113883.6.96
AXR Competing Diagnosis,2.16.840.1.113883.3.464.1004.2245,609436009,Fetal damage from maternal toxoplasmosis (disorder),SNOMED CT US Edition,2.16.840.1.113883.6.96
AXR Competing Diagnosis,2.16.840.1.113883.3.464.1004.2245,609491002,Induced termination of pregnancy complicated by urinary tract infection (disorder),SNOMED CT US Edition,2.16.840.1.113883.6.96
AXR Competing Diagnosis,2.16.840.1.113883.3.464.1004.2245,609493004,Induced termination of pregnancy complicated by tetanus (disorder),SNOMED CT US Edition,2.16.840.1.113883.6.96
AXR Competing Diagnosis,2.16.840.1.113883.3.464.1004.2245,698227004,Infection caused by Rhodococcus hoagii (disorder),SNOMED CT US Edition,2.16.840.1.113883.6.96
AXR Competing Diagnosis,2.16.840.1.113883.3.464.1004.2245,698628000,Postabortal pelvic inflammatory disease (disorder),SNOMED CT US Edition,2.16.840.1.113883.6.96
AXR Competing Diagnosis,2.16.840.1.113883.3.464.1004.2245,698734003,Postoperative bacterial meningitis (disorder),SNOMED CT US Edition,2.16.840.1.113883.6.96
AXR Competing Diagnosis,2.16.840.1.113883.3.464.1004.2245,699489009,Dental caries class I (disorder),SNOMED CT US Edition,2.16.840.1.113883.6.96
AXR Competing Diagnosis,2.16.840.1.113883.3.464.1004.2245,699490000,Dental caries class II (disorder),SNOMED CT US Edition,2.16.840.1.113883.6.96
AXR Competing Diagnosis,2.16.840.1.113883.3.464.1004.2245,699491001,Dental caries class III (disorder),SNOMED CT US Edition,2.16.840.1.113883.6.96
AXR Competing Diagnosis,2.16.840.1.113883.3.464.1004.2245,699492008,Dental caries class IV (disorder),SNOMED CT US Edition,2.16.840.1.113883.6.96
AXR Competing Diagnosis,2.16.840.1.113883.3.464.1004.2245,699494009,Dental caries class V (disorder),SNOMED CT US Edition,2.16.840.1.113883.6.96
AXR Competing Diagnosis,2.16.840.1.113883.3.464.1004.2245,699495005,Dental caries class VI (disorder),SNOMED CT US Edition,2.16.840.1.113883.6.96
AXR Competing Diagnosis,2.16.840.1.113883.3.464.1004.2245,699676006,Infection caused by Microsporidia (disorder),SNOMED CT US Edition,2.16.840.1.113883.6.96
AXR Competing Diagnosis,2.16.840.1.113883.3.464.1004.2245,699683004,Nonrestorable carious tooth (disorder),SNOMED CT US Edition,2.16.840.1.113883.6.96
AXR Competing Diagnosis,2.16.840.1.113883.3.464.1004.2245,699684005,Dental peri-implant mucositis (disorder),SNOMED CT US Edition,2.16.840.1.113883.6.96
AXR Competing Diagnosis,2.16.840.1.113883.3.464.1004.2245,699951008,Gas gangrene of lower limb (disorder),SNOMED CT US Edition,2.16.840.1.113883.6.96
AXR Competing Diagnosis,2.16.840.1.113883.3.464.1004.2245,699952001,Gas gangrene of upper limb (disorder),SNOMED CT US Edition,2.16.840.1.113883.6.96
AXR Competing Diagnosis,2.16.840.1.113883.3.464.1004.2245,700046006,Carious exposure of pulp (disorder),SNOMED CT US Edition,2.16.840.1.113883.6.96
AXR Competing Diagnosis,2.16.840.1.113883.3.464.1004.2245,700220003,Acute bacterial otitis externa (disorder),SNOMED CT US Edition,2.16.840.1.113883.6.96
AXR Competing Diagnosis,2.16.840.1.113883.3.464.1004.2245,700284005,Congenital disseminated toxoplasmosis (disorder),SNOMED CT US Edition,2.16.840.1.113883.6.96
AXR Competing Diagnosis,2.16.840.1.113883.3.464.1004.2245,700372006,Urinary tract infection associated with catheter (disorder),SNOMED CT US Edition,2.16.840.1.113883.6.96
AXR Competing Diagnosis,2.16.840.1.113883.3.464.1004.2245,702383005,Distal myopathy 2 (disorder),SNOMED CT US Edition,2.16.840.1.113883.6.96
AXR Competing Diagnosis,2.16.840.1.113883.3.464.1004.2245,702402003,Early childhood caries (disorder),SNOMED CT US Edition,2.16.840.1.113883.6.96
AXR Competing Diagnosis,2.16.840.1.113883.3.464.1004.2245,702646000,Extensive cavitated lesion with exposed dentine (disorder),SNOMED CT US Edition,2.16.840.1.113883.6.96
AXR Competing Diagnosis,2.16.840.1.113883.3.464.1004.2245,702715008,Acute on chronic prostatitis (disorder),SNOMED CT US Edition,2.16.840.1.113883.6.96
AXR Competing Diagnosis,2.16.840.1.113883.3.464.1004.2245,703339005,Moderate cavitated lesion limited to outer half of dentin (disorder),SNOMED CT US Edition,2.16.840.1.113883.6.96
AXR Competing Diagnosis,2.16.840.1.113883.3.464.1004.2245,704175009,Acute chorioamnionitis (disorder),SNOMED CT US Edition,2.16.840.1.113883.6.96
AXR Competing Diagnosis,2.16.840.1.113883.3.464.1004.2245,707208009,Familial non-obstructive reflux-associated chronic pyelonephritis (disorder),SNOMED CT US Edition,2.16.840.1.113883.6.96
AXR Competing Diagnosis,2.16.840.1.113883.3.464.1004.2245,707211005,Invasive listeriosis (disorder),SNOMED CT US Edition,2.16.840.1.113883.6.96
AXR Competing Diagnosis,2.16.840.1.113883.3.464.1004.2245,707222009,Epidemic gastroenteritis (disorder),SNOMED CT US Edition,2.16.840.1.113883.6.96
AXR Competing Diagnosis,2.16.840.1.113883.3.464.1004.2245,707225006,Invasive meningococcal disease (disorder),SNOMED CT US Edition,2.16.840.1.113883.6.96
AXR Competing Diagnosis,2.16.840.1.113883.3.464.1004.2245,707235000,Acute multiple gingival abscesses (disorder),SNOMED CT US Edition,2.16.840.1.113883.6.96
AXR Competing Diagnosis,2.16.840.1.113883.3.464.1004.2245,707274007,Infection caused by carbapenem resistant bacteria (disorder),SNOMED CT US Edition,2.16.840.1.113883.6.96
AXR Competing Diagnosis,2.16.840.1.113883.3.464.1004.2245,707525005,Non-O1 and non-O139 Vibrio cholerae infection (disorder),SNOMED CT US Edition,2.16.840.1.113883.6.96
AXR Competing Diagnosis,2.16.840.1.113883.3.464.1004.2245,707834009,Acute on chronic cystitis (disorder),SNOMED CT US Edition,2.16.840.1.113883.6.96
AXR Competing Diagnosis,2.16.840.1.113883.3.464.1004.2245,708055005,Gingival disease caused by bacteria (disorder),SNOMED CT US Edition,2.16.840.1.113883.6.96
AXR Competing Diagnosis,2.16.840.1.113883.3.464.1004.2245,708126004,Recurrent candidiasis of vagina (disorder),SNOMED CT US Edition,2.16.840.1.113883.6.96
AXR Competing Diagnosis,2.16.840.1.113883.3.464.1004.2245,708164002,Gastritis caused by Helicobacter pylori (disorder),SNOMED CT US Edition,2.16.840.1.113883.6.96
AXR Competing Diagnosis,2.16.840.1.113883.3.464.1004.2245,708165001,Gastritis caused by Helicobacter heilmannii (disorder),SNOMED CT US Edition,2.16.840.1.113883.6.96
AXR Competing Diagnosis,2.16.840.1.113883.3.464.1004.2245,709200009,Bacterial arthritis of costotransverse joint (disorder),SNOMED CT US Edition,2.16.840.1.113883.6.96
AXR Competing Diagnosis,2.16.840.1.113883.3.464.1004.2245,709410003,Haemophilus influenzae type b infection (disorder),SNOMED CT US Edition,2.16.840.1.113883.6.96
AXR Competing Diagnosis,2.16.840.1.113883.3.464.1004.2245,710727006,Enlargement of root of tongue (disorder),SNOMED CT US Edition,2.16.840.1.113883.6.96
AXR Competing Diagnosis,2.16.840.1.113883.3.464.1004.2245,710729009,Woody tongue (disorder),SNOMED CT US Edition,2.16.840.1.113883.6.96
AXR Competing Diagnosis,2.16.840.1.113883.3.464.1004.2245,711167005,Enteritis caused by Yersinia enterocolitica (disorder),SNOMED CT US Edition,2.16.840.1.113883.6.96
AXR Competing Diagnosis,2.16.840.1.113883.3.464.1004.2245,711173006,Pit and fissure caries (disorder),SNOMED CT US Edition,2.16.840.1.113883.6.96
AXR Competing Diagnosis,2.16.840.1.113883.3.464.1004.2245,711174000,Interproximal enamel caries (disorder),SNOMED CT US Edition,2.16.840.1.113883.6.96
AXR Competing Diagnosis,2.16.840.1.113883.3.464.1004.2245,711175004,Caries of smooth surface of tooth (disorder),SNOMED CT US Edition,2.16.840.1.113883.6.96
AXR Competing Diagnosis,2.16.840.1.113883.3.464.1004.2245,711617002,Iritis caused by Treponema pallidum (disorder),SNOMED CT US Edition,2.16.840.1.113883.6.96
AXR Competing Diagnosis,2.16.840.1.113883.3.464.1004.2245,711644007,Endophthalmitis caused by Acanthamoeba (disorder),SNOMED CT US Edition,2.16.840.1.113883.6.96
AXR Competing Diagnosis,2.16.840.1.113883.3.464.1004.2245,711645008,Corneal ulcer caused by Acanthamoeba (disorder),SNOMED CT US Edition,2.16.840.1.113883.6.96
AXR Competing Diagnosis,2.16.840.1.113883.3.464.1004.2245,712521003,Bacterial arthritis caused by Haemophilus influenzae type b (disorder),SNOMED CT US Edition,2.16.840.1.113883.6.96
AXR Competing Diagnosis,2.16.840.1.113883.3.464.1004.2245,712524006,Bacterial arthritis of atlantoaxial joint (disorder),SNOMED CT US Edition,2.16.840.1.113883.6.96
AXR Competing Diagnosis,2.16.840.1.113883.3.464.1004.2245,712530006,Bacterial arthritis of costovertebral joint (disorder),SNOMED CT US Edition,2.16.840.1.113883.6.96
AXR Competing Diagnosis,2.16.840.1.113883.3.464.1004.2245,712531005,Bacterial infection caused by Streptococcus milleri group (disorder),SNOMED CT US Edition,2.16.840.1.113883.6.96
AXR Competing Diagnosis,2.16.840.1.113883.3.464.1004.2245,712547007,Bacterial arthritis of facet joint of thoracic spine (disorder),SNOMED CT US Edition,2.16.840.1.113883.6.96
AXR Competing Diagnosis,2.16.840.1.113883.3.464.1004.2245,712548002,Bacterial arthritis of facet joint of lumbar spine (disorder),SNOMED CT US Edition,2.16.840.1.113883.6.96
AXR Competing Diagnosis,2.16.840.1.113883.3.464.1004.2245,712549005,Bacterial arthritis of facet joint of cervical spine (disorder),SNOMED CT US Edition,2.16.840.1.113883.6.96
AXR Competing Diagnosis,2.16.840.1.113883.3.464.1004.2245,712583003,Intestinal infection caused by Plesiomonas shigelloides (disorder),SNOMED CT US Edition,2.16.840.1.113883.6.96
AXR Competing Diagnosis,2.16.840.1.113883.3.464.1004.2245,712657002,Infection caused by Fusobacterium (disorder),SNOMED CT US Edition,2.16.840.1.113883.6.96
AXR Competing Diagnosis,2.16.840.1.113883.3.464.1004.2245,712830002,Infection due to carbapenem resistant Enterobacteriaceae (disorder),SNOMED CT US Edition,2.16.840.1.113883.6.96
AXR Competing Diagnosis,2.16.840.1.113883.3.464.1004.2245,713014002,Infection caused by Borrelia miyamotoi (disorder),SNOMED CT US Edition,2.16.840.1.113883.6.96
AXR Competing Diagnosis,2.16.840.1.113883.3.464.1004.2245,713249002,Pyogenic granuloma of gingiva due to pregnancy (disorder),SNOMED CT US Edition,2.16.840.1.113883.6.96
AXR Competing Diagnosis,2.16.840.1.113883.3.464.1004.2245,713251003,Gingival disease caused by Treponema pallidum (disorder),SNOMED CT US Edition,2.16.840.1.113883.6.96
AXR Competing Diagnosis,2.16.840.1.113883.3.464.1004.2245,713261005,Gingival disease caused by Neisseria gonorrhoeae (disorder),SNOMED CT US Edition,2.16.840.1.113883.6.96
AXR Competing Diagnosis,2.16.840.1.113883.3.464.1004.2245,713312005,Bursitis caused by bacterial infection (disorder),SNOMED CT US Edition,2.16.840.1.113883.6.96
AXR Competing Diagnosis,2.16.840.1.113883.3.464.1004.2245,713453003,Renal impairment caused by Polyomavirus (disorder),SNOMED CT US Edition,2.16.840.1.113883.6.96
AXR Competing Diagnosis,2.16.840.1.113883.3.464.1004.2245,713455005,Infection caused by Streptococcus mitis group (disorder),SNOMED CT US Edition,2.16.840.1.113883.6.96
AXR Competing Diagnosis,2.16.840.1.113883.3.464.1004.2245,713614001,Drug resistant Streptococcus pneumoniae disease (disorder),SNOMED CT US Edition,2.16.840.1.113883.6.96
AXR Competing Diagnosis,2.16.840.1.113883.3.464.1004.2245,713865006,Perinatal sepsis caused by Streptococcus agalactiae (disorder),SNOMED CT US Edition,2.16.840.1.113883.6.96
AXR Competing Diagnosis,2.16.840.1.113883.3.464.1004.2245,713866007,Perinatal sepsis caused by Escherichia coli (disorder),SNOMED CT US Edition,2.16.840.1.113883.6.96
AXR Competing Diagnosis,2.16.840.1.113883.3.464.1004.2245,713886006,Nephropathy caused by BK polyomavirus (disorder),SNOMED CT US Edition,2.16.840.1.113883.6.96
AXR Competing Diagnosis,2.16.840.1.113883.3.464.1004.2245,714633003,Gingival disease caused by Streptococcus (disorder),SNOMED CT US Edition,2.16.840.1.113883.6.96
AXR Competing Diagnosis,2.16.840.1.113883.3.464.1004.2245,715053008,Dermatosis caused by plant mite (disorder),SNOMED CT US Edition,2.16.840.1.113883.6.96
AXR Competing Diagnosis,2.16.840.1.113883.3.464.1004.2245,715062005,Infection caused by Oesophagostomum radiatum (disorder),SNOMED CT US Edition,2.16.840.1.113883.6.96
AXR Competing Diagnosis,2.16.840.1.113883.3.464.1004.2245,715065007,Infection caused by Bartonella talpae (disorder),SNOMED CT US Edition,2.16.840.1.113883.6.96
AXR Competing Diagnosis,2.16.840.1.113883.3.464.1004.2245,715067004,Ulcerating cutaneous leishmaniasis of lower extremity (disorder),SNOMED CT US Edition,2.16.840.1.113883.6.96
AXR Competing Diagnosis,2.16.840.1.113883.3.464.1004.2245,715070000,Sepsis caused by Peptostreptococcus (disorder),SNOMED CT US Edition,2.16.840.1.113883.6.96
AXR Competing Diagnosis,2.16.840.1.113883.3.464.1004.2245,715071001,Sepsis caused by anaerobic streptococcus (disorder),SNOMED CT US Edition,2.16.840.1.113883.6.96
AXR Competing Diagnosis,2.16.840.1.113883.3.464.1004.2245,715145003,Infection caused by Escherichia coli serogroup O158 (disorder),SNOMED CT US Edition,2.16.840.1.113883.6.96
AXR Competing Diagnosis,2.16.840.1.113883.3.464.1004.2245,715149009,Shellfish poisoning caused by Gonyaulax catenella (disorder),SNOMED CT US Edition,2.16.840.1.113883.6.96
AXR Competing Diagnosis,2.16.840.1.113883.3.464.1004.2245,715266002,Infection of skin of eyelid and periocular region (disorder),SNOMED CT US Edition,2.16.840.1.113883.6.96
AXR Competing Diagnosis,2.16.840.1.113883.3.464.1004.2245,715507005,Infection of central nervous system caused by Borrelia burgdorferi (disorder),SNOMED CT US Edition,2.16.840.1.113883.6.96
AXR Competing Diagnosis,2.16.840.1.113883.3.464.1004.2245,715874005,Infection of skin caused by Neoscytalidium dimidiatum (disorder),SNOMED CT US Edition,2.16.840.1.113883.6.96
AXR Competing Diagnosis,2.16.840.1.113883.3.464.1004.2245,715892002,Onychomycosis caused by Neoscytalidium dimidiatum (disorder),SNOMED CT US Edition,2.16.840.1.113883.6.96
AXR Competing Diagnosis,2.16.840.1.113883.3.464.1004.2245,716364007,Caries of cervical margin of tooth (disorder),SNOMED CT US Edition,2.16.840.1.113883.6.96
AXR Competing Diagnosis,2.16.840.1.113883.3.464.1004.2245,716860005,Infection of intestine caused by cyclospora cayetanensis (disorder),SNOMED CT US Edition,2.16.840.1.113883.6.96
AXR Competing Diagnosis,2.16.840.1.113883.3.464.1004.2245,717875005,Infective duodenitis (disorder),SNOMED CT US Edition,2.16.840.1.113883.6.96
AXR Competing Diagnosis,2.16.840.1.113883.3.464.1004.2245,717876006,Phlegmonous enteritis of duodenum (disorder),SNOMED CT US Edition,2.16.840.1.113883.6.96
AXR Competing Diagnosis,2.16.840.1.113883.3.464.1004.2245,718232007,Pyogenic bacterial infection due to deficiency of myeloid differentiation primary response 88 (disorder),SNOMED CT US Edition,2.16.840.1.113883.6.96
AXR Competing Diagnosis,2.16.840.1.113883.3.464.1004.2245,718373005,Cutaneous B-cell pseudolymphoma caused by Borrelia (disorder),SNOMED CT US Edition,2.16.840.1.113883.6.96
AXR Competing Diagnosis,2.16.840.1.113883.3.464.1004.2245,719551008,Hematuria due to radiation cystitis (disorder),SNOMED CT US Edition,2.16.840.1.113883.6.96
AXR Competing Diagnosis,2.16.840.1.113883.3.464.1004.2245,719755001,Conjunctivitis of adulthood caused by Neisseria gonorrhoeae (disorder),SNOMED CT US Edition,2.16.840.1.113883.6.96
AXR Competing Diagnosis,2.16.840.1.113883.3.464.1004.2245,720989003,Endocarditis caused by Erysipelothrix rhusiopathiae (disorder),SNOMED CT US Edition,2.16.840.1.113883.6.96
AXR Competing Diagnosis,2.16.840.1.113883.3.464.1004.2245,720990007,Meningitis caused by Bacillus anthracis (disorder),SNOMED CT US Edition,2.16.840.1.113883.6.96
AXR Competing Diagnosis,2.16.840.1.113883.3.464.1004.2245,721102001,Osteomyelitis caused by Pasteurella multocida (disorder),SNOMED CT US Edition,2.16.840.1.113883.6.96
AXR Competing Diagnosis,2.16.840.1.113883.3.464.1004.2245,721159001,Dental caries due to fluorine deficiency (disorder),SNOMED CT US Edition,2.16.840.1.113883.6.96
AXR Competing Diagnosis,2.16.840.1.113883.3.464.1004.2245,721201001,Protozoal disease complicating pregnancy childbirth and the puerperium (disorder),SNOMED CT US Edition,2.16.840.1.113883.6.96
AXR Competing Diagnosis,2.16.840.1.113883.3.464.1004.2245,721240006,Meningitis caused by gram-negative aerobic coccus (disorder),SNOMED CT US Edition,2.16.840.1.113883.6.96
AXR Competing Diagnosis,2.16.840.1.113883.3.464.1004.2245,721241005,Meningitis caused by gram-negative aerobic bacillus (disorder),SNOMED CT US Edition,2.16.840.1.113883.6.96
AXR Competing Diagnosis,2.16.840.1.113883.3.464.1004.2245,721242003,Meningitis caused by Spirochaetes (disorder),SNOMED CT US Edition,2.16.840.1.113883.6.96
AXR Competing Diagnosis,2.16.840.1.113883.3.464.1004.2245,721245001,Myelitis caused by bacterium (disorder),SNOMED CT US Edition,2.16.840.1.113883.6.96
AXR Competing Diagnosis,2.16.840.1.113883.3.464.1004.2245,721250007,Abscess of spinal cord caused by bacterium (disorder),SNOMED CT US Edition,2.16.840.1.113883.6.96
AXR Competing Diagnosis,2.16.840.1.113883.3.464.1004.2245,721258000,Infection of lacrimal gland caused by bacterium (disorder),SNOMED CT US Edition,2.16.840.1.113883.6.96
AXR Competing Diagnosis,2.16.840.1.113883.3.464.1004.2245,721267000,Pyogenic infection of skin and subcutaneous tissues caused by bacterium (disorder),SNOMED CT US Edition,2.16.840.1.113883.6.96
AXR Competing Diagnosis,2.16.840.1.113883.3.464.1004.2245,721268005,Superficial folliculitis caused by bacterium (disorder),SNOMED CT US Edition,2.16.840.1.113883.6.96
AXR Competing Diagnosis,2.16.840.1.113883.3.464.1004.2245,721270001,Infection of diaper area (disorder),SNOMED CT US Edition,2.16.840.1.113883.6.96
AXR Competing Diagnosis,2.16.840.1.113883.3.464.1004.2245,721281003,Neonatal conjunctivitis and dacrocystitis caused by Neisseria gonorrhoeae (disorder),SNOMED CT US Edition,2.16.840.1.113883.6.96
AXR Competing Diagnosis,2.16.840.1.113883.3.464.1004.2245,721572008,Sepsis caused by Pseudomonas aeruginosa (disorder),SNOMED CT US Edition,2.16.840.1.113883.6.96
AXR Competing Diagnosis,2.16.840.1.113883.3.464.1004.2245,721583004,Mucocutaneous early congenital syphilis (disorder),SNOMED CT US Edition,2.16.840.1.113883.6.96
AXR Competing Diagnosis,2.16.840.1.113883.3.464.1004.2245,721585006,Sexually transmissible infection caused by Herpes simplex virus (disorder),SNOMED CT US Edition,2.16.840.1.113883.6.96
AXR Competing Diagnosis,2.16.840.1.113883.3.464.1004.2245,721587003,Sexually transmissible infection caused by human papillomavirus (disorder),SNOMED CT US Edition,2.16.840.1.113883.6.96
AXR Competing Diagnosis,2.16.840.1.113883.3.464.1004.2245,721588008,Hepatitis caused by sexually transmissible virus (disorder),SNOMED CT US Edition,2.16.840.1.113883.6.96
AXR Competing Diagnosis,2.16.840.1.113883.3.464.1004.2245,721589000,Sexually transmissible infection caused by Molluscum contagiosum virus (disorder),SNOMED CT US Edition,2.16.840.1.113883.6.96
AXR Competing Diagnosis,2.16.840.1.113883.3.464.1004.2245,721590009,Infection of anogenital region caused by Molluscum contagiosum virus (disorder),SNOMED CT US Edition,2.16.840.1.113883.6.96
AXR Competing Diagnosis,2.16.840.1.113883.3.464.1004.2245,721657003,Food poisoning caused by Listeria monocytogenes (disorder),SNOMED CT US Edition,2.16.840.1.113883.6.96
AXR Competing Diagnosis,2.16.840.1.113883.3.464.1004.2245,721659000,Parasitic infection causing inflammation of small intestine (disorder),SNOMED CT US Edition,2.16.840.1.113883.6.96
AXR Competing Diagnosis,2.16.840.1.113883.3.464.1004.2245,721681005,Colitis caused by bacterium (disorder),SNOMED CT US Edition,2.16.840.1.113883.6.96
AXR Competing Diagnosis,2.16.840.1.113883.3.464.1004.2245,721682003,Colitis caused by Salmonella (disorder),SNOMED CT US Edition,2.16.840.1.113883.6.96
AXR Competing Diagnosis,2.16.840.1.113883.3.464.1004.2245,721683008,Infection causing abscess of colon (disorder),SNOMED CT US Edition,2.16.840.1.113883.6.96
AXR Competing Diagnosis,2.16.840.1.113883.3.464.1004.2245,721684002,Colitis caused by protozoan (disorder),SNOMED CT US Edition,2.16.840.1.113883.6.96
AXR Competing Diagnosis,2.16.840.1.113883.3.464.1004.2245,721685001,Parasitic infection causing colitis (disorder),SNOMED CT US Edition,2.16.840.1.113883.6.96
AXR Competing Diagnosis,2.16.840.1.113883.3.464.1004.2245,721728007,Infection caused by Enterobacter (disorder),SNOMED CT US Edition,2.16.840.1.113883.6.96
AXR Competing Diagnosis,2.16.840.1.113883.3.464.1004.2245,721729004,Meningitis caused by Enterobacter (disorder),SNOMED CT US Edition,2.16.840.1.113883.6.96
AXR Competing Diagnosis,2.16.840.1.113883.3.464.1004.2245,721730009,Infection caused by Helicobacter pylori (disorder),SNOMED CT US Edition,2.16.840.1.113883.6.96
AXR Competing Diagnosis,2.16.840.1.113883.3.464.1004.2245,721732001,Infection of musculoskeletal system caused by Mycobacterium tuberculosis (disorder),SNOMED CT US Edition,2.16.840.1.113883.6.96
AXR Competing Diagnosis,2.16.840.1.113883.3.464.1004.2245,721734000,Infection caused by Francisella (disorder),SNOMED CT US Edition,2.16.840.1.113883.6.96
AXR Competing Diagnosis,2.16.840.1.113883.3.464.1004.2245,721735004,Infection caused by Bacillus cereus (disorder),SNOMED CT US Edition,2.16.840.1.113883.6.96
AXR Competing Diagnosis,2.16.840.1.113883.3.464.1004.2245,721736003,Infection caused by Burkholderia (disorder),SNOMED CT US Edition,2.16.840.1.113883.6.96
AXR Competing Diagnosis,2.16.840.1.113883.3.464.1004.2245,721737007,Infection caused by Spirillum (disorder),SNOMED CT US Edition,2.16.840.1.113883.6.96
