Value Set Name,Value Set OID,Code,Definition,Code System,Code System OID
Diagnostic Radiology,2.16.840.1.113883.3.464.1004.1081,16444861000119109,Transcervical recanalization of fallopian tube with catheter using fluoroscopic guidance (procedure),SNOMED CT US Edition,2.16.840.1.113883.6.96
Diagnostic Radiology,2.16.840.1.113883.3.464.1004.1081,16444991000119109,"Computed tomography of kidney, ureter and urinary bladder without contrast (procedure)",SNOMED CT US Edition,2.16.840.1.113883.6.96
Diagnostic Radiology,2.16.840.1.113883.3.464.1004.1081,16446101000119108,Ultrasonography of abdomen for ascites (procedure),SNOMED CT US Edition,2.16.840.1.113883.6.96
Diagnostic Radiology,2.16.840.1.113883.3.464.1004.1081,16446481000119106,Percutaneous core needle biopsy of thyroid using ultrasonographic guidance (procedure),SNOMED CT US Edition,2.16.840.1.113883.6.96
Diagnostic Radiology,2.16.840.1.113883.3.464.1004.1081,16446541000119100,Ultrasonography of soft tissue of head and neck (procedure),SNOMED CT US Edition,2.16.840.1.113883.6.96
Diagnostic Radiology,2.16.840.1.113883.3.464.1004.1081,16446591000119108,Ultrasonography of mass of soft tissue of neck (procedure),SNOMED CT US Edition,2.16.840.1.113883.6.96
Diagnostic Radiology,2.16.840.1.113883.3.464.1004.1081,16446991000119104,Ultrasonography of soft tissue mass of limb (procedure),SNOMED CT US Edition,2.16.840.1.113883.6.96
Diagnostic Radiology,2.16.840.1.113883.3.464.1004.1081,16451571000119101,Needle biopsy of right kidney using ultrasonographic guidance (procedure),SNOMED CT US Edition,2.16.840.1.113883.6.96
Diagnostic Radiology,2.16.840.1.113883.3.464.1004.1081,16451621000119103,Needle biopsy of left kidney using ultrasonographic guidance (procedure),SNOMED CT US Edition,2.16.840.1.113883.6.96
Diagnostic Radiology,2.16.840.1.113883.3.464.1004.1081,16452511000119101,Fluoroscopic angiography of artery of limb with contrast (procedure),SNOMED CT US Edition,2.16.840.1.113883.6.96
Diagnostic Radiology,2.16.840.1.113883.3.464.1004.1081,16456981000119100,Intraoperative fluoroscopic cholangiogram (procedure),SNOMED CT US Edition,2.16.840.1.113883.6.96
Diagnostic Radiology,2.16.840.1.113883.3.464.1004.1081,16457501000119102,Computed tomography of abdomen and pelvis without contrast (procedure),SNOMED CT US Edition,2.16.840.1.113883.6.96
Diagnostic Radiology,2.16.840.1.113883.3.464.1004.1081,16457791000119101,Percutaneous injection of pseudoaneurysm of left limb using ultrasonographic guidance (procedure),SNOMED CT US Edition,2.16.840.1.113883.6.96
Diagnostic Radiology,2.16.840.1.113883.3.464.1004.1081,16457831000119107,Percutaneous injection of pseudoaneurysm of right limb using ultrasonographic guidance (procedure),SNOMED CT US Edition,2.16.840.1.113883.6.96
Diagnostic Radiology,2.16.840.1.113883.3.464.1004.1081,16459631000119104,Fluoroscopic angiography of artery of left upper limb with contrast (procedure),SNOMED CT US Edition,2.16.840.1.113883.6.96
Diagnostic Radiology,2.16.840.1.113883.3.464.1004.1081,16460061000119103,Percutaneous needle biopsy of left kidney using ultrasonographic guidance (procedure),SNOMED CT US Edition,2.16.840.1.113883.6.96
Diagnostic Radiology,2.16.840.1.113883.3.464.1004.1081,16460111000119102,Percutaneous needle biopsy of right kidney using ultrasonographic guidance (procedure),SNOMED CT US Edition,2.16.840.1.113883.6.96
Diagnostic Radiology,2.16.840.1.113883.3.464.1004.1081,16460411000119108,Ultrasonography of surgical specimen (procedure),SNOMED CT US Edition,2.16.840.1.113883.6.96
Diagnostic Radiology,2.16.840.1.113883.3.464.1004.1081,16462121000119108,Computed tomography angiography of thorax and abdomen and pelvis with contrast (procedure),SNOMED CT US Edition,2.16.840.1.113883.6.96
Diagnostic Radiology,2.16.840.1.113883.3.464.1004.1081,16464181000119103,Fluoroscopic angiography of arteries of bilateral extremities with contrast (procedure),SNOMED CT US Edition,2.16.840.1.113883.6.96
Diagnostic Radiology,2.16.840.1.113883.3.464.1004.1081,16464851000119104,Fluoroscopic angiography of arteriovenous shunt with contrast (procedure),SNOMED CT US Edition,2.16.840.1.113883.6.96
Diagnostic Radiology,2.16.840.1.113883.3.464.1004.1081,16520681000119101,Injection of thrombin into pseudoaneurysm of extremity using fluoroscopic guidance (procedure),SNOMED CT US Edition,2.16.840.1.113883.6.96
Diagnostic Radiology,2.16.840.1.113883.3.464.1004.1081,16520741000119101,Needle biopsy of salivary gland using computed tomography guidance (procedure),SNOMED CT US Edition,2.16.840.1.113883.6.96
Diagnostic Radiology,2.16.840.1.113883.3.464.1004.1081,16520881000119102,Fluoroscopic angiography of bilateral internal mammary arteries with contrast (procedure),SNOMED CT US Edition,2.16.840.1.113883.6.96
Diagnostic Radiology,2.16.840.1.113883.3.464.1004.1081,16520921000119109,Percutaneous needle biopsy of muscle using fluoroscopic guidance (procedure),SNOMED CT US Edition,2.16.840.1.113883.6.96
Diagnostic Radiology,2.16.840.1.113883.3.464.1004.1081,16522691000119102,Computed tomography for bone length measurement (procedure),SNOMED CT US Edition,2.16.840.1.113883.6.96
Diagnostic Radiology,2.16.840.1.113883.3.464.1004.1081,16522741000119100,Plain X-ray for bone length measurement (procedure),SNOMED CT US Edition,2.16.840.1.113883.6.96
Diagnostic Radiology,2.16.840.1.113883.3.464.1004.1081,16523851000119103,Needle puncture and aspiration of abscess of rectum using computed tomography guidance (procedure),SNOMED CT US Edition,2.16.840.1.113883.6.96
Diagnostic Radiology,2.16.840.1.113883.3.464.1004.1081,16523911000119105,Percutaneous needle puncture and aspiration of abscess of neck using computed tomography guidance (procedure),SNOMED CT US Edition,2.16.840.1.113883.6.96
Diagnostic Radiology,2.16.840.1.113883.3.464.1004.1081,16523971000119102,Needle puncture and aspiration of abscess of abdomen using computed tomography guidance (procedure),SNOMED CT US Edition,2.16.840.1.113883.6.96
Diagnostic Radiology,2.16.840.1.113883.3.464.1004.1081,16534101000119106,Single photon emission computed tomography with computed tomography of liver using technetium Tc^99m^ sulfur colloid (procedure),SNOMED CT US Edition,2.16.840.1.113883.6.96
Diagnostic Radiology,2.16.840.1.113883.3.464.1004.1081,16534151000119105,Single photon emission computed tomography with computed tomography of liver (procedure),SNOMED CT US Edition,2.16.840.1.113883.6.96
Diagnostic Radiology,2.16.840.1.113883.3.464.1004.1081,16534201000119102,Radionuclide esophageal motility study (procedure),SNOMED CT US Edition,2.16.840.1.113883.6.96
Diagnostic Radiology,2.16.840.1.113883.3.464.1004.1081,16534261000119101,Radionuclide scan of sentinel lymph node of breast (procedure),SNOMED CT US Edition,2.16.840.1.113883.6.96
Diagnostic Radiology,2.16.840.1.113883.3.464.1004.1081,16534311000119107,Radionuclide scan of bone marrow of whole body (procedure),SNOMED CT US Edition,2.16.840.1.113883.6.96
Diagnostic Radiology,2.16.840.1.113883.3.464.1004.1081,16534461000119100,Radionuclide scan of lymphatics and lymph nodes of breast (procedure),SNOMED CT US Edition,2.16.840.1.113883.6.96
Diagnostic Radiology,2.16.840.1.113883.3.464.1004.1081,16534511000119102,Single photon emission computed tomography of bones of whole body (procedure),SNOMED CT US Edition,2.16.840.1.113883.6.96
Diagnostic Radiology,2.16.840.1.113883.3.464.1004.1081,16545191000119100,Radionuclide myocardial perfusion stress study (procedure),SNOMED CT US Edition,2.16.840.1.113883.6.96
Diagnostic Radiology,2.16.840.1.113883.3.464.1004.1081,16545381000119101,Single photon emission computed tomography of myocardial perfusion with computed tomography (procedure),SNOMED CT US Edition,2.16.840.1.113883.6.96
Diagnostic Radiology,2.16.840.1.113883.3.464.1004.1081,16545811000119100,Positron emission tomography myocardial metabolism study (procedure),SNOMED CT US Edition,2.16.840.1.113883.6.96
Diagnostic Radiology,2.16.840.1.113883.3.464.1004.1081,16546531000119101,Plain X-ray for bone age (procedure),SNOMED CT US Edition,2.16.840.1.113883.6.96
Diagnostic Radiology,2.16.840.1.113883.3.464.1004.1081,16547731000119108,Diagnostic lumbar puncture using fluoroscopic guidance (procedure),SNOMED CT US Edition,2.16.840.1.113883.6.96
Diagnostic Radiology,2.16.840.1.113883.3.464.1004.1081,16547791000119107,Needle biopsy of mass of retroperitoneum using computed tomography guidance (procedure),SNOMED CT US Edition,2.16.840.1.113883.6.96
Diagnostic Radiology,2.16.840.1.113883.3.464.1004.1081,16547871000119103,Needle aspiration of cyst of left kidney using computed tomography guidance (procedure),SNOMED CT US Edition,2.16.840.1.113883.6.96
Diagnostic Radiology,2.16.840.1.113883.3.464.1004.1081,16547921000119107,Needle aspiration of cyst of right kidney using computed tomography guidance (procedure),SNOMED CT US Edition,2.16.840.1.113883.6.96
Diagnostic Radiology,2.16.840.1.113883.3.464.1004.1081,16548031000119107,Radionuclide scan of whole body using technetium sestamibi for localization of neoplasm (procedure),SNOMED CT US Edition,2.16.840.1.113883.6.96
Diagnostic Radiology,2.16.840.1.113883.3.464.1004.1081,16548181000119109,Radionuclide scan of whole body using gallium for localization of neoplasm (procedure),SNOMED CT US Edition,2.16.840.1.113883.6.96
Diagnostic Radiology,2.16.840.1.113883.3.464.1004.1081,16548241000119107,Radionuclide scan of whole body using octreotide for localization of neoplasm (procedure),SNOMED CT US Edition,2.16.840.1.113883.6.96
Diagnostic Radiology,2.16.840.1.113883.3.464.1004.1081,16548901000119104,Single photon emission computed tomography of kidney (procedure),SNOMED CT US Edition,2.16.840.1.113883.6.96
Diagnostic Radiology,2.16.840.1.113883.3.464.1004.1081,16548951000119100,Single photon emission computed tomography of brain (procedure),SNOMED CT US Edition,2.16.840.1.113883.6.96
Diagnostic Radiology,2.16.840.1.113883.3.464.1004.1081,16549001000119105,Therapeutic injection of right hip using fluoroscopic guidance (procedure),SNOMED CT US Edition,2.16.840.1.113883.6.96
Diagnostic Radiology,2.16.840.1.113883.3.464.1004.1081,16549151000119108,Therapeutic injection of right knee using fluoroscopic guidance (procedure),SNOMED CT US Edition,2.16.840.1.113883.6.96
Diagnostic Radiology,2.16.840.1.113883.3.464.1004.1081,16549301000119107,Therapeutic injection of right wrist using fluoroscopic guidance (procedure),SNOMED CT US Edition,2.16.840.1.113883.6.96
Diagnostic Radiology,2.16.840.1.113883.3.464.1004.1081,16549351000119106,Therapeutic injection of left wrist using fluoroscopic guidance (procedure),SNOMED CT US Edition,2.16.840.1.113883.6.96
Diagnostic Radiology,2.16.840.1.113883.3.464.1004.1081,16549441000119102,Radionuclide scan of cerebrospinal fluid flow of brain using indium 111 (procedure),SNOMED CT US Edition,2.16.840.1.113883.6.96
Diagnostic Radiology,2.16.840.1.113883.3.464.1004.1081,16549591000119109,Percutaneous biopsy of right lung using computed tomography guidance (procedure),SNOMED CT US Edition,2.16.840.1.113883.6.96
Diagnostic Radiology,2.16.840.1.113883.3.464.1004.1081,16549641000119100,Percutaneous biopsy of left lung using computed tomography guidance (procedure),SNOMED CT US Edition,2.16.840.1.113883.6.96
Diagnostic Radiology,2.16.840.1.113883.3.464.1004.1081,16549791000119102,Needle biopsy of left kidney using computed tomography guidance (procedure),SNOMED CT US Edition,2.16.840.1.113883.6.96
Diagnostic Radiology,2.16.840.1.113883.3.464.1004.1081,16549841000119104,Needle biopsy of right kidney using computed tomography guidance (procedure),SNOMED CT US Edition,2.16.840.1.113883.6.96
Diagnostic Radiology,2.16.840.1.113883.3.464.1004.1081,16549891000119107,Percutaneous needle biopsy of adrenal gland using computed tomography guidance (procedure),SNOMED CT US Edition,2.16.840.1.113883.6.96
Diagnostic Radiology,2.16.840.1.113883.3.464.1004.1081,16550001000119100,Percutaneous drainage of lesion of pelvis using computed tomography guidance (procedure),SNOMED CT US Edition,2.16.840.1.113883.6.96
Diagnostic Radiology,2.16.840.1.113883.3.464.1004.1081,16550051000119101,Radiofrequency ablation of lesion of left kidney using computed tomography guidance (procedure),SNOMED CT US Edition,2.16.840.1.113883.6.96
Diagnostic Radiology,2.16.840.1.113883.3.464.1004.1081,16550101000119101,Radiofrequency ablation of lesion of right kidney using computed tomography guidance (procedure),SNOMED CT US Edition,2.16.840.1.113883.6.96
Diagnostic Radiology,2.16.840.1.113883.3.464.1004.1081,16550151000119102,Percutaneous cryoablation of neoplasm of right kidney using computed tomography guidance (procedure),SNOMED CT US Edition,2.16.840.1.113883.6.96
Diagnostic Radiology,2.16.840.1.113883.3.464.1004.1081,16550201000119105,Percutaneous cryoablation of neoplasm of left kidney using computed tomography guidance (procedure),SNOMED CT US Edition,2.16.840.1.113883.6.96
Diagnostic Radiology,2.16.840.1.113883.3.464.1004.1081,16550981000119107,Percutaneous needle biopsy of muscle using computed tomography guidance (procedure),SNOMED CT US Edition,2.16.840.1.113883.6.96
Diagnostic Radiology,2.16.840.1.113883.3.464.1004.1081,16551041000119108,Needle puncture and aspiration of lesion of right lower leg using computed tomography guidance (procedure),SNOMED CT US Edition,2.16.840.1.113883.6.96
Diagnostic Radiology,2.16.840.1.113883.3.464.1004.1081,16551091000119100,Percutaneous fine needle aspiration biopsy of joint of left hip using computed tomography guidance (procedure),SNOMED CT US Edition,2.16.840.1.113883.6.96
Diagnostic Radiology,2.16.840.1.113883.3.464.1004.1081,16551141000119107,Percutaneous fine needle aspiration biopsy of joint of right hip using computed tomography guidance (procedure),SNOMED CT US Edition,2.16.840.1.113883.6.96
Diagnostic Radiology,2.16.840.1.113883.3.464.1004.1081,16551191000119104,Percutaneous fine needle aspiration biopsy of chest using computed tomography guidance (procedure),SNOMED CT US Edition,2.16.840.1.113883.6.96
Diagnostic Radiology,2.16.840.1.113883.3.464.1004.1081,16551241000119104,Needle puncture and aspiration of lesion of left lower leg using computed tomography guidance (procedure),SNOMED CT US Edition,2.16.840.1.113883.6.96
Diagnostic Radiology,2.16.840.1.113883.3.464.1004.1081,16552301000119102,Single photon emission computed tomography of whole body for localization of neoplasm (procedure),SNOMED CT US Edition,2.16.840.1.113883.6.96
Diagnostic Radiology,2.16.840.1.113883.3.464.1004.1081,16553741000119105,Radionuclide scan of whole body for localization of inflammation (procedure),SNOMED CT US Edition,2.16.840.1.113883.6.96
Diagnostic Radiology,2.16.840.1.113883.3.464.1004.1081,16553961000119107,Single photon emission computed tomography of whole body for localization of abscess (procedure),SNOMED CT US Edition,2.16.840.1.113883.6.96
Diagnostic Radiology,2.16.840.1.113883.3.464.1004.1081,16554061000119109,Computed tomography myelogram of lumbosacral spine with lumbar injection of contrast (procedure),SNOMED CT US Edition,2.16.840.1.113883.6.96
Diagnostic Radiology,2.16.840.1.113883.3.464.1004.1081,16554361000119106,Positron emission tomography with computed tomography of brain (procedure),SNOMED CT US Edition,2.16.840.1.113883.6.96
Diagnostic Radiology,2.16.840.1.113883.3.464.1004.1081,16554411000119104,Positron emission tomography with computed tomography of heart (procedure),SNOMED CT US Edition,2.16.840.1.113883.6.96
Diagnostic Radiology,2.16.840.1.113883.3.464.1004.1081,16554511000119103,Single photon emission computed tomography using gallium radiolabeled white blood cells for localization of inflammation (procedure),SNOMED CT US Edition,2.16.840.1.113883.6.96
Diagnostic Radiology,2.16.840.1.113883.3.464.1004.1081,16554571000119106,Single photon emission computed tomography with computed tomography for localization of inflammation (procedure),SNOMED CT US Edition,2.16.840.1.113883.6.96
Diagnostic Radiology,2.16.840.1.113883.3.464.1004.1081,16554721000119102,Single photon emission computed tomography for localization of inflammation (procedure),SNOMED CT US Edition,2.16.840.1.113883.6.96
Diagnostic Radiology,2.16.840.1.113883.3.464.1004.1081,16555401000119103,Therapeutic injection of left hip using fluoroscopic guidance (procedure),SNOMED CT US Edition,2.16.840.1.113883.6.96
Diagnostic Radiology,2.16.840.1.113883.3.464.1004.1081,16555451000119104,Therapeutic injection of left knee using fluoroscopic guidance (procedure),SNOMED CT US Edition,2.16.840.1.113883.6.96
Diagnostic Radiology,2.16.840.1.113883.3.464.1004.1081,16555501000119102,Injection of celiac plexus using computed tomography guidance (procedure),SNOMED CT US Edition,2.16.840.1.113883.6.96
Diagnostic Radiology,2.16.840.1.113883.3.464.1004.1081,16555561000119101,Therapeutic injection of right shoulder using fluoroscopic guidance (procedure),SNOMED CT US Edition,2.16.840.1.113883.6.96
Diagnostic Radiology,2.16.840.1.113883.3.464.1004.1081,16555611000119103,Therapeutic injection of left shoulder using fluoroscopic guidance (procedure),SNOMED CT US Edition,2.16.840.1.113883.6.96
Diagnostic Radiology,2.16.840.1.113883.3.464.1004.1081,16557031000119108,Needle biopsy of thyroid using fluoroscopic guidance (procedure),SNOMED CT US Edition,2.16.840.1.113883.6.96
Diagnostic Radiology,2.16.840.1.113883.3.464.1004.1081,16558481000119100,Percutaneous cryoablation of lesion of liver using computed tomography guidance (procedure),SNOMED CT US Edition,2.16.840.1.113883.6.96
Diagnostic Radiology,2.16.840.1.113883.3.464.1004.1081,16558541000119106,Needle puncture and aspiration of bursa of left ankle using computed tomography guidance (procedure),SNOMED CT US Edition,2.16.840.1.113883.6.96
Diagnostic Radiology,2.16.840.1.113883.3.464.1004.1081,16558601000119105,Needle aspiration of bursa of right ankle using computed tomography guidance (procedure),SNOMED CT US Edition,2.16.840.1.113883.6.96
Diagnostic Radiology,2.16.840.1.113883.3.464.1004.1081,16558661000119106,Needle puncture and aspiration of bursa of left knee using computed tomography guidance (procedure),SNOMED CT US Edition,2.16.840.1.113883.6.96
Diagnostic Radiology,2.16.840.1.113883.3.464.1004.1081,16558721000119108,Needle aspiration of bursa of right hip using computed tomography guidance (procedure),SNOMED CT US Edition,2.16.840.1.113883.6.96
Diagnostic Radiology,2.16.840.1.113883.3.464.1004.1081,16558781000119107,Needle aspiration of bursa of left hip using computed tomography guidance (procedure),SNOMED CT US Edition,2.16.840.1.113883.6.96
Diagnostic Radiology,2.16.840.1.113883.3.464.1004.1081,16558841000119108,Needle aspiration of bursa of left shoulder using computed tomography guidance (procedure),SNOMED CT US Edition,2.16.840.1.113883.6.96
Diagnostic Radiology,2.16.840.1.113883.3.464.1004.1081,16558901000119101,Needle aspiration of bursa of right shoulder using computed tomography guidance (procedure),SNOMED CT US Edition,2.16.840.1.113883.6.96
Diagnostic Radiology,2.16.840.1.113883.3.464.1004.1081,16558961000119100,Needle aspiration of bursa of right knee using computed tomography guidance (procedure),SNOMED CT US Edition,2.16.840.1.113883.6.96
Diagnostic Radiology,2.16.840.1.113883.3.464.1004.1081,16559021000119103,Fine needle aspiration biopsy of spleen using computed tomography guidance (procedure),SNOMED CT US Edition,2.16.840.1.113883.6.96
Diagnostic Radiology,2.16.840.1.113883.3.464.1004.1081,16559081000119104,Cryoablation of lesion of lung using computed tomography guidance (procedure),SNOMED CT US Edition,2.16.840.1.113883.6.96
Diagnostic Radiology,2.16.840.1.113883.3.464.1004.1081,16559141000119108,Percutaneous fine needle aspiration biopsy of pelvis using computed tomography guidance (procedure),SNOMED CT US Edition,2.16.840.1.113883.6.96
Diagnostic Radiology,2.16.840.1.113883.3.464.1004.1081,16559201000119102,Percutaneous needle biopsy of mass of abdomen using computed tomography guidance (procedure),SNOMED CT US Edition,2.16.840.1.113883.6.96
Diagnostic Radiology,2.16.840.1.113883.3.464.1004.1081,16559261000119101,Percutaneous fine needle aspiration biopsy of pseudocyst of pancreas using computed tomography guidance (procedure),SNOMED CT US Edition,2.16.840.1.113883.6.96
Diagnostic Radiology,2.16.840.1.113883.3.464.1004.1081,16559321000119100,Fine needle aspiration biopsy of abdomen using computed tomography guidance (procedure),SNOMED CT US Edition,2.16.840.1.113883.6.96
Diagnostic Radiology,2.16.840.1.113883.3.464.1004.1081,16559621000119108,Biopsy of neck using computed tomography guidance (procedure),SNOMED CT US Edition,2.16.840.1.113883.6.96
Diagnostic Radiology,2.16.840.1.113883.3.464.1004.1081,16559741000119107,Percutaneous needle biopsy of cyst of spinal cord using computed tomography guidance (procedure),SNOMED CT US Edition,2.16.840.1.113883.6.96
Diagnostic Radiology,2.16.840.1.113883.3.464.1004.1081,16559801000119103,Aspiration of cyst of spinal synovium using computed tomography guidance (procedure),SNOMED CT US Edition,2.16.840.1.113883.6.96
Diagnostic Radiology,2.16.840.1.113883.3.464.1004.1081,16561811000119107,Magnetic resonance imaging of internal auditory meatus without contrast (procedure),SNOMED CT US Edition,2.16.840.1.113883.6.96
Diagnostic Radiology,2.16.840.1.113883.3.464.1004.1081,997199941000119102,Fluoroscopic venography of left limb with contrast (procedure),SNOMED CT US Edition,2.16.840.1.113883.6.96
Hospice Encounter,2.16.840.1.113883.3.464.1004.1761,G9473,"Services performed by chaplain in the hospice setting, each 15 minutes (G9473)",HCPCS,2.16.840.1.113883.6.285
Hospice Encounter,2.16.840.1.113883.3.464.1004.1761,G9474,"Services performed by dietary counselor in the hospice setting, each 15 minutes (G9474)",HCPCS,2.16.840.1.113883.6.285
Hospice Encounter,2.16.840.1.113883.3.464.1004.1761,G9475,"Services performed by other counselor in the hospice setting, each 15 minutes (G9475)",HCPCS,2.16.840.1.113883.6.285
Hospice Encounter,2.16.840.1.113883.3.464.1004.1761,G9476,"Services performed by volunteer in the hospice setting, each 15 minutes (G9476)",HCPCS,2.16.840.1.113883.6.285
Hospice Encounter,2.16.840.1.113883.3.464.1004.1761,G9477,"Services performed by care coordinator in the hospice setting, each 15 minutes (G9477)",HCPCS,2.16.840.1.113883.6.285
Hospice Encounter,2.16.840.1.113883.3.464.1004.1761,G9478,"Services performed by other qualified therapist in the hospice setting, each 15 minutes (G9478)",HCPCS,2.16.840.1.113883.6.285
Hospice Encounter,2.16.840.1.113883.3.464.1004.1761,G9479,"Services performed by qualified pharmacist in the hospice setting, each 15 minutes (G9479)",HCPCS,2.16.840.1.113883.6.285
Hospice Encounter,2.16.840.1.113883.3.464.1004.1761,Q5003,Hospice care provided in nursing long term care facility (ltc) or non-skilled nursing facility (nf) (Q5003),HCPCS,2.16.840.1.113883.6.285
Hospice Encounter,2.16.840.1.113883.3.464.1004.1761,Q5004,Hospice care provided in skilled nursing facility (snf) (Q5004),HCPCS,2.16.840.1.113883.6.285
Hospice Encounter,2.16.840.1.113883.3.464.1004.1761,Q5005,Hospice care provided in inpatient hospital (Q5005),HCPCS,2.16.840.1.113883.6.285
Hospice Encounter,2.16.840.1.113883.3.464.1004.1761,Q5006,Hospice care provided in inpatient hospice facility (Q5006),HCPCS,2.16.840.1.113883.6.285
Hospice Encounter,2.16.840.1.113883.3.464.1004.1761,Q5007,Hospice care provided in long term care facility (Q5007),HCPCS,2.16.840.1.113883.6.285
Hospice Encounter,2.16.840.1.113883.3.464.1004.1761,Q5008,Hospice care provided in inpatient psychiatric facility (Q5008),HCPCS,2.16.840.1.113883.6.285
Hospice Encounter,2.16.840.1.113883.3.464.1004.1761,Q5010,Hospice home care provided in a hospice facility (Q5010),HCPCS,2.16.840.1.113883.6.285
Hospice Encounter,2.16.840.1.113883.3.464.1004.1761,S9126,"Hospice care, in the home, per diem (S9126)",HCPCS,2.16.840.1.113883.6.285
Hospice Encounter,2.16.840.1.113883.3.464.1004.1761,T2042,Hospice routine home care; per diem (T2042),HCPCS,2.16.840.1.113883.6.285
Hospice Encounter,2.16.840.1.113883.3.464.1004.1761,T2043,Hospice continuous home care; per hour (T2043),HCPCS,2.16.840.1.113883.6.285
Hospice Encounter,2.16.840.1.113883.3.464.1004.1761,T2044,Hospice inpatient respite care; per diem (T2044),HCPCS,2.16.840.1.113883.6.285
Hospice Encounter,2.16.840.1.113883.3.464.1004.1761,T2045,Hospice general inpatient care; per diem (T2045),HCPCS,2.16.840.1.113883.6.285
Hospice Encounter,2.16.840.1.113883.3.464.1004.1761,T2046,"Hospice long term care, room and board only; per diem (T2046)",HCPCS,2.16.840.1.113883.6.285
Hospice Encounter,2.16.840.1.113883.3.464.1004.1761,183919006,Urgent admission to hospice (procedure),SNOMED CT US Edition,2.16.840.1.113883.6.96
Hospice Encounter,2.16.840.1.113883.3.464.1004.1761,183920000,Routine admission to hospice (procedure),SNOMED CT US Edition,2.16.840.1.113883.6.96
Hospice Encounter,2.16.840.1.113883.3.464.1004.1761,183921001,Admission to hospice for respite (procedure),SNOMED CT US Edition,2.16.840.1.113883.6.96
Hospice Encounter,2.16.840.1.113883.3.464.1004.1761,305336008,Admission to hospice (procedure),SNOMED CT US Edition,2.16.840.1.113883.6.96
Hospice Encounter,2.16.840.1.113883.3.464.1004.1761,305911006,Seen in hospice (finding),SNOMED CT US Edition,2.16.840.1.113883.6.96
Hospice Encounter,2.16.840.1.113883.3.464.1004.1761,385765002,Hospice care management (procedure),SNOMED CT US Edition,2.16.840.1.113883.6.96
Hospice Encounter,2.16.840.1.113883.3.464.1004.1761,0115,,UBREV,2.16.840.1.113883.6.301.3
Hospice Encounter,2.16.840.1.113883.3.464.1004.1761,0125,,UBREV,2.16.840.1.113883.6.301.3
Hospice Encounter,2.16.840.1.113883.3.464.1004.1761,0135,,UBREV,2.16.840.1.113883.6.301.3
Hospice Encounter,2.16.840.1.113883.3.464.1004.1761,0145,,UBREV,2.16.840.1.113883.6.301.3
Hospice Encounter,2.16.840.1.113883.3.464.1004.1761,0155,,UBREV,2.16.840.1.113883.6.301.3
Hospice Encounter,2.16.840.1.113883.3.464.1004.1761,0235,,UBREV,2.16.840.1.113883.6.301.3
Hospice Encounter,2.16.840.1.113883.3.464.1004.1761,0650,,UBREV,2.16.840.1.113883.6.301.3
