Value Set Name,Value Set OID,Code,Definition,Code System,Code System OID
Diagnostic Radiology,2.16.840.1.113883.3.464.1004.1081,4951000087105,Computed tomography of bilateral forearms (procedure),SNOMED CT US Edition,2.16.840.1.113883.6.96
Diagnostic Radiology,2.16.840.1.113883.3.464.1004.1081,4961000087108,Computed tomography of bilateral forearms with contrast (procedure),SNOMED CT US Edition,2.16.840.1.113883.6.96
Diagnostic Radiology,2.16.840.1.113883.3.464.1004.1081,4971000087104,Computed tomography of bilateral hands (procedure),SNOMED CT US Edition,2.16.840.1.113883.6.96
Diagnostic Radiology,2.16.840.1.113883.3.464.1004.1081,4981000087102,Computed tomography of bilateral hands with contrast (procedure),SNOMED CT US Edition,2.16.840.1.113883.6.96
Diagnostic Radiology,2.16.840.1.113883.3.464.1004.1081,4991000087100,Computed tomography of left hand with contrast (procedure),SNOMED CT US Edition,2.16.840.1.113883.6.96
Diagnostic Radiology,2.16.840.1.113883.3.464.1004.1081,5001000087109,Computed tomography of right hand with contrast (procedure),SNOMED CT US Edition,2.16.840.1.113883.6.96
Diagnostic Radiology,2.16.840.1.113883.3.464.1004.1081,5011000087106,Fluoroscopic arthrography of bilateral ankles (procedure),SNOMED CT US Edition,2.16.840.1.113883.6.96
Diagnostic Radiology,2.16.840.1.113883.3.464.1004.1081,5021000087103,Fluoroscopic arthrography of bilateral elbows (procedure),SNOMED CT US Edition,2.16.840.1.113883.6.96
Diagnostic Radiology,2.16.840.1.113883.3.464.1004.1081,5031000087101,Fluoroscopic arthrography of bilateral hip joints (procedure),SNOMED CT US Edition,2.16.840.1.113883.6.96
Diagnostic Radiology,2.16.840.1.113883.3.464.1004.1081,5041000087107,Fluoroscopic arthrography of left hip joint (procedure),SNOMED CT US Edition,2.16.840.1.113883.6.96
Diagnostic Radiology,2.16.840.1.113883.3.464.1004.1081,5051000087105,Fluoroscopic arthrography of right hip joint (procedure),SNOMED CT US Edition,2.16.840.1.113883.6.96
Diagnostic Radiology,2.16.840.1.113883.3.464.1004.1081,5061000087108,Fluoroscopic arthrography of bilateral knees (procedure),SNOMED CT US Edition,2.16.840.1.113883.6.96
Diagnostic Radiology,2.16.840.1.113883.3.464.1004.1081,5071000087104,Fluoroscopic arthrography of bilateral lower limb joints (procedure),SNOMED CT US Edition,2.16.840.1.113883.6.96
Diagnostic Radiology,2.16.840.1.113883.3.464.1004.1081,5081000087102,Fluoroscopic arthrography of left lower limb joint (procedure),SNOMED CT US Edition,2.16.840.1.113883.6.96
Diagnostic Radiology,2.16.840.1.113883.3.464.1004.1081,5091000087100,Fluoroscopic arthrography of right lower limb joint (procedure),SNOMED CT US Edition,2.16.840.1.113883.6.96
Diagnostic Radiology,2.16.840.1.113883.3.464.1004.1081,5101000087105,Fluoroscopic arthrography of joint of bilateral shoulder regions (procedure),SNOMED CT US Edition,2.16.840.1.113883.6.96
Diagnostic Radiology,2.16.840.1.113883.3.464.1004.1081,5111000087107,Fluoroscopic arthrography of bilateral temporomandibular joints (procedure),SNOMED CT US Edition,2.16.840.1.113883.6.96
Diagnostic Radiology,2.16.840.1.113883.3.464.1004.1081,5121000087104,Fluoroscopic arthrography of bilateral wrists (procedure),SNOMED CT US Edition,2.16.840.1.113883.6.96
Diagnostic Radiology,2.16.840.1.113883.3.464.1004.1081,5161000087109,Lithotripsy of bilateral kidneys using fluoroscopic guidance (procedure),SNOMED CT US Edition,2.16.840.1.113883.6.96
Diagnostic Radiology,2.16.840.1.113883.3.464.1004.1081,5171000087100,Fluoroscopic bilateral nephrostography (procedure),SNOMED CT US Edition,2.16.840.1.113883.6.96
Diagnostic Radiology,2.16.840.1.113883.3.464.1004.1081,5181000087103,Biopsy of bilateral breasts using ultrasonographic guidance (procedure),SNOMED CT US Edition,2.16.840.1.113883.6.96
Diagnostic Radiology,2.16.840.1.113883.3.464.1004.1081,5231000179108,Three dimensional obstetric ultrasonography (procedure),SNOMED CT US Edition,2.16.840.1.113883.6.96
Diagnostic Radiology,2.16.840.1.113883.3.464.1004.1081,5241000179100,Three dimensional obstetric ultrasonography in third trimester (procedure),SNOMED CT US Edition,2.16.840.1.113883.6.96
Diagnostic Radiology,2.16.840.1.113883.3.464.1004.1081,5461000087101,Mammary ductography of left breast (procedure),SNOMED CT US Edition,2.16.840.1.113883.6.96
Diagnostic Radiology,2.16.840.1.113883.3.464.1004.1081,5471000087105,Mammary ductography of right breast (procedure),SNOMED CT US Edition,2.16.840.1.113883.6.96
Diagnostic Radiology,2.16.840.1.113883.3.464.1004.1081,5481000087107,Needle localization of lesion of left breast using ultrasonographic guidance (procedure),SNOMED CT US Edition,2.16.840.1.113883.6.96
Diagnostic Radiology,2.16.840.1.113883.3.464.1004.1081,5491000087109,Needle localization of lesion of right breast using ultrasonographic guidance (procedure),SNOMED CT US Edition,2.16.840.1.113883.6.96
Diagnostic Radiology,2.16.840.1.113883.3.464.1004.1081,5541000087103,Computed tomography of bilateral ankles with contrast (procedure),SNOMED CT US Edition,2.16.840.1.113883.6.96
Diagnostic Radiology,2.16.840.1.113883.3.464.1004.1081,5561000087102,Mammary ductography of bilateral breasts (procedure),SNOMED CT US Edition,2.16.840.1.113883.6.96
Diagnostic Radiology,2.16.840.1.113883.3.464.1004.1081,5701000087106,Fluoroscopic antegrade pyelography of bilateral renal pelvis (procedure),SNOMED CT US Edition,2.16.840.1.113883.6.96
Diagnostic Radiology,2.16.840.1.113883.3.464.1004.1081,5971000087103,Mammography and aspiration of left breast (procedure),SNOMED CT US Edition,2.16.840.1.113883.6.96
Diagnostic Radiology,2.16.840.1.113883.3.464.1004.1081,5981000087101,Mammography and aspiration of right breast (procedure),SNOMED CT US Edition,2.16.840.1.113883.6.96
Diagnostic Radiology,2.16.840.1.113883.3.464.1004.1081,6101000087104,Magnetic resonance imaging of tibia (procedure),SNOMED CT US Edition,2.16.840.1.113883.6.96
Diagnostic Radiology,2.16.840.1.113883.3.464.1004.1081,6111000087102,Magnetic resonance imaging of fibula (procedure),SNOMED CT US Edition,2.16.840.1.113883.6.96
Diagnostic Radiology,2.16.840.1.113883.3.464.1004.1081,6131000087107,Plain X-ray of all fingers of left hand (procedure),SNOMED CT US Edition,2.16.840.1.113883.6.96
Diagnostic Radiology,2.16.840.1.113883.3.464.1004.1081,6141000087101,Plain X-ray of all fingers of right hand (procedure),SNOMED CT US Edition,2.16.840.1.113883.6.96
Diagnostic Radiology,2.16.840.1.113883.3.464.1004.1081,6151000087103,Plain X-ray of bone of left rib (procedure),SNOMED CT US Edition,2.16.840.1.113883.6.96
Diagnostic Radiology,2.16.840.1.113883.3.464.1004.1081,6161000087100,Plain X-ray of bone of right rib (procedure),SNOMED CT US Edition,2.16.840.1.113883.6.96
Diagnostic Radiology,2.16.840.1.113883.3.464.1004.1081,6201000087105,Plain X-ray of all toes of left foot (procedure),SNOMED CT US Edition,2.16.840.1.113883.6.96
Diagnostic Radiology,2.16.840.1.113883.3.464.1004.1081,6211000087107,Plain X-ray of all toes of right foot (procedure),SNOMED CT US Edition,2.16.840.1.113883.6.96
Diagnostic Radiology,2.16.840.1.113883.3.464.1004.1081,6231000087102,Doppler ultrasonography of artery of left lower limb (procedure),SNOMED CT US Edition,2.16.840.1.113883.6.96
Diagnostic Radiology,2.16.840.1.113883.3.464.1004.1081,6241000087108,Doppler ultrasonography of artery of right lower limb (procedure),SNOMED CT US Edition,2.16.840.1.113883.6.96
Diagnostic Radiology,2.16.840.1.113883.3.464.1004.1081,6251000087106,Doppler ultrasonography of artery of left upper limb (procedure),SNOMED CT US Edition,2.16.840.1.113883.6.96
Diagnostic Radiology,2.16.840.1.113883.3.464.1004.1081,6261000087109,Doppler ultrasonography of artery of right upper limb (procedure),SNOMED CT US Edition,2.16.840.1.113883.6.96
Diagnostic Radiology,2.16.840.1.113883.3.464.1004.1081,6281000087103,Doppler ultrasonography flow mapping of vein of right lower limb (procedure),SNOMED CT US Edition,2.16.840.1.113883.6.96
Diagnostic Radiology,2.16.840.1.113883.3.464.1004.1081,6291000087101,Doppler ultrasonography flow mapping of vein of left lower limb (procedure),SNOMED CT US Edition,2.16.840.1.113883.6.96
Diagnostic Radiology,2.16.840.1.113883.3.464.1004.1081,6301000087102,Doppler ultrasonography flow mapping of vein of right upper limb (procedure),SNOMED CT US Edition,2.16.840.1.113883.6.96
Diagnostic Radiology,2.16.840.1.113883.3.464.1004.1081,6311000087100,Doppler ultrasonography flow mapping of vein of left upper limb (procedure),SNOMED CT US Edition,2.16.840.1.113883.6.96
Diagnostic Radiology,2.16.840.1.113883.3.464.1004.1081,6411000087106,Fluoroscopic antegrade pyelography of left renal pelvis (procedure),SNOMED CT US Edition,2.16.840.1.113883.6.96
Diagnostic Radiology,2.16.840.1.113883.3.464.1004.1081,6421000087103,Fluoroscopic antegrade pyelography of right renal pelvis (procedure),SNOMED CT US Edition,2.16.840.1.113883.6.96
Diagnostic Radiology,2.16.840.1.113883.3.464.1004.1081,6431000087101,Magnetic resonance imaging of left acromioclavicular joint (procedure),SNOMED CT US Edition,2.16.840.1.113883.6.96
Diagnostic Radiology,2.16.840.1.113883.3.464.1004.1081,6441000087107,Magnetic resonance imaging of right acromioclavicular joint (procedure),SNOMED CT US Edition,2.16.840.1.113883.6.96
Diagnostic Radiology,2.16.840.1.113883.3.464.1004.1081,6451000087105,Biopsy of left kidney using fluoroscopic guidance (procedure),SNOMED CT US Edition,2.16.840.1.113883.6.96
Diagnostic Radiology,2.16.840.1.113883.3.464.1004.1081,6461000087108,Biopsy of right kidney using fluoroscopic guidance (procedure),SNOMED CT US Edition,2.16.840.1.113883.6.96
Diagnostic Radiology,2.16.840.1.113883.3.464.1004.1081,6481000087102,Biopsy of left lung using computed tomography guidance (procedure),SNOMED CT US Edition,2.16.840.1.113883.6.96
Diagnostic Radiology,2.16.840.1.113883.3.464.1004.1081,6491000087100,Biopsy of right lung using computed tomography guidance (procedure),SNOMED CT US Edition,2.16.840.1.113883.6.96
Diagnostic Radiology,2.16.840.1.113883.3.464.1004.1081,6521000087102,Biopsy of left lung using fluoroscopic guidance (procedure),SNOMED CT US Edition,2.16.840.1.113883.6.96
Diagnostic Radiology,2.16.840.1.113883.3.464.1004.1081,6531000087100,Biopsy of right lung using fluoroscopic guidance (procedure),SNOMED CT US Edition,2.16.840.1.113883.6.96
Diagnostic Radiology,2.16.840.1.113883.3.464.1004.1081,6601000087107,Computed tomography of bilateral tibia and fibula with contrast (procedure),SNOMED CT US Edition,2.16.840.1.113883.6.96
Diagnostic Radiology,2.16.840.1.113883.3.464.1004.1081,6611000087109,Computed tomography of bilateral tibia and fibula (procedure),SNOMED CT US Edition,2.16.840.1.113883.6.96
Diagnostic Radiology,2.16.840.1.113883.3.464.1004.1081,6631000087104,Computed tomography of left tibia and fibula (procedure),SNOMED CT US Edition,2.16.840.1.113883.6.96
Diagnostic Radiology,2.16.840.1.113883.3.464.1004.1081,6651000087108,Computed tomography of right tibia and fibula (procedure),SNOMED CT US Edition,2.16.840.1.113883.6.96
Diagnostic Radiology,2.16.840.1.113883.3.464.1004.1081,6681000087100,Magnetic resonance imaging of bilateral tibia and fibula (procedure),SNOMED CT US Edition,2.16.840.1.113883.6.96
Diagnostic Radiology,2.16.840.1.113883.3.464.1004.1081,6691000087103,Magnetic resonance imaging of bilateral tibia and fibula with contrast (procedure),SNOMED CT US Edition,2.16.840.1.113883.6.96
Diagnostic Radiology,2.16.840.1.113883.3.464.1004.1081,6711000087101,Magnetic resonance imaging of left tibia and fibula (procedure),SNOMED CT US Edition,2.16.840.1.113883.6.96
Diagnostic Radiology,2.16.840.1.113883.3.464.1004.1081,6721000087109,Magnetic resonance imaging of left tibia and fibula with contrast (procedure),SNOMED CT US Edition,2.16.840.1.113883.6.96
Diagnostic Radiology,2.16.840.1.113883.3.464.1004.1081,6731000087106,Magnetic resonance imaging of right tibia and fibula (procedure),SNOMED CT US Edition,2.16.840.1.113883.6.96
Diagnostic Radiology,2.16.840.1.113883.3.464.1004.1081,6741000087100,Magnetic resonance imaging of right tibia and fibula with contrast (procedure),SNOMED CT US Edition,2.16.840.1.113883.6.96
Diagnostic Radiology,2.16.840.1.113883.3.464.1004.1081,6751000087102,Doppler ultrasonography of arteries of bilateral lower limbs (procedure),SNOMED CT US Edition,2.16.840.1.113883.6.96
Diagnostic Radiology,2.16.840.1.113883.3.464.1004.1081,6761000087104,Doppler ultrasonography of arteries of bilateral upper limbs (procedure),SNOMED CT US Edition,2.16.840.1.113883.6.96
Diagnostic Radiology,2.16.840.1.113883.3.464.1004.1081,6771000087108,Doppler ultrasonography flow mapping of veins of bilateral lower limbs (procedure),SNOMED CT US Edition,2.16.840.1.113883.6.96
Diagnostic Radiology,2.16.840.1.113883.3.464.1004.1081,6781000087105,Doppler ultrasonography flow mapping of veins of bilateral upper limbs (procedure),SNOMED CT US Edition,2.16.840.1.113883.6.96
Diagnostic Radiology,2.16.840.1.113883.3.464.1004.1081,6791000087107,Mammography and aspiration of bilateral breasts (procedure),SNOMED CT US Edition,2.16.840.1.113883.6.96
Diagnostic Radiology,2.16.840.1.113883.3.464.1004.1081,6801000087106,Magnetic resonance imaging of bilateral acromioclavicular joints (procedure),SNOMED CT US Edition,2.16.840.1.113883.6.96
Diagnostic Radiology,2.16.840.1.113883.3.464.1004.1081,6811000087108,Biopsy of left lower limb using computed tomography guidance (procedure),SNOMED CT US Edition,2.16.840.1.113883.6.96
Diagnostic Radiology,2.16.840.1.113883.3.464.1004.1081,6821000087100,Biopsy of right lower limb using computed tomography guidance (procedure),SNOMED CT US Edition,2.16.840.1.113883.6.96
Diagnostic Radiology,2.16.840.1.113883.3.464.1004.1081,8891000087103,Doppler ultrasonography of left carotid artery (procedure),SNOMED CT US Edition,2.16.840.1.113883.6.96
Diagnostic Radiology,2.16.840.1.113883.3.464.1004.1081,8901000087102,Doppler ultrasonography of right carotid artery (procedure),SNOMED CT US Edition,2.16.840.1.113883.6.96
Diagnostic Radiology,2.16.840.1.113883.3.464.1004.1081,9101000087107,Doppler ultrasonography of left iliac vessel (procedure),SNOMED CT US Edition,2.16.840.1.113883.6.96
Diagnostic Radiology,2.16.840.1.113883.3.464.1004.1081,9111000087109,Doppler ultrasonography of artery of right inguinal region (procedure),SNOMED CT US Edition,2.16.840.1.113883.6.96
Diagnostic Radiology,2.16.840.1.113883.3.464.1004.1081,9121000087101,Doppler ultrasonography of artery of left inguinal region (procedure),SNOMED CT US Edition,2.16.840.1.113883.6.96
Diagnostic Radiology,2.16.840.1.113883.3.464.1004.1081,9151000087108,Doppler ultrasonography of right iliac vessel (procedure),SNOMED CT US Edition,2.16.840.1.113883.6.96
Diagnostic Radiology,2.16.840.1.113883.3.464.1004.1081,9161000087106,Doppler ultrasonography of artery of bilateral inguinal regions (procedure),SNOMED CT US Edition,2.16.840.1.113883.6.96
Diagnostic Radiology,2.16.840.1.113883.3.464.1004.1081,9171000087102,Doppler ultrasonography of bilateral carotid arteries (procedure),SNOMED CT US Edition,2.16.840.1.113883.6.96
Diagnostic Radiology,2.16.840.1.113883.3.464.1004.1081,9181000087100,Doppler ultrasonography of bilateral iliac vessels (procedure),SNOMED CT US Edition,2.16.840.1.113883.6.96
Diagnostic Radiology,2.16.840.1.113883.3.464.1004.1081,9191000087103,Plain X-ray of right upper limb (procedure),SNOMED CT US Edition,2.16.840.1.113883.6.96
Diagnostic Radiology,2.16.840.1.113883.3.464.1004.1081,9201000087101,Plain X-ray of left upper limb (procedure),SNOMED CT US Edition,2.16.840.1.113883.6.96
Diagnostic Radiology,2.16.840.1.113883.3.464.1004.1081,9241000087103,Plain X-ray of left lower limb (procedure),SNOMED CT US Edition,2.16.840.1.113883.6.96
Diagnostic Radiology,2.16.840.1.113883.3.464.1004.1081,9251000087100,Plain X-ray of right lower limb (procedure),SNOMED CT US Edition,2.16.840.1.113883.6.96
Diagnostic Radiology,2.16.840.1.113883.3.464.1004.1081,9491000087106,Ultrasonography of face and neck (procedure),SNOMED CT US Edition,2.16.840.1.113883.6.96
Diagnostic Radiology,2.16.840.1.113883.3.464.1004.1081,9521000087109,Computed tomography angiography of abdominal artery and pelvic artery with contrast (procedure),SNOMED CT US Edition,2.16.840.1.113883.6.96
Diagnostic Radiology,2.16.840.1.113883.3.464.1004.1081,9751000087109,Plain X-ray of bilateral upper limbs (procedure),SNOMED CT US Edition,2.16.840.1.113883.6.96
Diagnostic Radiology,2.16.840.1.113883.3.464.1004.1081,9771000087103,Plain X-ray of bilateral lower limbs (procedure),SNOMED CT US Edition,2.16.840.1.113883.6.96
Diagnostic Radiology,2.16.840.1.113883.3.464.1004.1081,10321000087109,Ultrasonography of chest and abdomen (procedure),SNOMED CT US Edition,2.16.840.1.113883.6.96
Diagnostic Radiology,2.16.840.1.113883.3.464.1004.1081,10361000087104,Computed tomography of head and cervical spine (procedure),SNOMED CT US Edition,2.16.840.1.113883.6.96
Diagnostic Radiology,2.16.840.1.113883.3.464.1004.1081,10401000087105,"Ultrasonography of chest, abdomen and pelvis (procedure)",SNOMED CT US Edition,2.16.840.1.113883.6.96
Diagnostic Radiology,2.16.840.1.113883.3.464.1004.1081,11341000087106,Computed tomography of right acromioclavicular joint (procedure),SNOMED CT US Edition,2.16.840.1.113883.6.96
Diagnostic Radiology,2.16.840.1.113883.3.464.1004.1081,11361000087107,Magnetic resonance imaging of joint of right lower extremity (procedure),SNOMED CT US Edition,2.16.840.1.113883.6.96
Diagnostic Radiology,2.16.840.1.113883.3.464.1004.1081,11381000087101,Magnetic resonance imaging of joint of left lower extremity (procedure),SNOMED CT US Edition,2.16.840.1.113883.6.96
Diagnostic Radiology,2.16.840.1.113883.3.464.1004.1081,11401000087101,Ultrasonography of chest and right axilla (procedure),SNOMED CT US Edition,2.16.840.1.113883.6.96
Diagnostic Radiology,2.16.840.1.113883.3.464.1004.1081,11411000087104,Magnetic resonance imaging of joint of left upper extremity (procedure),SNOMED CT US Edition,2.16.840.1.113883.6.96
Diagnostic Radiology,2.16.840.1.113883.3.464.1004.1081,11421000087107,Magnetic resonance imaging of pelvis and left hip (procedure),SNOMED CT US Edition,2.16.840.1.113883.6.96
Diagnostic Radiology,2.16.840.1.113883.3.464.1004.1081,11441000087103,Computed tomography of left acromioclavicular joint (procedure),SNOMED CT US Edition,2.16.840.1.113883.6.96
Diagnostic Radiology,2.16.840.1.113883.3.464.1004.1081,11471000087106,Ultrasonography of chest and left axilla (procedure),SNOMED CT US Edition,2.16.840.1.113883.6.96
Diagnostic Radiology,2.16.840.1.113883.3.464.1004.1081,11491000087105,Ultrasonography of left buttock (procedure),SNOMED CT US Edition,2.16.840.1.113883.6.96
Diagnostic Radiology,2.16.840.1.113883.3.464.1004.1081,11521000087108,Ultrasonography of right kidney (procedure),SNOMED CT US Edition,2.16.840.1.113883.6.96
Diagnostic Radiology,2.16.840.1.113883.3.464.1004.1081,11541000087104,Magnetic resonance imaging of pelvis and right hip (procedure),SNOMED CT US Edition,2.16.840.1.113883.6.96
Diagnostic Radiology,2.16.840.1.113883.3.464.1004.1081,11581000087109,Ultrasonography of left kidney (procedure),SNOMED CT US Edition,2.16.840.1.113883.6.96
Diagnostic Radiology,2.16.840.1.113883.3.464.1004.1081,11601000087103,Magnetic resonance imaging of joint of right upper extremity (procedure),SNOMED CT US Edition,2.16.840.1.113883.6.96
Diagnostic Radiology,2.16.840.1.113883.3.464.1004.1081,11611000087101,Ultrasonography of right buttock (procedure),SNOMED CT US Edition,2.16.840.1.113883.6.96
Diagnostic Radiology,2.16.840.1.113883.3.464.1004.1081,11621000087109,Magnetic resonance imaging of joints of bilateral upper extremities (procedure),SNOMED CT US Edition,2.16.840.1.113883.6.96
Diagnostic Radiology,2.16.840.1.113883.3.464.1004.1081,11631000087106,Ultrasonography of bilateral buttocks (procedure),SNOMED CT US Edition,2.16.840.1.113883.6.96
Diagnostic Radiology,2.16.840.1.113883.3.464.1004.1081,11641000087100,Magnetic resonance imaging of joints of bilateral lower extremities (procedure),SNOMED CT US Edition,2.16.840.1.113883.6.96
Diagnostic Radiology,2.16.840.1.113883.3.464.1004.1081,11651000087102,Ultrasonography of bilateral adrenal glands (procedure),SNOMED CT US Edition,2.16.840.1.113883.6.96
Diagnostic Radiology,2.16.840.1.113883.3.464.1004.1081,11661000087104,Computed tomography of bilateral acromioclavicular joints (procedure),SNOMED CT US Edition,2.16.840.1.113883.6.96
Diagnostic Radiology,2.16.840.1.113883.3.464.1004.1081,11681000087105,Ultrasonography of right adrenal gland (procedure),SNOMED CT US Edition,2.16.840.1.113883.6.96
Diagnostic Radiology,2.16.840.1.113883.3.464.1004.1081,11691000087107,Ultrasonography of left adrenal gland (procedure),SNOMED CT US Edition,2.16.840.1.113883.6.96
Diagnostic Radiology,2.16.840.1.113883.3.464.1004.1081,11841000087101,Ultrasonography of breast and axilla (procedure),SNOMED CT US Edition,2.16.840.1.113883.6.96
Diagnostic Radiology,2.16.840.1.113883.3.464.1004.1081,11931000087101,Biopsy of left adrenal gland using ultrasonographic guidance (procedure),SNOMED CT US Edition,2.16.840.1.113883.6.96
Diagnostic Radiology,2.16.840.1.113883.3.464.1004.1081,11981000087102,Computed tomography arthrography of right lower limb (procedure),SNOMED CT US Edition,2.16.840.1.113883.6.96
Diagnostic Radiology,2.16.840.1.113883.3.464.1004.1081,12011000087100,Biopsy of left axilla using ultrasonographic guidance (procedure),SNOMED CT US Edition,2.16.840.1.113883.6.96
Diagnostic Radiology,2.16.840.1.113883.3.464.1004.1081,12021000087108,Computed tomography arthrography of left upper limb (procedure),SNOMED CT US Edition,2.16.840.1.113883.6.96
Diagnostic Radiology,2.16.840.1.113883.3.464.1004.1081,12081000087109,Injection of right upper limb using ultrasonographic guidance (procedure),SNOMED CT US Edition,2.16.840.1.113883.6.96
Diagnostic Radiology,2.16.840.1.113883.3.464.1004.1081,12111000087104,Fluoroscopic angiography of abdominal and pelvic vascular structure with contrast (procedure),SNOMED CT US Edition,2.16.840.1.113883.6.96
Diagnostic Radiology,2.16.840.1.113883.3.464.1004.1081,12131000087109,Biopsy of breast and axilla using ultrasonographic guidance (procedure),SNOMED CT US Edition,2.16.840.1.113883.6.96
Diagnostic Radiology,2.16.840.1.113883.3.464.1004.1081,12141000087103,Computed tomography angiography of neck and thorax with contrast (procedure),SNOMED CT US Edition,2.16.840.1.113883.6.96
Diagnostic Radiology,2.16.840.1.113883.3.464.1004.1081,12181000087108,Computed tomography arthrography of right upper limb (procedure),SNOMED CT US Edition,2.16.840.1.113883.6.96
Diagnostic Radiology,2.16.840.1.113883.3.464.1004.1081,12191000087105,Biopsy of right adrenal gland using ultrasonographic guidance (procedure),SNOMED CT US Edition,2.16.840.1.113883.6.96
Diagnostic Radiology,2.16.840.1.113883.3.464.1004.1081,12311000087102,Magnetic resonance imaging of pelvis and bilateral hips (procedure),SNOMED CT US Edition,2.16.840.1.113883.6.96
Diagnostic Radiology,2.16.840.1.113883.3.464.1004.1081,12351000087103,Drainage of right breast using ultrasonographic guidance (procedure),SNOMED CT US Edition,2.16.840.1.113883.6.96
Diagnostic Radiology,2.16.840.1.113883.3.464.1004.1081,12471000087101,Injection of left upper limb using ultrasonographic guidance (procedure),SNOMED CT US Edition,2.16.840.1.113883.6.96
Diagnostic Radiology,2.16.840.1.113883.3.464.1004.1081,12511000087107,Computed tomography arthrography of left lower limb (procedure),SNOMED CT US Edition,2.16.840.1.113883.6.96
Diagnostic Radiology,2.16.840.1.113883.3.464.1004.1081,12601000087109,Drainage of left breast using ultrasonographic guidance (procedure),SNOMED CT US Edition,2.16.840.1.113883.6.96
Diagnostic Radiology,2.16.840.1.113883.3.464.1004.1081,12641000087107,Ultrasonography of right breast and right axilla (procedure),SNOMED CT US Edition,2.16.840.1.113883.6.96
Diagnostic Radiology,2.16.840.1.113883.3.464.1004.1081,12651000087105,Drainage of bilateral breasts using ultrasonographic guidance (procedure),SNOMED CT US Edition,2.16.840.1.113883.6.96
Diagnostic Radiology,2.16.840.1.113883.3.464.1004.1081,12681000087102,Computed tomography arthrography of bilateral upper limbs (procedure),SNOMED CT US Edition,2.16.840.1.113883.6.96
Diagnostic Radiology,2.16.840.1.113883.3.464.1004.1081,12691000087100,Injection of bilateral lower limbs using ultrasonographic guidance (procedure),SNOMED CT US Edition,2.16.840.1.113883.6.96
Diagnostic Radiology,2.16.840.1.113883.3.464.1004.1081,12701000087100,Computed tomography arthrography of bilateral lower limbs (procedure),SNOMED CT US Edition,2.16.840.1.113883.6.96
Diagnostic Radiology,2.16.840.1.113883.3.464.1004.1081,12711000087103,Ultrasonography of bilateral breasts and bilateral axillae (procedure),SNOMED CT US Edition,2.16.840.1.113883.6.96
Diagnostic Radiology,2.16.840.1.113883.3.464.1004.1081,12731000087108,Injection of left lower limb using ultrasonographic guidance (procedure),SNOMED CT US Edition,2.16.840.1.113883.6.96
Diagnostic Radiology,2.16.840.1.113883.3.464.1004.1081,12741000087102,Injection of bilateral upper limbs using ultrasonographic guidance (procedure),SNOMED CT US Edition,2.16.840.1.113883.6.96
Diagnostic Radiology,2.16.840.1.113883.3.464.1004.1081,12771000087105,Ultrasonography of left breast and left axilla (procedure),SNOMED CT US Edition,2.16.840.1.113883.6.96
Diagnostic Radiology,2.16.840.1.113883.3.464.1004.1081,12821000087102,Mammography of left breast specimen (procedure),SNOMED CT US Edition,2.16.840.1.113883.6.96
Diagnostic Radiology,2.16.840.1.113883.3.464.1004.1081,12831000087100,Mammography of right breast specimen (procedure),SNOMED CT US Edition,2.16.840.1.113883.6.96
Diagnostic Radiology,2.16.840.1.113883.3.464.1004.1081,12861000087107,Biopsy of left upper limb using computed tomography guidance (procedure),SNOMED CT US Edition,2.16.840.1.113883.6.96
Diagnostic Radiology,2.16.840.1.113883.3.464.1004.1081,12871000087103,Biopsy of right upper limb using computed tomography guidance (procedure),SNOMED CT US Edition,2.16.840.1.113883.6.96
