Value Set Name,Value Set OID,Code,Definition,Code System,Code System OID
Diagnostic Radiology,2.16.840.1.113883.3.464.1004.1081,17961000087102,Doppler ultrasonography of vascular structure of pelvis and veins of bilateral lower limbs (procedure),SNOMED CT US Edition,2.16.840.1.113883.6.96
Diagnostic Radiology,2.16.840.1.113883.3.464.1004.1081,18001000087104,Computed tomography of pelvis and lower limb with contrast (procedure),SNOMED CT US Edition,2.16.840.1.113883.6.96
Diagnostic Radiology,2.16.840.1.113883.3.464.1004.1081,18051000087103,Computed tomography of pelvis and bilateral lower limbs with contrast (procedure),SNOMED CT US Edition,2.16.840.1.113883.6.96
Diagnostic Radiology,2.16.840.1.113883.3.464.1004.1081,18061000087100,Doppler ultrasonography of vein of left lower limb (procedure),SNOMED CT US Edition,2.16.840.1.113883.6.96
Diagnostic Radiology,2.16.840.1.113883.3.464.1004.1081,18291000087100,Computed tomography angiography of right lower limb with contrast (procedure),SNOMED CT US Edition,2.16.840.1.113883.6.96
Diagnostic Radiology,2.16.840.1.113883.3.464.1004.1081,18301000087101,Doppler ultrasonography of veins of bilateral lower limbs (procedure),SNOMED CT US Edition,2.16.840.1.113883.6.96
Diagnostic Radiology,2.16.840.1.113883.3.464.1004.1081,18361000087102,Biopsy of right rib using computed tomography guidance (procedure),SNOMED CT US Edition,2.16.840.1.113883.6.96
Diagnostic Radiology,2.16.840.1.113883.3.464.1004.1081,18381000087108,Computed tomography angiography of bilateral lower limbs with contrast (procedure),SNOMED CT US Edition,2.16.840.1.113883.6.96
Diagnostic Radiology,2.16.840.1.113883.3.464.1004.1081,18401000087108,Biopsy of left rib using computed tomography guidance (procedure),SNOMED CT US Edition,2.16.840.1.113883.6.96
Diagnostic Radiology,2.16.840.1.113883.3.464.1004.1081,19521000087107,Magnetic resonance arthrography of right shoulder (procedure),SNOMED CT US Edition,2.16.840.1.113883.6.96
Diagnostic Radiology,2.16.840.1.113883.3.464.1004.1081,19531000087109,Biopsy of bilateral kidneys using fluoroscopic guidance (procedure),SNOMED CT US Edition,2.16.840.1.113883.6.96
Diagnostic Radiology,2.16.840.1.113883.3.464.1004.1081,19621000087108,Magnetic resonance arthrography of left hip (procedure),SNOMED CT US Edition,2.16.840.1.113883.6.96
Diagnostic Radiology,2.16.840.1.113883.3.464.1004.1081,19651000087101,Magnetic resonance arthrography of left ankle (procedure),SNOMED CT US Edition,2.16.840.1.113883.6.96
Diagnostic Radiology,2.16.840.1.113883.3.464.1004.1081,19711000087108,Angioplasty of right tibial artery using fluoroscopic guidance with contrast (procedure),SNOMED CT US Edition,2.16.840.1.113883.6.96
Diagnostic Radiology,2.16.840.1.113883.3.464.1004.1081,19741000087109,Magnetic resonance arthrography of right knee (procedure),SNOMED CT US Edition,2.16.840.1.113883.6.96
Diagnostic Radiology,2.16.840.1.113883.3.464.1004.1081,19761000087105,Biopsy of left salivary gland using ultrasonographic guidance (procedure),SNOMED CT US Edition,2.16.840.1.113883.6.96
Diagnostic Radiology,2.16.840.1.113883.3.464.1004.1081,19771000087101,Magnetic resonance arthrography of right wrist (procedure),SNOMED CT US Edition,2.16.840.1.113883.6.96
Diagnostic Radiology,2.16.840.1.113883.3.464.1004.1081,19791000087102,Magnetic resonance arthrography of right elbow (procedure),SNOMED CT US Edition,2.16.840.1.113883.6.96
Diagnostic Radiology,2.16.840.1.113883.3.464.1004.1081,19831000087106,Magnetic resonance arthrography of right hip (procedure),SNOMED CT US Edition,2.16.840.1.113883.6.96
Diagnostic Radiology,2.16.840.1.113883.3.464.1004.1081,19971000087103,Magnetic resonance arthrography of right ankle (procedure),SNOMED CT US Edition,2.16.840.1.113883.6.96
Diagnostic Radiology,2.16.840.1.113883.3.464.1004.1081,20021000087104,Computed tomography of right scapula (procedure),SNOMED CT US Edition,2.16.840.1.113883.6.96
Diagnostic Radiology,2.16.840.1.113883.3.464.1004.1081,20051000087106,Magnetic resonance arthrography of left shoulder (procedure),SNOMED CT US Edition,2.16.840.1.113883.6.96
Diagnostic Radiology,2.16.840.1.113883.3.464.1004.1081,20091000087101,Biopsy of right salivary gland using ultrasonographic guidance (procedure),SNOMED CT US Edition,2.16.840.1.113883.6.96
Diagnostic Radiology,2.16.840.1.113883.3.464.1004.1081,20111000087108,Computed tomography of left scapula (procedure),SNOMED CT US Edition,2.16.840.1.113883.6.96
Diagnostic Radiology,2.16.840.1.113883.3.464.1004.1081,20141000087109,Angioplasty of left tibial artery using fluoroscopic guidance with contrast (procedure),SNOMED CT US Edition,2.16.840.1.113883.6.96
Diagnostic Radiology,2.16.840.1.113883.3.464.1004.1081,20171000087101,Magnetic resonance arthrography of left wrist (procedure),SNOMED CT US Edition,2.16.840.1.113883.6.96
Diagnostic Radiology,2.16.840.1.113883.3.464.1004.1081,20221000087106,Magnetic resonance arthrography of left knee (procedure),SNOMED CT US Edition,2.16.840.1.113883.6.96
Diagnostic Radiology,2.16.840.1.113883.3.464.1004.1081,20271000087105,Magnetic resonance arthrography of left elbow (procedure),SNOMED CT US Edition,2.16.840.1.113883.6.96
Diagnostic Radiology,2.16.840.1.113883.3.464.1004.1081,20311000087105,Ultrasonography of bilateral popliteal fossa (procedure),SNOMED CT US Edition,2.16.840.1.113883.6.96
Diagnostic Radiology,2.16.840.1.113883.3.464.1004.1081,20321000087102,Angioplasty of bilateral tibial arteries using fluoroscopic guidance with contrast (procedure),SNOMED CT US Edition,2.16.840.1.113883.6.96
Diagnostic Radiology,2.16.840.1.113883.3.464.1004.1081,20331000087100,Computed tomography of bilateral scapulae (procedure),SNOMED CT US Edition,2.16.840.1.113883.6.96
Diagnostic Radiology,2.16.840.1.113883.3.464.1004.1081,20341000087106,Magnetic resonance arthrography of bilateral hips (procedure),SNOMED CT US Edition,2.16.840.1.113883.6.96
Diagnostic Radiology,2.16.840.1.113883.3.464.1004.1081,20351000087109,Aspiration of right axilla using ultrasonographic guidance (procedure),SNOMED CT US Edition,2.16.840.1.113883.6.96
Diagnostic Radiology,2.16.840.1.113883.3.464.1004.1081,20361000087107,Aspiration of left axilla using ultrasonographic guidance (procedure),SNOMED CT US Edition,2.16.840.1.113883.6.96
Diagnostic Radiology,2.16.840.1.113883.3.464.1004.1081,20371000087103,Magnetic resonance imaging of left calf (procedure),SNOMED CT US Edition,2.16.840.1.113883.6.96
Diagnostic Radiology,2.16.840.1.113883.3.464.1004.1081,20381000087101,Magnetic resonance imaging of right calf (procedure),SNOMED CT US Edition,2.16.840.1.113883.6.96
Diagnostic Radiology,2.16.840.1.113883.3.464.1004.1081,20411000087104,Computed tomography of left scapula with contrast (procedure),SNOMED CT US Edition,2.16.840.1.113883.6.96
Diagnostic Radiology,2.16.840.1.113883.3.464.1004.1081,20421000087107,Computed tomography of right scapula with contrast (procedure),SNOMED CT US Edition,2.16.840.1.113883.6.96
Diagnostic Radiology,2.16.840.1.113883.3.464.1004.1081,20431000087109,Magnetic resonance imaging of left humerus (procedure),SNOMED CT US Edition,2.16.840.1.113883.6.96
Diagnostic Radiology,2.16.840.1.113883.3.464.1004.1081,20451000087100,Magnetic resonance imaging of right humerus (procedure),SNOMED CT US Edition,2.16.840.1.113883.6.96
Diagnostic Radiology,2.16.840.1.113883.3.464.1004.1081,20481000087108,Magnetic resonance imaging of left humerus with contrast (procedure),SNOMED CT US Edition,2.16.840.1.113883.6.96
Diagnostic Radiology,2.16.840.1.113883.3.464.1004.1081,20491000087105,Magnetic resonance imaging of right humerus with contrast (procedure),SNOMED CT US Edition,2.16.840.1.113883.6.96
Diagnostic Radiology,2.16.840.1.113883.3.464.1004.1081,20501000087102,Computed tomography of bilateral scapulae with contrast (procedure),SNOMED CT US Edition,2.16.840.1.113883.6.96
Diagnostic Radiology,2.16.840.1.113883.3.464.1004.1081,20511000087100,Aspiration of bilateral axillae using ultrasonographic guidance (procedure),SNOMED CT US Edition,2.16.840.1.113883.6.96
Diagnostic Radiology,2.16.840.1.113883.3.464.1004.1081,20521000087108,Magnetic resonance imaging of bilateral humeri (procedure),SNOMED CT US Edition,2.16.840.1.113883.6.96
Diagnostic Radiology,2.16.840.1.113883.3.464.1004.1081,20531000087105,Magnetic resonance imaging of bilateral calves (procedure),SNOMED CT US Edition,2.16.840.1.113883.6.96
Diagnostic Radiology,2.16.840.1.113883.3.464.1004.1081,20541000087104,Magnetic resonance imaging of bilateral humeri with contrast (procedure),SNOMED CT US Edition,2.16.840.1.113883.6.96
Diagnostic Radiology,2.16.840.1.113883.3.464.1004.1081,20951000087105,Ultrasonography of pelvis and perineum (procedure),SNOMED CT US Edition,2.16.840.1.113883.6.96
Diagnostic Radiology,2.16.840.1.113883.3.464.1004.1081,21101000087100,Magnetic resonance venography of limb (procedure),SNOMED CT US Edition,2.16.840.1.113883.6.96
Diagnostic Radiology,2.16.840.1.113883.3.464.1004.1081,21151000087104,Ultrasonography of toe of right foot (procedure),SNOMED CT US Edition,2.16.840.1.113883.6.96
Diagnostic Radiology,2.16.840.1.113883.3.464.1004.1081,21171000087105,Ultrasonography of right biceps tendon (procedure),SNOMED CT US Edition,2.16.840.1.113883.6.96
Diagnostic Radiology,2.16.840.1.113883.3.464.1004.1081,21181000087107,Ultrasonography of left biceps tendon (procedure),SNOMED CT US Edition,2.16.840.1.113883.6.96
Diagnostic Radiology,2.16.840.1.113883.3.464.1004.1081,21211000087108,Magnetic resonance imaging of calf of left lower leg with contrast (procedure),SNOMED CT US Edition,2.16.840.1.113883.6.96
Diagnostic Radiology,2.16.840.1.113883.3.464.1004.1081,21231000087103,Plain X-ray of right salivary gland (procedure),SNOMED CT US Edition,2.16.840.1.113883.6.96
Diagnostic Radiology,2.16.840.1.113883.3.464.1004.1081,21291000087102,Doppler ultrasonography of right saphenous vein (procedure),SNOMED CT US Edition,2.16.840.1.113883.6.96
Diagnostic Radiology,2.16.840.1.113883.3.464.1004.1081,21301000087103,Magnetic resonance imaging of pelvis and bilateral hips with contrast (procedure),SNOMED CT US Edition,2.16.840.1.113883.6.96
Diagnostic Radiology,2.16.840.1.113883.3.464.1004.1081,21321000087109,Doppler ultrasonography of left saphenous vein (procedure),SNOMED CT US Edition,2.16.840.1.113883.6.96
Diagnostic Radiology,2.16.840.1.113883.3.464.1004.1081,21401000087105,Ultrasonography of finger of right hand (procedure),SNOMED CT US Edition,2.16.840.1.113883.6.96
Diagnostic Radiology,2.16.840.1.113883.3.464.1004.1081,21441000087108,Ultrasonography of finger of left hand (procedure),SNOMED CT US Edition,2.16.840.1.113883.6.96
Diagnostic Radiology,2.16.840.1.113883.3.464.1004.1081,21461000087109,Plain X-ray of left salivary gland (procedure),SNOMED CT US Edition,2.16.840.1.113883.6.96
Diagnostic Radiology,2.16.840.1.113883.3.464.1004.1081,21471000087100,Magnetic resonance imaging of calf of right lower leg with contrast (procedure),SNOMED CT US Edition,2.16.840.1.113883.6.96
Diagnostic Radiology,2.16.840.1.113883.3.464.1004.1081,21491000087101,Ultrasonography of toe of left foot (procedure),SNOMED CT US Edition,2.16.840.1.113883.6.96
Diagnostic Radiology,2.16.840.1.113883.3.464.1004.1081,21521000087103,Doppler ultrasonography of bilateral saphenous veins (procedure),SNOMED CT US Edition,2.16.840.1.113883.6.96
Diagnostic Radiology,2.16.840.1.113883.3.464.1004.1081,21531000087101,Magnetic resonance imaging of bilateral calves with contrast (procedure),SNOMED CT US Edition,2.16.840.1.113883.6.96
Diagnostic Radiology,2.16.840.1.113883.3.464.1004.1081,21551000087105,Ultrasonography of bilateral biceps tendons (procedure),SNOMED CT US Edition,2.16.840.1.113883.6.96
Diagnostic Radiology,2.16.840.1.113883.3.464.1004.1081,21731000087107,Biopsy of bilateral lungs using fluoroscopic guidance (procedure),SNOMED CT US Edition,2.16.840.1.113883.6.96
Diagnostic Radiology,2.16.840.1.113883.3.464.1004.1081,22831000087106,"Computed tomography of abdomen, pelvis and bilateral lower limbs with contrast (procedure)",SNOMED CT US Edition,2.16.840.1.113883.6.96
Diagnostic Radiology,2.16.840.1.113883.3.464.1004.1081,22851000087102,"Computed tomography of abdomen, pelvis and left lower limb with contrast (procedure)",SNOMED CT US Edition,2.16.840.1.113883.6.96
Diagnostic Radiology,2.16.840.1.113883.3.464.1004.1081,22871000087108,"Computed tomography of abdomen, pelvis and lower limb (procedure)",SNOMED CT US Edition,2.16.840.1.113883.6.96
Diagnostic Radiology,2.16.840.1.113883.3.464.1004.1081,22881000087105,"Computed tomography of abdomen, pelvis and lower limb with contrast (procedure)",SNOMED CT US Edition,2.16.840.1.113883.6.96
Diagnostic Radiology,2.16.840.1.113883.3.464.1004.1081,22891000087107,"Computed tomography of abdomen, pelvis and right lower limb with contrast (procedure)",SNOMED CT US Edition,2.16.840.1.113883.6.96
Diagnostic Radiology,2.16.840.1.113883.3.464.1004.1081,52211000087101,Magnetic resonance imaging of left calcaneus (procedure),SNOMED CT US Edition,2.16.840.1.113883.6.96
Diagnostic Radiology,2.16.840.1.113883.3.464.1004.1081,52221000087109,Magnetic resonance imaging of right calcaneus (procedure),SNOMED CT US Edition,2.16.840.1.113883.6.96
Diagnostic Radiology,2.16.840.1.113883.3.464.1004.1081,52231000087106,Magnetic resonance imaging of left sacroiliac joint (procedure),SNOMED CT US Edition,2.16.840.1.113883.6.96
Diagnostic Radiology,2.16.840.1.113883.3.464.1004.1081,52241000087100,Magnetic resonance imaging of right sacroiliac joint (procedure),SNOMED CT US Edition,2.16.840.1.113883.6.96
Diagnostic Radiology,2.16.840.1.113883.3.464.1004.1081,105281000220105,Horizontal bitewing plain X-ray of teeth (procedure),SNOMED CT US Edition,2.16.840.1.113883.6.96
Diagnostic Radiology,2.16.840.1.113883.3.464.1004.1081,105291000220108,Vertical bitewing plain X-ray of teeth (procedure),SNOMED CT US Edition,2.16.840.1.113883.6.96
Diagnostic Radiology,2.16.840.1.113883.3.464.1004.1081,105301000220109,"Plain X-ray cephalometry, lateral (procedure)",SNOMED CT US Edition,2.16.840.1.113883.6.96
Diagnostic Radiology,2.16.840.1.113883.3.464.1004.1081,105311000220107,Occlusal plain X-ray of anterior maxillary region (procedure),SNOMED CT US Edition,2.16.840.1.113883.6.96
Diagnostic Radiology,2.16.840.1.113883.3.464.1004.1081,305011000000108,Core needle biopsy of breast using plain X-ray guidance (procedure),SNOMED CT US Edition,2.16.840.1.113883.6.96
Diagnostic Radiology,2.16.840.1.113883.3.464.1004.1081,305051000000107,Fine needle aspiration biopsy of breast using plain X-ray guidance (procedure),SNOMED CT US Edition,2.16.840.1.113883.6.96
Diagnostic Radiology,2.16.840.1.113883.3.464.1004.1081,305071000000103,Fine needle aspiration biopsy and core needle biopsy of breast using plain X-ray guidance (procedure),SNOMED CT US Edition,2.16.840.1.113883.6.96
Diagnostic Radiology,2.16.840.1.113883.3.464.1004.1081,306371000000109,Prone fine needle aspiration biopsy and core needle biopsy of breast using stereotactic plain X-ray guidance (procedure),SNOMED CT US Edition,2.16.840.1.113883.6.96
Diagnostic Radiology,2.16.840.1.113883.3.464.1004.1081,306381000000106,Prone core needle biopsy of breast using stereotactic plain X-ray guidance (procedure),SNOMED CT US Edition,2.16.840.1.113883.6.96
Diagnostic Radiology,2.16.840.1.113883.3.464.1004.1081,306391000000108,Prone wire localization of lesion of breast using stereotactic plain X-ray guidance (procedure),SNOMED CT US Edition,2.16.840.1.113883.6.96
Diagnostic Radiology,2.16.840.1.113883.3.464.1004.1081,306641000000107,Upright core needle biopsy of breast using stereotactic plain X-ray guidance (procedure),SNOMED CT US Edition,2.16.840.1.113883.6.96
Diagnostic Radiology,2.16.840.1.113883.3.464.1004.1081,306651000000105,Upright fine needle aspiration biopsy and core needle biopsy of breast using stereotactic plain X-ray guidance (procedure),SNOMED CT US Edition,2.16.840.1.113883.6.96
Diagnostic Radiology,2.16.840.1.113883.3.464.1004.1081,306661000000108,Upright wire localization of lesion of breast using stereotactic plain X-ray guidance (procedure),SNOMED CT US Edition,2.16.840.1.113883.6.96
Diagnostic Radiology,2.16.840.1.113883.3.464.1004.1081,306671000000101,Upright fine needle aspiration biopsy of breast using stereotactic plain X-ray guidance (procedure),SNOMED CT US Edition,2.16.840.1.113883.6.96
Diagnostic Radiology,2.16.840.1.113883.3.464.1004.1081,307971000000105,Prone vacuum assisted biopsy of breast using stereotactic plain X-ray guidance (procedure),SNOMED CT US Edition,2.16.840.1.113883.6.96
Diagnostic Radiology,2.16.840.1.113883.3.464.1004.1081,307981000000107,Upright vacuum assisted biopsy of breast using stereotactic plain X-ray guidance (procedure),SNOMED CT US Edition,2.16.840.1.113883.6.96
Diagnostic Radiology,2.16.840.1.113883.3.464.1004.1081,308001000000100,Mammography lateral view (procedure),SNOMED CT US Edition,2.16.840.1.113883.6.96
Diagnostic Radiology,2.16.840.1.113883.3.464.1004.1081,308031000000106,Mammography extended view (procedure),SNOMED CT US Edition,2.16.840.1.113883.6.96
Diagnostic Radiology,2.16.840.1.113883.3.464.1004.1081,308041000000102,Prone fine needle aspiration biopsy of breast using stereotactic plain X-ray guidance (procedure),SNOMED CT US Edition,2.16.840.1.113883.6.96
Diagnostic Radiology,2.16.840.1.113883.3.464.1004.1081,317631000000102,Fluoroscopic direct puncture venography with contrast (procedure),SNOMED CT US Edition,2.16.840.1.113883.6.96
Diagnostic Radiology,2.16.840.1.113883.3.464.1004.1081,321511000000107,Computed tomography of midfoot (procedure),SNOMED CT US Edition,2.16.840.1.113883.6.96
Diagnostic Radiology,2.16.840.1.113883.3.464.1004.1081,382911000119105,Magnetic resonance imaging of neck without contrast (procedure),SNOMED CT US Edition,2.16.840.1.113883.6.96
Diagnostic Radiology,2.16.840.1.113883.3.464.1004.1081,383311000119100,Magnetic resonance imaging of orbits without contrast (procedure),SNOMED CT US Edition,2.16.840.1.113883.6.96
Diagnostic Radiology,2.16.840.1.113883.3.464.1004.1081,383321000119107,Magnetic resonance imaging of brain and brain stem without contrast (procedure),SNOMED CT US Edition,2.16.840.1.113883.6.96
Diagnostic Radiology,2.16.840.1.113883.3.464.1004.1081,383371000119108,Computed tomography of head without contrast (procedure),SNOMED CT US Edition,2.16.840.1.113883.6.96
Diagnostic Radiology,2.16.840.1.113883.3.464.1004.1081,383381000119106,Computed tomography of orbit without contrast (procedure),SNOMED CT US Edition,2.16.840.1.113883.6.96
Diagnostic Radiology,2.16.840.1.113883.3.464.1004.1081,383391000119109,Computed tomography of orbit and sella turcica without contrast (procedure),SNOMED CT US Edition,2.16.840.1.113883.6.96
Diagnostic Radiology,2.16.840.1.113883.3.464.1004.1081,383401000119106,Computed tomography of middle ear without contrast (procedure),SNOMED CT US Edition,2.16.840.1.113883.6.96
Diagnostic Radiology,2.16.840.1.113883.3.464.1004.1081,383441000119108,Computed tomography of orbit and sella turcica with contrast (procedure),SNOMED CT US Edition,2.16.840.1.113883.6.96
Diagnostic Radiology,2.16.840.1.113883.3.464.1004.1081,383471000119101,Computed tomography of paranasal sinus without contrast (procedure),SNOMED CT US Edition,2.16.840.1.113883.6.96
Diagnostic Radiology,2.16.840.1.113883.3.464.1004.1081,383501000119107,"Plain X-ray of chest, apical and lordotic views (procedure)",SNOMED CT US Edition,2.16.840.1.113883.6.96
Diagnostic Radiology,2.16.840.1.113883.3.464.1004.1081,383761000119101,Computed tomography of shoulder without contrast (procedure),SNOMED CT US Edition,2.16.840.1.113883.6.96
Diagnostic Radiology,2.16.840.1.113883.3.464.1004.1081,383771000119107,Computed tomography of wrist without contrast (procedure),SNOMED CT US Edition,2.16.840.1.113883.6.96
Diagnostic Radiology,2.16.840.1.113883.3.464.1004.1081,383931000119106,Computed tomography of lower leg without contrast (procedure),SNOMED CT US Edition,2.16.840.1.113883.6.96
Diagnostic Radiology,2.16.840.1.113883.3.464.1004.1081,383941000119102,Computed tomography of knee without contrast (procedure),SNOMED CT US Edition,2.16.840.1.113883.6.96
Diagnostic Radiology,2.16.840.1.113883.3.464.1004.1081,384041000119100,Fluoroscopy of esophagus with barium (procedure),SNOMED CT US Edition,2.16.840.1.113883.6.96
Diagnostic Radiology,2.16.840.1.113883.3.464.1004.1081,384051000119103,Fluoroscopy of esophagus with contrast (procedure),SNOMED CT US Edition,2.16.840.1.113883.6.96
Diagnostic Radiology,2.16.840.1.113883.3.464.1004.1081,384091000119108,Fluoroscopic barium enema via colostomy (procedure),SNOMED CT US Edition,2.16.840.1.113883.6.96
Diagnostic Radiology,2.16.840.1.113883.3.464.1004.1081,384151000119104,Screening mammography of bilateral breasts (procedure),SNOMED CT US Edition,2.16.840.1.113883.6.96
Diagnostic Radiology,2.16.840.1.113883.3.464.1004.1081,384161000119102,Ultrasonography of soft tissue of neck (procedure),SNOMED CT US Edition,2.16.840.1.113883.6.96
Diagnostic Radiology,2.16.840.1.113883.3.464.1004.1081,384521000119100,Computed tomography of lower limb without contrast (procedure),SNOMED CT US Edition,2.16.840.1.113883.6.96
Diagnostic Radiology,2.16.840.1.113883.3.464.1004.1081,385111000119104,Computed tomography of facial bones without contrast (procedure),SNOMED CT US Edition,2.16.840.1.113883.6.96
Diagnostic Radiology,2.16.840.1.113883.3.464.1004.1081,385701000119103,Ultrasonography of right thorax (procedure),SNOMED CT US Edition,2.16.840.1.113883.6.96
Diagnostic Radiology,2.16.840.1.113883.3.464.1004.1081,385711000119100,Ultrasonography of left thorax (procedure),SNOMED CT US Edition,2.16.840.1.113883.6.96
Diagnostic Radiology,2.16.840.1.113883.3.464.1004.1081,385731000119105,Plain X-ray of tissue specimen (procedure),SNOMED CT US Edition,2.16.840.1.113883.6.96
Diagnostic Radiology,2.16.840.1.113883.3.464.1004.1081,387691000119107,Endoscopic retrograde cholangiopancreatography with insertion of catheter into biliary and pancreatic ducts using fluoroscopic guidance (procedure),SNOMED CT US Edition,2.16.840.1.113883.6.96
Diagnostic Radiology,2.16.840.1.113883.3.464.1004.1081,388131000119100,Computed tomography of mastoid without contrast (procedure),SNOMED CT US Edition,2.16.840.1.113883.6.96
Diagnostic Radiology,2.16.840.1.113883.3.464.1004.1081,388321000119101,Magnetic resonance imaging of sacrum without contrast (procedure),SNOMED CT US Edition,2.16.840.1.113883.6.96
Diagnostic Radiology,2.16.840.1.113883.3.464.1004.1081,388511000119103,Fluoroscopic angiography of thoracic aorta with serialography by femoral approach with contrast (procedure),SNOMED CT US Edition,2.16.840.1.113883.6.96
Diagnostic Radiology,2.16.840.1.113883.3.464.1004.1081,391131000119106,Ultrasonography for qualitative amniotic fluid volume (procedure),SNOMED CT US Edition,2.16.840.1.113883.6.96
Diagnostic Radiology,2.16.840.1.113883.3.464.1004.1081,391391000119107,Radionuclide scan of whole body using indium 111 for localization of abscess (procedure),SNOMED CT US Edition,2.16.840.1.113883.6.96
Diagnostic Radiology,2.16.840.1.113883.3.464.1004.1081,392491000119105,Fluoroscopic venography of right limb with contrast (procedure),SNOMED CT US Edition,2.16.840.1.113883.6.96
Diagnostic Radiology,2.16.840.1.113883.3.464.1004.1081,392521000119107,Screening mammography of right breast (procedure),SNOMED CT US Edition,2.16.840.1.113883.6.96
Diagnostic Radiology,2.16.840.1.113883.3.464.1004.1081,392531000119105,Screening mammography of left breast (procedure),SNOMED CT US Edition,2.16.840.1.113883.6.96
Diagnostic Radiology,2.16.840.1.113883.3.464.1004.1081,393031000119106,Magnetic resonance imaging cholangiography without contrast (procedure),SNOMED CT US Edition,2.16.840.1.113883.6.96
Diagnostic Radiology,2.16.840.1.113883.3.464.1004.1081,393091000119105,Computed tomography of neck and chest without contrast (procedure),SNOMED CT US Edition,2.16.840.1.113883.6.96
Diagnostic Radiology,2.16.840.1.113883.3.464.1004.1081,393161000119104,"Computed tomography of chest, abdomen and pelvis without contrast (procedure)",SNOMED CT US Edition,2.16.840.1.113883.6.96
Diagnostic Radiology,2.16.840.1.113883.3.464.1004.1081,394211000119109,Ultrasonography for fetal biophysical profile with non-stress testing (procedure),SNOMED CT US Edition,2.16.840.1.113883.6.96
Diagnostic Radiology,2.16.840.1.113883.3.464.1004.1081,394221000119102,Ultrasonography for fetal biophysical profile without non-stress testing (procedure),SNOMED CT US Edition,2.16.840.1.113883.6.96
Diagnostic Radiology,2.16.840.1.113883.3.464.1004.1081,394421000119103,"Plain X-ray of chest, anteroposterior view (procedure)",SNOMED CT US Edition,2.16.840.1.113883.6.96
Diagnostic Radiology,2.16.840.1.113883.3.464.1004.1081,394451000119106,Magnetic resonance imaging of lumbar spine without contrast (procedure),SNOMED CT US Edition,2.16.840.1.113883.6.96
Diagnostic Radiology,2.16.840.1.113883.3.464.1004.1081,394491000119101,Computed tomography of upper limb without contrast (procedure),SNOMED CT US Edition,2.16.840.1.113883.6.96
Diagnostic Radiology,2.16.840.1.113883.3.464.1004.1081,394501000119108,Magnetic resonance arthrography of upper limb without contrast (procedure),SNOMED CT US Edition,2.16.840.1.113883.6.96
Diagnostic Radiology,2.16.840.1.113883.3.464.1004.1081,394511000119106,Magnetic resonance imaging of lower limb joint without contrast (procedure),SNOMED CT US Edition,2.16.840.1.113883.6.96
Diagnostic Radiology,2.16.840.1.113883.3.464.1004.1081,394531000119101,Magnetic resonance imaging of abdomen without contrast (procedure),SNOMED CT US Edition,2.16.840.1.113883.6.96
Diagnostic Radiology,2.16.840.1.113883.3.464.1004.1081,394591000119102,Shuntogram of indwelling nonvascular shunt using fluoroscopic guidance (procedure),SNOMED CT US Edition,2.16.840.1.113883.6.96
Diagnostic Radiology,2.16.840.1.113883.3.464.1004.1081,394611000119107,Fluoroscopic angiography with contrast for transcatheter biopsy (procedure),SNOMED CT US Edition,2.16.840.1.113883.6.96
