Value Set Name,Value Set OID,Code,Definition,Code System,Code System OID
Hospice Encounter,2.16.840.1.113883.3.464.1004.1761,G9473,"Services performed by chaplain in the hospice setting, each 15 minutes (G9473)",HCPCS,2.16.840.1.113883.6.285
Hospice Encounter,2.16.840.1.113883.3.464.1004.1761,G9474,"Services performed by dietary counselor in the hospice setting, each 15 minutes (G9474)",HCPCS,2.16.840.1.113883.6.285
Hospice Encounter,2.16.840.1.113883.3.464.1004.1761,G9475,"Services performed by other counselor in the hospice setting, each 15 minutes (G9475)",HCPCS,2.16.840.1.113883.6.285
Hospice Encounter,2.16.840.1.113883.3.464.1004.1761,G9476,"Services performed by volunteer in the hospice setting, each 15 minutes (G9476)",HCPCS,2.16.840.1.113883.6.285
Hospice Encounter,2.16.840.1.113883.3.464.1004.1761,G9477,"Services performed by care coordinator in the hospice setting, each 15 minutes (G9477)",HCPCS,2.16.840.1.113883.6.285
Hospice Encounter,2.16.840.1.113883.3.464.1004.1761,G9478,"Services performed by other qualified therapist in the hospice setting, each 15 minutes (G9478)",HCPCS,2.16.840.1.113883.6.285
Hospice Encounter,2.16.840.1.113883.3.464.1004.1761,G9479,"Services performed by qualified pharmacist in the hospice setting, each 15 minutes (G9479)",HCPCS,2.16.840.1.113883.6.285
Hospice Encounter,2.16.840.1.113883.3.464.1004.1761,Q5003,Hospice care provided in nursing long term care facility (ltc) or non-skilled nursing facility (nf) (Q5003),HCPCS,2.16.840.1.113883.6.285
Hospice Encounter,2.16.840.1.113883.3.464.1004.1761,Q5004,Hospice care provided in skilled nursing facility (snf) (Q5004),HCPCS,2.16.840.1.113883.6.285
Hospice Encounter,2.16.840.1.113883.3.464.1004.1761,Q5005,Hospice care provided in inpatient hospital (Q5005),HCPCS,2.16.840.1.113883.6.285
Hospice Encounter,2.16.840.1.113883.3.464.1004.1761,Q5006,Hospice care provided in inpatient hospice facility (Q5006),HCPCS,2.16.840.1.113883.6.285
Hospice Encounter,2.16.840.1.113883.3.464.1004.1761,Q5007,Hospice care provided in long term care facility (Q5007),HCPCS,2.16.840.1.113883.6.285
Hospice Encounter,2.16.840.1.113883.3.464.1004.1761,Q5008,Hospice care provided in inpatient psychiatric facility (Q5008),HCPCS,2.16.840.1.113883.6.285
Hospice Encounter,2.16.840.1.113883.3.464.1004.1761,Q5010,Hospice home care provided in a hospice facility (Q5010),HCPCS,2.16.840.1.113883.6.285
Hospice Encounter,2.16.840.1.113883.3.464.1004.1761,S9126,"Hospice care, in the home, per diem (S9126)",HCPCS,2.16.840.1.113883.6.285
Hospice Encounter,2.16.840.1.113883.3.464.1004.1761,T2042,Hospice routine home care; per diem (T2042),HCPCS,2.16.840.1.113883.6.285
Hospice Encounter,2.16.840.1.113883.3.464.1004.1761,T2043,Hospice continuous home care; per hour (T2043),HCPCS,2.16.840.1.113883.6.285
Hospice Encounter,2.16.840.1.113883.3.464.1004.1761,T2044,Hospice inpatient respite care; per diem (T2044),HCPCS,2.16.840.1.113883.6.285
Hospice Encounter,2.16.840.1.113883.3.464.1004.1761,T2045,Hospice general inpatient care; per diem (T2045),HCPCS,2.16.840.1.113883.6.285
Hospice Encounter,2.16.840.1.113883.3.464.1004.1761,T2046,"Hospice long term care, room and board only; per diem (T2046)",HCPCS,2.16.840.1.113883.6.285
Hospice Encounter,2.16.840.1.113883.3.464.1004.1761,183919006,Urgent admission to hospice (procedure),SNOMED CT US Edition,2.16.840.1.113883.6.96
Hospice Encounter,2.16.840.1.113883.3.464.1004.1761,183920000,Routine admission to hospice (procedure),SNOMED CT US Edition,2.16.840.1.113883.6.96
Hospice Encounter,2.16.840.1.113883.3.464.1004.1761,183921001,Admission to hospice for respite (procedure),SNOMED CT US Edition,2.16.840.1.113883.6.96
Hospice Encounter,2.16.840.1.113883.3.464.1004.1761,305336008,Admission to hospice (procedure),SNOMED CT US Edition,2.16.840.1.113883.6.96
Hospice Encounter,2.16.840.1.113883.3.464.1004.1761,305911006,Seen in hospice (finding),SNOMED CT US Edition,2.16.840.1.113883.6.96
Hospice Encounter,2.16.840.1.113883.3.464.1004.1761,385765002,Hospice care management (procedure),SNOMED CT US Edition,2.16.840.1.113883.6.96
Hospice Encounter,2.16.840.1.113883.3.464.1004.1761,0115,,UBREV,2.16.840.1.113883.6.301.3
Hospice Encounter,2.16.840.1.113883.3.464.1004.1761,0125,,UBREV,2.16.840.1.113883.6.301.3
Hospice Encounter,2.16.840.1.113883.3.464.1004.1761,0135,,UBREV,2.16.840.1.113883.6.301.3
Hospice Encounter,2.16.840.1.113883.3.464.1004.1761,0145,,UBREV,2.16.840.1.113883.6.301.3
Hospice Encounter,2.16.840.1.113883.3.464.1004.1761,0155,,UBREV,2.16.840.1.113883.6.301.3
Hospice Encounter,2.16.840.1.113883.3.464.1004.1761,0235,,UBREV,2.16.840.1.113883.6.301.3
Hospice Encounter,2.16.840.1.113883.3.464.1004.1761,0650,,UBREV,2.16.840.1.113883.6.301.3
Hospice Encounter,2.16.840.1.113883.3.464.1004.1761,0651,,UBREV,2.16.840.1.113883.6.301.3
Hospice Encounter,2.16.840.1.113883.3.464.1004.1761,0652,,UBREV,2.16.840.1.113883.6.301.3
Hospice Encounter,2.16.840.1.113883.3.464.1004.1761,0655,,UBREV,2.16.840.1.113883.6.301.3
Hospice Encounter,2.16.840.1.113883.3.464.1004.1761,0656,,UBREV,2.16.840.1.113883.6.301.3
Hospice Encounter,2.16.840.1.113883.3.464.1004.1761,0657,,UBREV,2.16.840.1.113883.6.301.3
Hospice Encounter,2.16.840.1.113883.3.464.1004.1761,0658,,UBREV,2.16.840.1.113883.6.301.3
Hospice Encounter,2.16.840.1.113883.3.464.1004.1761,0659,,UBREV,2.16.840.1.113883.6.301.3
Hospice Intervention,2.16.840.1.113883.3.464.1004.1762,99377,,CPT,2.16.840.1.113883.6.12
Hospice Intervention,2.16.840.1.113883.3.464.1004.1762,99378,,CPT,2.16.840.1.113883.6.12
Hospice Intervention,2.16.840.1.113883.3.464.1004.1762,G0182,"Physician supervision of a patient under a medicare-approved hospice (patient not present) requiring complex and multidisciplinary care modalities involving regular physician development and/or revision of care plans, review of subsequent reports of patient status, review of laboratory and other studies, communication (including telephone calls) with other health care professionals involved in the patient's care, integration of new information into the medical treatment plan and/or adjustment of medical therapy, within a calendar month, 30 minutes or more (G0182)",HCPCS,2.16.840.1.113883.6.285
Hospice Intervention,2.16.840.1.113883.3.464.1004.1762,170935008,Full care by hospice (finding),SNOMED CT US Edition,2.16.840.1.113883.6.96
Hospice Intervention,2.16.840.1.113883.3.464.1004.1762,170936009,Shared care - hospice and general practitioner (finding),SNOMED CT US Edition,2.16.840.1.113883.6.96
Hospice Intervention,2.16.840.1.113883.3.464.1004.1762,385763009,Hospice care (regime/therapy),SNOMED CT US Edition,2.16.840.1.113883.6.96
